id,publish_time,title,article_url,ticker,publisher,description,keywords
,2023-02-05 15:00:00,Orica Selects Cognizant to Accelerate Development of a Digital Platform to Report Greenhouse Gas Emissions,https://www.prnewswire.com/news-releases/orica-selects-cognizant-to-accelerate-development-of-a-digital-platform-to-report-greenhouse-gas-emissions-301737298.html,MSFT,PR Newswire,Orica Selects Cognizant to Accelerate Development of a Digital ... PR ...,Technology
,2023-02-05 15:00:00,Orica Selects Cognizant to Accelerate Development of a Digital Platform to Report Greenhouse Gas Emissions,https://www.prnewswire.com/news-releases/orica-selects-cognizant-to-accelerate-development-of-a-digital-platform-to-report-greenhouse-gas-emissions-301737323.html,MSFT,PR Newswire,Orica Selects Cognizant to Accelerate Development of a Digital ... PR ...,Technology
,2023-02-05 15:00:00,"Orica Selects Cognizant to Accelerate Development of a Digital Platform to Report Greenhouse Gas Emissions - Orica  ( OTC:OCLDY ) , Cognizant Tech Solns  ( NASDAQ:CTSH ) ",https://www.benzinga.com/pressreleases/23/02/n30722577/orica-selects-cognizant-to-accelerate-development-of-a-digital-platform-to-report-greenhouse-gas-e,MSFT,Benzinga,"Cognizant will implement a digital platform designed to monitor and forecast emissions in real-time, and help develop its new ESG data strategy, reporting and governance model","Technology,Financial Markets"
,2023-02-05 12:57:00,Bill Gates to Elon Musk: 'Don't go to Mars',https://www.marketwatch.com/story/bill-gates-to-elon-musk-dont-go-to-mars-11675619864,MSFT,MarketWatch,The Microsoft co-founder calls for spending money on measles vaccines vs. space travel-but he thinks Musk will be 'a great philanthropist' someday ...,"Technology,Manufacturing"
,2023-02-05 11:41:00,"Bill Gates Has Been Playing Wordle For A Year, Here's His Favorite 4 Vowel Starter Word - Microsoft  ( NASDAQ:MSFT ) , New York Times  ( NYSE:NYT ) ",https://www.benzinga.com/news/22/08/28710008/bill-gates-has-played-wordle-since-february-shares-4-vowel-starter-word-3,MSFT,Benzinga,"One of the richest people in the world starts his morning routine by playing a popular word game. Bill Gates is addicted to Wordle and other guessing games. In August 2022, he revealed more about his habits and some strategies.","Technology,Manufacturing"
,2023-02-05 10:55:34,"Tech Rally Scares Bears, Should It?",https://www.forbes.com/sites/tomaspray/2023/02/05/tech-rally-scares-bears-should-it/,MSFT,Forbes,A few strategists in the financial media were questioning their bearish outlook for the stock market after last week's earnings reports. The Viper Report's Tom Aspray discusses his current technical outlook for the stock market.,"Economy - Monetary,Financial Markets,Earnings,Technology,Finance"
,2023-02-05 10:46:04,Dogecoin Set To Release New Version Of Blockchain Tool Libdogecoin: What Investors Need To Know,https://www.benzinga.com/markets/cryptocurrency/23/02/30719814/dogecoin-set-to-release-new-version-of-blockchain-tool-libdogecoin-what-investors-need-to-,MSFT,Benzinga,"Dogecoin DOGE/USD is set to release a new version of its blockchain tool, Libdogecoin, according to Michi Lumin, a core engineer of the meme crypto. The updated version 0.1.2 will come with improved features, such as mnemonic/seedphrase generation, QR code production, and better support for ...","Technology,Blockchain"
,2023-02-05 10:09:58,A laid-off Google engineer describes losing his 'only career' 16 years after starting as an intern,https://africa.businessinsider.com/news/a-laid-off-google-engineer-describes-losing-his-only-career-16-years-after-starting/fw4x7l2,MSFT,Business Insider,A laid-off Google engineer describes losing his 'only career' 16 ... - Business Insider Africa ...,Technology
,2023-02-05 10:09:58,A laid-off Google engineer describes losing his 'only career' 16 years after starting as an intern,https://www.businessinsider.com/googler-who-started-intern-only-career-tech-layoffs-2023-2,MSFT,Business Insider,Laid-Off Google Engineer Describes Losing 'Only Career' After 16 ... - Business Insider ...,Technology
,2023-02-05 10:00:01,The 7 most in-demand tech skills for freelancers-many pay more than $125 an hour,https://www.cnbc.com/2023/02/05/most-in-demand-tech-skills-for-freelancersmany-pay-more-than-125-an-hour.html,MSFT,CNBC,"Tech skills are in high demand, and many can pay more than $100 per hour. These include full stack developer, mobile app developer and web designer.",Technology
,2023-02-05 09:47:25,Wall St Week Ahead-Signs of market strength cheer U.S. stocks bulls | The Financial Express,https://www.financialexpress.com/market/wall-st-week-ahead-signs-of-market-strength-cheer-u-s-stocks-bulls/2972056/,MSFT,The Financial Express,Wall St Week Ahead-Signs of market strength cheer U.S. stocks bulls The Financial Express ...,"Economy - Monetary,Financial Markets,Technology,Finance"
,2023-02-05 09:12:00,Bill Gates Raises Alarm Over This Menace: 'Kills More People In One Day Than Sharks Kill In 100 Years' - Microsoft  ( NASDAQ:MSFT ) ,https://www.benzinga.com/news/22/07/28181720/bill-gates-raises-alarm-over-this-menace-mosquitoes-kill-more-people-in-one-day-than-sharks-kill-in-4,MSFT,Benzinga,"Microsoft co-founder Bill Gates, whose Bill & Melinda Gates Foundation works to improve healthcare and alleviate poverty in developing and under-developed countries, brought to attention a deadly natural menace that often goes unnoticed by many people.",Technology
,2023-02-05 09:05:00,OpenAI makes a ChatGPT-like tool called Codex that can write software. Here's why Codex won't replace developers and will instead create more demand for their skills.,https://africa.businessinsider.com/careers/openai-makes-a-chatgpt-like-tool-called-codex-that-can-write-software-heres-why-codex/x1f0w2z,MSFT,Business Insider,OpenAI makes a ChatGPT-like tool called Codex that can write ... - Business Insider Africa ...,"Technology,Financial Markets"
,2023-02-05 09:05:00,OpenAI makes a ChatGPT-like tool called Codex that can write software. Here's why Codex won't replace developers and will instead create more demand for their skills.,https://www.businessinsider.com/chatgpt-openai-codex-developer-jobs-2023-2,MSFT,Business Insider,OpenAI's ChatGPT-Like Tool Codex Will Create More Demand for ... - Business Insider ...,"Technology,Financial Markets"
,2023-02-05 08:58:22,"EXCLUSIVE: Top 10 Most Searched Tickers On Pro In January: Where Do SPY, Tesla, Apple And Ford Rank? - SPDR S&P 500  ( ARCA:SPY ) ",https://www.benzinga.com/news/earnings/23/02/30713474/exclusive-top-10-most-searched-tickers-on-benzinga-pro-in-january-where-do-spy-tesla-apple-and-ford,MSFT,Benzinga,"Each trading day features hundreds of headlines and press releases on Benzinga Pro, a source for traders to see the latest news on the overall market and individual tickers. Here is a look at the most-searched stocks on Benzinga Pro for the month of January 2023.","Financial Markets,Manufacturing,Earnings,Real Estate & Construction,Technology,Finance"
,2023-02-05 05:30:00,3 Stocks I'd Give My Long-Term Valentine,https://www.fool.com/investing/2023/02/05/3-stocks-id-give-my-long-term-valentine/,MSFT,Motley Fool,"Like a good relationship, a great investment can actually get better over time.","Retail & Wholesale,Financial Markets,Earnings,Real Estate & Construction,Technology"
,2023-02-05 05:00:00,"Here's how tech giants Microsoft, Google, and Baidu are taking on ChatGPT, and what that could mean for investors",https://markets.businessinsider.com/news/stocks/chatgpt-big-tech-stocks-google-microsoft-investing-analysis-stock-market-2023-2,MSFT,Business Insider,"How Microsoft, Google Are Taking on ChatGPT, What It Means for ... - Markets Insider ...","Economy - Monetary,Technology,Financial Markets"
,2023-02-05 05:00:00,"Here's how tech giants Microsoft, Google, and Baidu are taking on ChatGPT, and what that could mean for investors",https://africa.businessinsider.com/markets/heres-how-tech-giants-microsoft-google-and-baidu-are-taking-on-chatgpt-and-what-that/30pyxkl,MSFT,Business Insider,"Here's how tech giants Microsoft, Google, and Baidu are taking on ... - Business Insider Africa ...","Economy - Monetary,Technology,Financial Markets"
,2023-02-04 13:28:00,"Yes, Elon Musk Is Rich, And So Is Bill Gates, But Who Are The Wealthiest Women In The World? Hint It's Not Oprah - Target  ( NYSE:TGT ) , Walmart  ( NYSE:WMT ) ",https://www.benzinga.com/general/entrepreneurship/23/01/30424327/yes-elon-musk-is-rich-and-so-is-bill-gates-but-who-are-the-wealthiest-women-in-the-wor-1,MSFT,Benzinga,"The battle for ""world's richest person"" is always fought between men, but as more women take on leadership and ownership roles in companies, the wealth gap between men and women is slowly closing.","Technology,Financial Markets,Manufacturing"
,2023-02-04 12:56:03,"Bill Gates Takes A Dig At Elon Musk, Says 'Don't Go To Mars,' Spend Money On This Instead",https://www.benzinga.com/news/23/02/30719444/bill-gates-takes-a-dig-at-elon-musk-says-dont-go-to-mars-spend-money-on-this-instead,MSFT,Benzinga,"Microsoft co-founder Bill Gates said he would not take a trip to Mars and would rather spend his money on life-saving vaccines. During an interview with the BBC, Gates was asked whether he believes the Tesla CEO would ever join philanthropists like Gates, Berkshire Hathaway's Warren Buffett, and ...","Technology,Financial Markets,Manufacturing"
,2023-02-04 10:13:39,Charted: Hardest hit in tech layoffs,https://www.axios.com/2023/02/04/tech-layoffs-twitter-apple-elon-musk,MSFT,Axios,Twitter leads the tech industry in layoffs ...,Technology
,2023-02-04 09:03:43,"Apple CEO Tim Cook Says Layoffs Are Last Resort, But 'You Can Never Say Never' - Apple  ( NASDAQ:AAPL ) ",https://www.benzinga.com/news/23/02/30719295/apple-ceo-tim-cook-says-layoffs-are-last-resort-but-you-can-never-say-never,MSFT,Benzinga,"As many tech giants have been executing an unprecedented level of layoffs, Apple Inc AAPL has managed to avoid major job cuts even though it missed expectations for several of its lines of business announced during its first-quarter earnings.","Earnings,Technology,Financial Markets"
,2023-02-04 09:00:01,"Cloud leaders Amazon, Google and Microsoft show the once-booming market is cooling down",https://www.cnbc.com/2023/02/04/amazon-google-microsoft-show-slowing-growth-in-cloud-infrastructure.html,MSFT,CNBC,"Companies looked for ways to save money on their cloud bills in the fourth quarter, a trend that could persist for at least the first half of 2023.","Economy - Monetary,Earnings,Technology,Finance"
,2023-02-04 09:00:00,Top 10 most famous computer programmers of all time,https://cointelegraph.com/news/top-10-most-famous-computer-programmers-of-all-time,MSFT,Cointelegraph,Computer programming has made the impossible possible. Read about the top 10 computer programmers to date.,"Technology,Blockchain"
,2023-02-04 08:44:47,"Here's how to invest in the AI craze, according to ChatGPT",https://markets.businessinsider.com/news/stocks/chatgpt-ai-stocks-markets-investing-adivce-etfs-microsoft-c3ai-google-2023-2,MSFT,Business Insider,We Asked ChatGPT How to Invest in the AI Craze Sweeping Wall ... - Markets Insider ...,"Retail & Wholesale,Financial Markets,Manufacturing,Technology"
,2023-02-04 08:30:00,"Tech, housing, and manufacturing might already be in a recession. They could bring the US economy down with it.",https://www.businessinsider.com/recession-coming-outlook-tech-housing-manufacturing-us-economy-next-2023-2,MSFT,Business Insider,"'Rolling Recession' in Tech, Housing, Manufacturing May Spread in ... - Business Insider ...","Economy - Monetary,Technology,Financial Markets"
,2023-02-04 08:15:00,"Here's how to invest in the AI craze, according to ChatGPT",https://africa.businessinsider.com/markets/heres-how-to-invest-in-the-ai-craze-according-to-chatgpt/e5gkkc8,MSFT,Business Insider,"I jumped into ChatGPT and asked two questions about getting exposure to AI through the financial markets. ChatGPT's suggestions included well-known companies such as Microsoft, but it also offered assets that aren't tech behemoths or household names. How can I invest in the AI craze?","Retail & Wholesale,Financial Markets,Manufacturing,Technology"
,2023-02-04 08:11:00,Bill Gates Once Described Trump As An Illeist: 'His First Sentence Kind Of Threw Me Off',https://www.benzinga.com/general/politics/22/07/28277803/why-bill-gates-once-called-trump-an-illeist-his-first-sentence-kinda-threw-me-off-5,MSFT,Benzinga,A 2018 video obtained by MSNBC featuring Microsoft Corporation MSFT co-founder Bill Gates expressing his opinion about former President Donald Trump was used by Inc. Magazine to explain the psychology behind persons similar to Trump.,Technology
,2023-02-04 08:08:50,"State of the Union: Biden sees economic glow, GOP sees gloom",https://apnews.com/article/biden-inflation-economy-mexico-business-4496d9470c90e86d3642521482cd0e19,MSFT,Associated Press,"WASHINGTON ( AP ) - Going into Tuesday's State of the Union address , President Joe Biden sees a nation with its future aglow. Republicans take a far bleaker view - that the country is beset by crushing debt and that Biden is largely responsible for inflation .","Economy - Monetary,Financial Markets,Real Estate & Construction,Technology,Finance"
,2023-02-04 08:00:00,Popular AI Like ChatGPT Could Be Just the Beginning for Data Center Stocks Like Nvidia,https://www.fool.com/investing/2023/02/04/popular-ai-like-chatgpt-could-be-just-the-beginnin/,MSFT,Motley Fool,These two semiconductor investors are back to discuss some significant tailwinds for various chip stocks.,"Technology,Financial Markets,Manufacturing"
,2023-02-04 07:30:00,Is the S&P 500 All You Need to Retire a Millionaire?,https://www.fool.com/retirement/2023/02/04/is-the-sp-500-all-you-need-to-retire-a-millionaire/,MSFT,Motley Fool,It's easier than you might think to retire a millionaire.,"Earnings,Technology,Financial Markets"
,2023-02-04 07:15:00,Mark Zuckerberg ushered in a new era of 'efficiency',https://markets.businessinsider.com/news/stocks/mark-zuckerberg-meta-efficiency-facebook-apple-amazon-earnings-2023-2,MSFT,Business Insider,"What a week this was, reader. Meta, Apple, Amazon, and Alphabet all reported earnings over the last few days, and, well, the outlook is bleak. This is Matt Weinberger, deputy editor of Insider's tech analysis team and your host for today.","Earnings,Technology,Financial Markets"
,2023-02-04 07:15:00,Mark Zuckerberg ushered in a new era of 'efficiency',https://www.businessinsider.com/mark-zuckerberg-meta-efficiency-facebook-apple-amazon-earnings-2023-2,MSFT,Business Insider,Mark Zuckerberg's New Era of 'Efficiency' - Business Insider ...,"Earnings,Technology,Financial Markets"
,2023-02-04 07:09:47,A laid-off Microsoft software engineer on an H1-B visa said she wonders 'where will I be living' with just 60 days to find a new job,https://markets.businessinsider.com/news/stocks/laid-off-microsoft-engineer-h1-b-worries-where-live-2023-2,MSFT,Business Insider,"• A Microsoft software engineer said in a LinkedIn post she had many unanswered questions after being laid off. • Lupe Canaviri Maydana wondered ""where will I be living"" as she is running against the clock. • Maydana is on an H-1B visa - she has a grace period of 60 days before she needs to ...",Technology
,2023-02-04 07:09:47,A laid-off Microsoft software engineer on an H1-B visa said she wonders 'where will I be living' with just 60 days to find a new job,https://www.businessinsider.com/laid-off-microsoft-engineer-h1-b-worries-where-live-2023-2,MSFT,Business Insider,Laid-Off Microsoft Engineer on H1-B Worries About Where She'll Live - Business Insider ...,Technology
,2023-02-04 07:00:00,"7 ways to use ChatGPT at work to boost your productivity, make your job easier, and save a ton of time",https://markets.businessinsider.com/news/stocks/how-to-use-chatgpt-at-work-job-save-time-ai-2023-2,MSFT,Business Insider,"• ChatGPT won't replace your job anytime soon. But it can make it a little bit easier. • With its impressive functions, the buzzy AI chatbot could give some workers a ""productivity boost."" • Insider compiled a list of seven ways workers can use the AI tool to help do their jobs.",Technology
,2023-02-04 07:00:00,"7 ways to use ChatGPT at work to boost your productivity, make your job easier, and save a ton of time",https://www.businessinsider.com/how-to-use-chatgpt-at-work-job-save-time-ai-2023-2,MSFT,Business Insider,"How to Use ChatGPT at Work to Do Your Job, Save Time With AI - Business Insider ...",Technology
,2023-02-04 06:35:00,"Close to 100,000 tech employees lost jobs globally in January alone",https://www.business-standard.com/article/companies/close-to-100-000-tech-employees-lost-jobs-globally-in-january-alone-123020400896_1.html,MSFT,Business Standard,Close to 100000 tech employees lost jobs globally in January alones Business Standard ...,Technology
,2023-02-04 06:30:55,"Mass layoff exit packages at Meta, Amazon, Microsoft and Alphabet will collectively cost the tech giants up to $4.7 billion",https://markets.businessinsider.com/news/stocks/meta-amazon-microsoft-alphabet-exits-will-cost-billions-2023-2,MSFT,Business Insider,"• Meta, Amazon, Microsoft and Alphabet's severance packages will cost up to $4.7 billion. • The tech giants have collectively laid off tens of thousands of workers over the past few months. • Google parent company Alphabet will have the highest severance cost, at a maximum of $2.3 billion.","Earnings,Technology"
,2023-02-04 06:30:55,"Mass layoff exit packages at Meta, Amazon, Microsoft and Alphabet will collectively cost the tech giants up to $4.7 billion",https://www.businessinsider.com/meta-amazon-microsoft-alphabet-exits-will-cost-billions-2023-2,MSFT,Business Insider,"Meta, Amazon, Microsoft, Alphabet Exits Will Cost up to $4.7 Billion - Business Insider ...","Earnings,Technology"
,2023-02-04 06:30:55,"Mass layoff exit packages at Meta, Amazon, Microsoft and Alphabet will collectively cost the tech giants up to $4.7 billion",https://africa.businessinsider.com/news/mass-layoff-exit-packages-at-meta-amazon-microsoft-and-alphabet-will-collectively/s5pv80e,MSFT,Business Insider,"Mass layoff exit packages at Meta, Amazon, Microsoft and Alphabet ... - Business Insider Africa ...","Earnings,Technology"
,2023-02-04 06:12:40,Cathie Wood says ARK Innovation ETF is 'the New Nasdaq' | The Financial Express,https://www.financialexpress.com/investing-abroad/featured-stories/cathie-wood-says-ark-innovation-etf-is-the-new-nasdaq/2971498/,MSFT,The Financial Express,Cathie Wood says ARK Innovation ETF is 'the New Nasdaq' The Financial Express ...,"Economy - Monetary,Financial Markets,Manufacturing,Technology"
,2023-02-04 05:07:00,EU sends formal warning to Microsoft over $69 bn Activision Blizzard deal,https://www.business-standard.com/article/international/eu-sends-formal-warning-to-microsoft-over-69-bn-activision-blizzard-deal-123020400735_1.html,MSFT,Business Standard,EU sends formal warning to Microsoft over $69 bn Activision ... Business Standard ...,Technology
,2023-02-04 05:00:00,ChatGPT seconds Warren Buffett's and Michael Burry's tips on what it takes to be a good investor - the bot lists patience and discipline among 6 must-have traits,https://markets.businessinsider.com/news/stocks/chatgpt-warren-buffett-michael-burry-stocks-successful-investor-traits-2023-2,MSFT,Business Insider,"ChatGPT Seconds Buffett, Burry Tips on Successful Stock Investor ... - Business Insider ...","Financial Markets,Manufacturing,Technology,Finance"
,2023-02-03 21:30:00,"Digital marketing courses market recorded 11.67% growth between 2021 and 2022; Insights on top countries such as the UK, among others - Technavio",https://www.prnewswire.com/news-releases/digital-marketing-courses-market-recorded-11-67-growth-between-2021-and-2022-insights-on-top-countries-such-as-the-uk-among-others--technavio-301736022.html,MSFT,PR Newswire,Digital marketing courses market recorded 11.67% growth between ... PR ...,"Technology,Finance,Manufacturing"
,2023-02-03 21:00:00,"3D printing market in the education sector recorded 10.87% growth between 2021 and 2022; Insights on top countries such as the UK, among others - Technavio",https://www.prnewswire.com/news-releases/3d-printing-market-in-the-education-sector-recorded-10-87-growth-between-2021-and-2022-insights-on-top-countries-such-as-the-uk-among-others--technavio-301736037.html,MSFT,PR Newswire,3D printing market in the education sector recorded 10.87% growth ... PR ...,"Life Sciences,Technology"
,2023-02-03 19:57:00,Wall St Week Ahead Signs of market strength cheer U.S. stocks bulls,https://www.reuters.com/markets/us/wall-st-week-ahead-signs-market-strength-cheer-us-stocks-bulls-2023-02-04/,MSFT,Reuters,"NEW YORK, Feb 3 ( Reuters ) - U.S. stock bulls are taking heart from a range of market signals pointing to an upbeat year for Wall Street, as equities sit on impressive gains despite worries that the Federal Reserve's monetary policy tightening may plunge the economy into a recession.","Economy - Monetary,Financial Markets,Technology,Finance"
