id,publish_time,title,article_url,ticker,publisher,description,keywords
,2024-10-02 16:59:10,"Nvidia's AI Leadership To Drive $1 Trillion Market Growth, With Accenture Partnership Accelerating Adoption, Analyst Says - NVIDIA  ( NASDAQ:NVDA ) , Accenture  ( NYSE:ACN ) ",https://www.benzinga.com/analyst-ratings/analyst-color/24/10/41151741/nvidias-ai-leadership-to-drive-1-trillion-market-growth-with-accenture-partnership-,MSFT,Benzinga,"In the latest tech news that has investors buzzing, Nvidia Corp NVDA and Accenture PLC ACN have teamed up to forge a new era in AI adoption within enterprises. As they unveil their ambitious plans, Wedbush Securities' analyst Dan Ives has weighed in with insights that paint a promising picture ...","Technology,Financial Markets,Manufacturing"
,2024-10-02 15:27:48,"OpenAI Valuation Soars To $157B In Latest Funding Round - Microsoft  ( NASDAQ:MSFT ) , Apple  ( NASDAQ:AAPL ) ",https://www.benzinga.com/news/24/10/41149788/openai-valuation-soars-to-157b-in-latest-funding-round,MSFT,Benzinga,OpenAI has secured more than $6.5 billion in new funding at a valuation of $157 billion as it looks to increase its lead in the artificial intelligence space.,"Technology,Financial Markets,Manufacturing"
,2024-10-02 15:20:19,OpenAI raises an additional $6.6B at a $157B valuation,https://cointelegraph.com/news/openai-raises-6-6-billion-157-billion-valuation,MSFT,Cointelegraph,"In February 2024, the artificial intelligence company was valued at approximately $80 billion and has grown considerably since that time.","Financial Markets,Manufacturing,Real Estate & Construction,Technology"
,2024-10-02 15:01:59,"How Google, Microsoft And Netflix Are Fueling Cannabis Legalization With Millions In Donations - Alphabet  ( NASDAQ:GOOGL ) ",https://www.benzinga.com/markets/cannabis/24/10/41149343/how-google-microsoft-and-netflix-are-fueling-cannabis-legalization-with-millions-in-donations,MSFT,Benzinga,"As the 2024 elections heat up, a look at the data reveals that publicly traded companies are indirectly supporting cannabis legalization efforts by funneling millions of dollars into Democratic candidates' campaigns.","Technology,Finance"
,2024-10-02 13:39:22,Why NetApp's AI-Driven Data Solutions Make It a Top Tech Stock - NetApp  ( NASDAQ:NTAP ) ,https://www.benzinga.com/news/earnings/24/10/41139923/why-netapps-ai-driven-data-solutions-make-it-a-top-tech-stock,MSFT,Benzinga,NetApp Inc. NTAP is an intelligent data infrastructure company that offers data-centric software and networking hardware that enable enterprises to manage and use their data.,"Earnings,Technology,Financial Markets"
,2024-10-02 13:00:02,Why Oracle Stock Jumped 21% in September,https://www.fool.com/investing/2024/10/02/why-oracle-stock-jumped-21-in-september/,MSFT,Motley Fool,A strong earnings report led to a rally over the rest of the month.,"Earnings,Technology,Financial Markets"
,2024-10-02 12:17:06,A Closer Look at Microsoft's Options Market Dynamics - Microsoft  ( NASDAQ:MSFT ) ,https://www.benzinga.com/insights/options/24/10/41145725/a-closer-look-at-microsofts-options-market-dynamics,MSFT,Benzinga,"Whales with a lot of money to spend have taken a noticeably bullish stance on Microsoft. Looking at options history for Microsoft MSFT we detected 71 trades. If we consider the specifics of each trade, it is accurate to state that 45% of the investors opened trades with bullish expectations and ...","Financial Markets,Earnings,Technology,Finance"
,2024-10-02 11:46:40,"Opportunity In Missile Defense Stocks, Once In A Century Buying Stampede In Hong Kong - Apple  ( NASDAQ:AAPL ) ",https://www.benzinga.com/general/market-summary/24/10/41145100/opportunity-in-missile-defense-stocks-once-in-a-century-buying-stampede-in-hong-kong,MSFT,Benzinga,"To gain an edge, this is what you need to know today. Please click here for an enlarged chart of Rtx Corp RTX. This article is about the big picture, not an individual stock. The chart of RTX stock is being used to illustrate the point. Yesterday, Iran fired about 180 ballistic missiles on ...","Economy - Monetary,Financial Markets,Manufacturing,Technology,Finance"
,2024-10-02 11:10:46,"Market Clubhouse Morning Memo - October 2nd, 2024  ( Trade Strategy For SPY, QQQ, AAPL, MSFT, NVDA, GOOGL, META And TSLA )  - Alphabet  ( NASDAQ:GOOGL ) , Apple  ( NASDAQ:AAPL ) ",https://www.benzinga.com/markets/24/10/41144184/market-clubhouse-morning-memo-october-2nd-2024-trade-strategy-for-spy-qqq-aapl-msft-nvda-googl-meta,MSFT,Benzinga,"Good Morning Traders! In today's Market Clubhouse Morning Memo, we will discuss SPY, QQQ, AAPL, MSFT, NVDA, GOOGL, META, and TSLA. Our proprietary formula, exclusive to Market Clubhouse, dictates these price levels. This dynamic equation takes into account price, volume, and options flow.","Economy - Monetary,Financial Markets,Manufacturing,Technology"
,2024-10-02 10:33:00,"ADP Up +143K, an Improvement on Private-Sector Payrolls",https://www.zacks.com/stock/news/2344838/adp-up-143k-an-improvement-on-private-sector-payrolls,MSFT,Zacks Commentary,"ADP released private-sector payrolls this morning, and results were better than anticipated.","Technology,Finance,Financial Markets"
,2024-10-02 10:21:10,"Cybersecurity, AI, Network Experts to Present at Nov. 7th Boston Summit",https://www.benzinga.com/pressreleases/24/10/g41142925/cybersecurity-ai-network-experts-to-present-at-nov-7th-boston-summit,MSFT,Benzinga,"Albany, NY, Oct. 02, 2024 ( GLOBE NEWSWIRE ) -- FirstLight, a leading provider of digital infrastructure services to enterprise and carrier customers throughout the Northeast and mid-Atlantic, announced the dynamic line-up of speakers for a November 7th IT conference focused on cybersecurity, ...",Technology
,2024-10-02 10:00:00,Bundling hotspot: Over a third of subscriptions in East Asia sold through indirect channels,https://www.globenewswire.com/news-release/2024/10/02/2957066/0/en/Bundling-hotspot-Over-a-third-of-subscriptions-in-East-Asia-sold-through-indirect-channels.html,MSFT,GlobeNewswire,"East Asia leading the world in subscription bundling, but localized content key to unlocking market East Asia leading the world in subscription bundling, but localized content key to unlocking market ...",Technology
,2024-10-02 09:41:00,Is NVIDIA Stock Worth Buying Despite Its 136% YTD Rally?,https://www.zacks.com/stock/news/2344768/is-nvidia-stock-worth-buying-despite-its-136-ytd-rally,MSFT,Zacks Commentary,"NVDA stock is poised to carry its momentum, given its dominant position in the AI space, impressive financial performance and expanding market reach.","Financial Markets,Manufacturing,Earnings,Technology"
,2024-10-02 09:30:00,Hewlett Packard Enterprise Climbs 18% YTD: What Should Investors Do?,https://www.zacks.com/stock/news/2344836/hewlett-packard-enterprise-climbs-18-ytd-what-should-investors-do,MSFT,Zacks Commentary,"HPE's prospects look strong, given the growing adoption of GreenLake and its AI solutions, including HPE Private Cloud AI.","Retail & Wholesale,Financial Markets,Manufacturing,Earnings,Technology"
,2024-10-02 09:00:17,Microsoft Corporation  ( MSFT )  Is a Trending Stock: Facts to Know Before Betting on It,https://www.zacks.com/stock/news/2344631/microsoft-corporation-msft-is-a-trending-stock-facts-to-know-before-betting-on-it,MSFT,Zacks Commentary,"Microsoft (MSFT) has been one of the stocks most watched by Zacks.com users lately. So, it is worth exploring what lies ahead for the stock.","Earnings,Technology,Financial Markets"
,2024-10-02 08:20:00,Why I Bought More Intel Stock,https://www.fool.com/investing/2024/10/02/why-i-bought-more-intel-stock/,MSFT,Motley Fool,"Intel is making great products again, and the potential of the foundry business is underappreciated.","Financial Markets,Manufacturing,Earnings,Technology"
,2024-10-02 08:03:22,Nvidia Expands AI Offerings with New Open-Source Models and Unreal Engine 5 Plugins - NVIDIA  ( NASDAQ:NVDA ) ,https://www.benzinga.com/news/24/10/41139084/nvidia-expands-ai-offerings-with-new-open-source-models-and-unreal-engine-5-plugins,MSFT,Benzinga,Nvidia Corp NVDA recently made significant product launches amid a volatile run as the Street factors in the company's customer concentration and delays in product releases like its Blackwell GPUs.,"Financial Markets,Manufacturing,Technology,Finance"
,2024-10-02 07:37:00,1 Millionaire-Maker Technology Stock,https://www.fool.com/investing/2024/10/02/1-millionaire-maker-technology-stock/,MSFT,Motley Fool,Looking for the next big thing in tech stocks? Check out this under-the-radar company with massive growth potential.,"IPO,Financial Markets,Earnings,Technology"
,2024-10-02 07:30:00,5 Best Dividend Growth Stocks to Buy in October,https://www.fool.com/investing/2024/10/02/5-best-dividend-growth-stocks-to-buy-in-october/,MSFT,Motley Fool,These five stocks are known for their generous dividend programs and robust business models.,"Life Sciences,Retail & Wholesale,Financial Markets,Earnings,Technology,Finance"
,2024-10-02 07:00:49,Grant Huang Transforms a Frustrating Internship Experience Into a Movement That's Simplifying Excel for Over 3 Million Professionals,https://www.benzinga.com/pressreleases/24/10/g41137656/grant-huang-transforms-a-frustrating-internship-experience-into-a-movement-thats-simplifying-excel,MSFT,Benzinga,"DALLAS, Oct. 02, 2024 ( GLOBE NEWSWIRE ) -- In a significant shift away from traditional education, Grant Huang has transformed the landscape of Excel learning through his innovative platform, Excel With Grant.",Technology
,2024-10-02 06:20:07,Should iShares S&P 500 Growth ETF  ( IVW )  Be on Your Investing Radar?,https://www.zacks.com/stock/news/2344498/should-ishares-sp-500-growth-etf-ivw-be-on-your-investing-radar,MSFT,Zacks Commentary,Style Box ETF report for ...,"Financial Markets,Manufacturing,Earnings,Technology,Finance"
,2024-10-02 06:20:06,Should Goldman Sachs ActiveBeta U.S. Large Cap Equity ETF  ( GSLC )  Be on Your Investing Radar?,https://www.zacks.com/stock/news/2344503/should-goldman-sachs-activebeta-us-large-cap-equity-etf-gslc-be-on-your-investing-radar,MSFT,Zacks Commentary,Style Box ETF report for ...,"Financial Markets,Manufacturing,Technology,Finance"
,2024-10-02 05:50:00,Could Constellation's Nuclear Revival Make NuScale the Next Big Thing?,https://www.fool.com/investing/2024/10/02/could-constellations-nuclear-revival-make-nuscale/,MSFT,Motley Fool,Constellation Energy rallied after it announced plans to partially reopen the nuclear power plant at Three Mile Island. Is this a positive sign for NuScale Energy?,"Technology,Financial Markets"
,2024-10-02 05:25:00,Is Micron a Buy After Massive Earnings Topper?,https://www.fool.com/investing/2024/10/02/is-micron-a-buy-after-massive-earnings-topper/,MSFT,Motley Fool,Micron's beat-and-raise quarter is eye-popping.,"Financial Markets,Manufacturing,Earnings,Technology"
,2024-10-02 05:17:00,"Meet the Best-Performing Stock in the Entire S&P 500 This Year -- No, It's Not Nvidia",https://www.fool.com/investing/2024/10/02/meet-the-best-performing-stock-in-the-entire-sp-50/,MSFT,Motley Fool,"This energy stock has tripled in 2024 so far, comfortably outperforming every other stock in the S&P 500 including Nvidia.","Financial Markets,Manufacturing,Earnings,Energy & Transportation,Technology,Finance"
,2024-10-02 05:11:08,"Another Blue Screen Day? Microsoft's Windows 11 Reboot Might Cause Temporary Glitches. Here's How To Fix Them - Microsoft  ( NASDAQ:MSFT ) , CrowdStrike Holdings  ( NASDAQ:CRWD ) ",https://www.benzinga.com/news/24/10/41136348/another-blue-screen-day-microsofts-windows-11-reboot-might-cause-temporary-glitches-heres-how-to-fix,MSFT,Benzinga,"Ahead of the latest Windows 11 update, users are reporting significant issues that could disrupt their workflow. Here's what you need to know about the problem and how to address it.",Technology
,2024-10-02 04:29:00,1 Unstoppable Vanguard ETF to Confidently Buy With $350 Heading Into 2025,https://www.fool.com/investing/2024/10/02/1-unstoppable-vanguard-etf-to-confidently-buy-with/,MSFT,Motley Fool,This exchange-traded fund holds 231 of the top-performing growth stocks from the S&P 500 index.,"Financial Markets,Manufacturing,Earnings,Technology"
,2024-10-02 00:47:21,"After Apple Reportedly Backed Out, SoftBank Eyes $500M Investment In ChatGPT Parent, Pushing Valuation To $150B - Microsoft  ( NASDAQ:MSFT ) , SoftBank Group  ( OTC:SFTBF ) ",https://www.benzinga.com/news/24/10/41134540/after-apple-reportedly-backed-out-softbank-eyes-500m-investment-in-chatgpt-parent-pushing-valuation,MSFT,Benzinga,"Masayoshi Son-led SoftBank Group Corporation SFTBF has reportedly re-committed to a $500 million investment in ChatGPT-parent OpenAI. What Happened: This investment forms part of a larger $6.5 billion funding round, catapulting OpenAI's valuation to a staggering $150 billion, reported Financial ...","Technology,Financial Markets"
,2024-10-01 21:00:00,"CROWDSTRIKE ALERT: Bragar Eagel & Squire, P.C. is Investigating CrowdStrike Holdings, Inc. on Behalf of Long-Term Stockholders and Encourages Investors to Contact the Firm - CrowdStrike Holdings  ( NASDAQ:CRWD ) ",https://www.benzinga.com/pressreleases/24/10/g41133565/crowdstrike-alert-bragar-eagel-squire-p-c-is-investigating-crowdstrike-holdings-inc-on-behalf-of-l,MSFT,Benzinga,"NEW YORK, Oct. 01, 2024 ( GLOBE NEWSWIRE ) -- Bragar Eagel & Squire, P.C., a nationally recognized shareholder rights law firm, is investigating potential claims against CrowdStrike Holdings, Inc.","Energy & Transportation,Technology,Financial Markets"
,2024-10-01 15:30:00,National Grid Renewables Signs Power Purchase Agreement with Microsoft,https://www.benzinga.com/pressreleases/24/10/n41127928/national-grid-renewables-signs-power-purchase-agreement-with-microsoft,MSFT,Benzinga,"250 MW Portage Solar Project located in Portage County, WI MINNEAPOLIS, Oct. 1, 2024 /PRNewswire/ -- National Grid Renewables is pleased to announce the execution of a power purchase agreement ( PPA ) with Microsoft for its Portage Solar Project, a 250-megawatt ( MW ) development located in ...","Earnings,Energy & Transportation,Technology"
,2024-10-01 14:36:00,The Paley Center for Media Announces the Agenda for the 2024 Paley International Council Summit: Global Innovators: Defining the Future of Media,https://www.benzinga.com/pressreleases/24/10/n41126874/the-paley-center-for-media-announces-the-agenda-for-the-2024-paley-international-council-summit-gl,MSFT,Benzinga,"Speakers Include: Zanny Minton Beddoes, Frank A. Bennack, Jr., Aryeh B. Bourkoff, Keia Clarke, Mike Fries, Commissioner Don Garber, Dr. Robert M. Gates, Bianna Golodryga, Ramin Hasani, Steve Hasker, Janet Haven, Almar Latour, Cynthia Littleton, John C.","Economy - Monetary,Economy - Fiscal,Financial Markets,Manufacturing,Technology,Finance"
,2024-10-01 13:59:00,Can Sapiens' Expansion Into Insurance Market Push the Stock Higher?,https://www.zacks.com/stock/news/2344352/can-sapiens-expansion-into-insurance-market-push-the-stock-higher,MSFT,Zacks Commentary,"SPNS empowers HGR with DataSuite, streamlining migration and enhancing data management for seamless operations.","Earnings,Technology,Financial Markets"
,2024-10-01 13:21:00,How to Fix Stitch Fix,https://www.fool.com/investing/2024/10/01/how-to-fix-stitch-fix/,MSFT,Motley Fool,Then we swing from fashion to tech to take a look at Palantir.,"Technology,IPO,Economy - Fiscal,Retail & Wholesale,Financial Markets,Manufacturing,Earnings"
,2024-10-01 12:57:04,"Powell Stock Market Drip Aggressively Bought, Important Data And Blind Money Ahead - Apple  ( NASDAQ:AAPL ) ",https://www.benzinga.com/markets/asia/24/10/41124552/powell-stock-market-drip-aggressively-bought-important-data-and-blind-money-ahead,MSFT,Benzinga,"To gain an edge, this is what you need to know today. Please click here for an enalrged chart of SPDR S&P 500 ETF Trust SPY which represents the benchmark stock market index S&P 500 ( SPX ) . JOLTS job openings data will be released at 10am ET. ISM Manufacturing index will also be released ...","Economy - Monetary,Economy - Fiscal,Financial Markets,Manufacturing,Technology,Finance"
,2024-10-01 12:00:00,National Cybersecurity Alliance Launches 21st Annual Cybersecurity Awareness Month,https://www.benzinga.com/pressreleases/24/10/g41122993/national-cybersecurity-alliance-launches-21st-annual-cybersecurity-awareness-month,MSFT,Benzinga,"WASHINGTON, Oct. 01, 2024 ( GLOBE NEWSWIRE ) -- The National Cybersecurity Alliance ( NCA ) , the nation's leading nonprofit dedicated to promoting a more secure and interconnected world, and the Cybersecurity and Infrastructure Security Agency ( CISA ) have announced the launch of the 21st ...","Technology,Finance"
,2024-10-01 11:37:58,What's Going On With MicroStrategy Stock? - MicroStrategy  ( NASDAQ:MSTR ) ,https://www.benzinga.com/markets/cryptocurrency/24/10/41122476/whats-going-on-with-microstrategy-stock,MSFT,Benzinga,MicroStrategy Incorporated MSTR shares are trading lower Tuesday as Bitcoin BTC/USD and the broader market fall on increased instability in the Middle East.,"Technology,Financial Markets"
,2024-10-01 10:58:51,"Market Clubhouse Morning Memo - October 1st, 2024  ( Trade Strategy For SPY, QQQ, AAPL, MSFT, NVDA, GOOGL, META And TSLA )  - Alphabet  ( NASDAQ:GOOGL ) , Apple  ( NASDAQ:AAPL ) ",https://www.benzinga.com/trading-ideas/24/10/41121097/market-clubhouse-morning-memo-october-1st-2024-trade-strategy-for-spy-qqq-aapl-msft-nvda-googl-meta,MSFT,Benzinga,"Good Morning Traders! In today's Market Clubhouse Morning Memo, we will discuss SPY, QQQ, AAPL, MSFT, NVDA, GOOGL, META, and TSLA. Our proprietary formula, exclusive to Market Clubhouse, dictates these price levels. This dynamic equation takes into account price, volume, and options flow.","Technology,Financial Markets,Manufacturing"
,2024-10-01 10:48:00,AAPL Shares Trade Near All-Time High: Is it Too Late to Buy the Stock?,https://www.zacks.com/stock/news/2344131/aapl-shares-trade-near-all-time-high-is-it-too-late-to-buy-the-stock,MSFT,Zacks Commentary,"Although Apple's AI push, growing Services business and strong liquidity position make shares attractive. Stretched valuation and China headwinds are concerns.","Technology,Retail & Wholesale,Financial Markets"
,2024-10-01 10:39:00,Amazon Rises 44% in a Year: Can GenAI Strength Drive the Stock?,https://www.zacks.com/stock/news/2344192/amazon-rises-44-in-a-year-can-genai-strength-drive-the-stock,MSFT,Zacks Commentary,"Amazon rides on solid cloud momentum, driven by the growing generative AI capabilities amid stiff AI competition.","Energy & Transportation,Technology,Retail & Wholesale,Financial Markets,Manufacturing,Earnings,Real Estate & Construction"
,2024-10-01 10:06:07,"Nvidia Faces New Competition: Cerebras Files for IPO, Huawei Pushes AI Chips - NVIDIA  ( NASDAQ:NVDA ) ",https://www.benzinga.com/news/24/10/41119735/nvidia-faces-new-competition-cerebras-files-for-ipo-huawei-pushes-ai-chips,MSFT,Benzinga,Accelerated computing and artificial intelligence stock Nvidia Corp NVDA has been up over 171% in the last 12 months.,"IPO,Financial Markets,Manufacturing,Earnings,Technology"
,2024-10-01 09:59:33,"India to fabricate its first chip in two years as Nvidia, AMD and Micron pledge to expand to the country",https://www.cnbc.com/2024/10/01/india-to-fabricate-its-first-chip-in-two-years-as-companies-pledge-to-expand-in-the-country.html,MSFT,CNBC,"India will fabricate its first chip in two years, Commerce Minister Piyush Goyal told CNBC during a one-on-one interview with CNBC in New York.","Technology,Finance,Manufacturing"
,2024-10-01 09:52:00,Is it Time to Buy Logitech Stock at a P/E Multiple of 19.52X?,https://www.zacks.com/stock/news/2344089/is-it-time-to-buy-logitech-stock-at-a-pe-multiple-of-1952x,MSFT,Zacks Commentary,"At a P/E multiple of 19.52X, LOGI shows an appealing buying opportunity, given its strong financial performance, innovative product range and positive prospects.","Financial Markets,Manufacturing,Earnings,Technology"
,2024-10-01 09:46:45,"Nvidia CEO Jensen Huang Backs Nuclear Energy To Power AI's Future: 3 Stocks To Watch - Constellation Energy  ( NASDAQ:CEG ) , NuScale Power  ( NYSE:SMR ) , Centrus Energy  ( AMEX:LEU ) ",https://www.benzinga.com/trading-ideas/long-ideas/24/10/41119184/nvidia-ceo-jensen-huang-backs-nuclear-energy-to-power-ais-future-3-stocks-to-watch,MSFT,Benzinga,Nvidia Corp NVDA CEO Jensen Huang is making waves with his endorsement of nuclear energy to meet the surging electricity demands posed by artificial intelligence ( AI ) . AI's energy consumption could rival that of a small country within just three years.,"Technology,Manufacturing"
,2024-10-01 09:05:00,New 'VMware offramp' plugin from CAST helps companies move faster to best-fit cloud services,https://www.benzinga.com/pressreleases/24/10/g41117504/new-vmware-offramp-plugin-from-cast-helps-companies-move-faster-to-best-fit-cloud-services,MSFT,Benzinga,"NEW YORK, Oct. 01, 2024 ( GLOBE NEWSWIRE ) -- CAST, the leader in software intelligence, today unveiled a new plugin to help companies swiftly migrate from VMware to cost-efficient cloud alternatives.",Technology
,2024-10-01 08:48:30,"Unified Endpoint Management Market Size Worth $84.91 Billion, Globally, by 2031 - Exclusive Report by The Insight Partners",https://www.benzinga.com/pressreleases/24/10/g41116709/unified-endpoint-management-market-size-worth-84-91-billion-globally-by-2031-exclusive-report-by-t,MSFT,Benzinga,"US & Canada, Oct. 01, 2024 ( GLOBE NEWSWIRE ) -- According to a new comprehensive report from The Insight Partners, the global unified endpoint management market is observing significant growth owing to surge in BYOD policies and work from home practices and rise of endpoint attacks.",Technology
,2024-10-01 08:40:00,Q3 Review: Top Stock Market Trends,https://www.zacks.com/commentary/2343584/q3-review-top-stock-market-trends,MSFT,Zacks Commentary,"The equity bull market continued in Q3. Stock Strategist Andrew Rocco breaks down key industry group moves such as AI, utilities, and space stocks.","Economy - Monetary,Financial Markets,Manufacturing,Earnings,Technology,Finance"
,2024-10-01 07:43:31,Taiwan Semiconductor's 2-Nm Breakthrough Puts Taiwan a Decade Ahead of China's Semiconductor Industry: Report - Taiwan Semiconductor  ( NYSE:TSM ) ,https://www.benzinga.com/government/24/10/41114632/taiwan-semiconductors-2-nm-breakthrough-puts-taiwan-a-decade-ahead-of-chinas-semiconductor-industry,MSFT,Benzinga,Taiwan Semiconductor Manufacturing Co TSM has multiple reasons to celebrate; the latest is China's comment on its technology moat.,"Technology,Financial Markets,Manufacturing"
,2024-10-01 07:16:00,My Top AI Growth Stock to Buy in October,https://www.fool.com/investing/2024/10/01/my-top-ai-growth-stock-to-buy-in-october/,MSFT,Motley Fool,AI is proving to be a major growth accelerant for Brookfield Infrastructure.,"Financial Markets,Manufacturing,Earnings,Energy & Transportation,Technology"
,2024-10-01 07:02:53,Malaysia steps up its AI game with regulations and cloud computing policy,https://cointelegraph.com/news/malaysia-steps-up-its-ai-game-with-regulations-and-cloud-computing-policy,MSFT,Cointelegraph,"Malaysia has strengthened its AI and cloud computing landscape with new regulations and partnerships, positioning itself as a hub for ethical AI and digital innovation.","Technology,Financial Markets"
,2024-10-01 06:20:06,Is Schwab Fundamental U.S. Broad Market ETF  ( FNDB )  a Strong ETF Right Now?,https://www.zacks.com/stock/news/2343793/is-schwab-fundamental-us-broad-market-etf-fndb-a-strong-etf-right-now,MSFT,Zacks Commentary,Smart Beta ETF report for ...,"Technology,Finance,Financial Markets"
