id,publish_time,title,article_url,ticker,publisher,description,keywords
,2023-03-13 19:24:00,3 Tech Titans Making Noise Within AI,https://www.zacks.com/stock/news/2065090/3-tech-titans-making-noise-within-ai,NVDA,Zacks Commentary,"To little surprise, several big-tech players have been scurrying to become the leader within AI. Who wins?","Earnings,Technology,Manufacturing"
,2023-03-13 19:06:54,Forget Tesla - The Biggest Tech Opportunities Of 2023,https://markets.businessinsider.com/news/stocks/forget-tesla-the-biggest-tech-opportunities-of-2023-1032164480,NVDA,Business Insider,"The tech market has yet to bottom out, and investors should be avoiding the mega-caps at all costs, but there are emerging stars from AI and gaming to semiconductors that underpin the new tech trends-and they're undervalued, not overvalued. Tesla ( NASDAQ:TSLA ) is tanking.","Economy - Monetary,Financial Markets,Manufacturing,Earnings,Technology,Finance"
,2023-03-13 16:45:48,This Is What Whales Are Betting On NVIDIA - NVIDIA  ( NASDAQ:NVDA ) ,https://www.benzinga.com/markets/options/23/03/31330032/this-is-what-whales-are-betting-on-nvidia,NVDA,Benzinga,"A whale with a lot of money to spend has taken a noticeably bearish stance on NVIDIA. Looking at options history for NVIDIA NVDA we detected 229 strange trades. If we consider the specifics of each trade, it is accurate to state that 46% of the investors opened trades with bullish expectations ...","Financial Markets,Manufacturing,Earnings,Finance"
,2023-03-13 16:26:39,'CS:GO' Shatters Records With 1.4 Million Concurrent Players Amid Rumors Of An Upcoming 'Counter-Strike 2' - Electronic Arts  ( NASDAQ:EA ) ,https://www.benzinga.com/general/gaming/23/03/31327472/cs-go-shatters-records-with-1-4-million-concurrent-players-amid-rumors-of-an-upcoming-counter-stri,NVDA,Benzinga,"""Counter-Strike: Global Offensive,"" the 2012 multiplayer tactical first-person shooter developed by Valve and Hidden Path Entertainment, has broken the record of concurrent players for the second time in two consecutive months.","Technology,Manufacturing"
,2023-03-13 11:51:16,From Ideation to Implementation: How Microsoft Achieved its ChatGPT Goals - Microsoft  ( NASDAQ:MSFT ) ,https://www.benzinga.com/news/23/03/31321453/from-ideation-to-implementation-how-microsoft-achieved-its-chatgpt-goals,NVDA,Benzinga,"Microsoft Corp MSFT pledged to build a massive, cutting-edge supercomputer for OpenAI in 2019 when it invested $1 billion. Microsoft had to find ways to string together tens of thousands of Nvidia Corp's NVDA A100 graphics chips, the workhorse for training AI models, and change how it positions ...","Technology,Manufacturing"
,2023-03-13 11:30:00,"Gaming Market Overview - Major Trends, Key Drivers And Forecasted Market Size And Growth Rate As Per The Business Research Company's Gaming Global Market Report 2023",https://www.benzinga.com/pressreleases/23/03/g31323667/gaming-market-overview-major-trends-key-drivers-and-forecasted-market-size-and-growth-rate-as-per-,NVDA,Benzinga,"LONDON, March 13, 2023 ( GLOBE NEWSWIRE ) -- The Business Research Company's research on the gaming market forecasts technological innovation to be a major trend in the gaming industry. To stay afloat in the gaming industry, major market players are utilizing cutting-edge technologies.","Economy - Monetary,Technology,Manufacturing"
,2023-03-13 10:57:00,"The Zacks Analyst Blog Highlights NVIDIA, McDonald's, Intuit, AT&T and Regeneron Pharmaceuticals",https://www.zacks.com/stock/news/2064866/the-zacks-analyst-blog-highlights-nvidia-mcdonalds-intuit-att-and-regeneron-pharmaceuticals,NVDA,Zacks Commentary,"NVIDIA, McDonald's, Intuit, AT&T and Regeneron Pharmaceuticals are part of the Zacks top Analyst ...","Life Sciences,Retail & Wholesale,Manufacturing,Technology"
,2023-03-13 10:02:00,"Beat the Market Like Zacks: United Airlines, NVIDIA, WANdisco in Focus",https://www.zacks.com/stock/news/2064798/beat-the-market-like-zacks-united-airlines-nvidia-wandisco-in-focus,NVDA,Zacks Commentary,Our time-tested methodologies were at work to help investors navigate the market well last week. Here are some of our key performance data from the past three months.,"Energy & Transportation,Technology,Economy - Monetary,Retail & Wholesale,Financial Markets,Manufacturing,Earnings"
,2023-03-13 09:09:13,1 Massive Reason to Avoid Nvidia Stock Right Now,https://www.fool.com/investing/2023/03/13/1-massive-reason-to-avoid-nvidia-stock-right-now/,NVDA,Motley Fool,The high-flying chipmaker's rally could come to a halt thanks to the PC market's weakness.,"Earnings,Financial Markets,Manufacturing"
,2023-03-13 08:58:09,"ChatGPT and Generative AI are booming, but at a very expensive price",https://www.cnbc.com/2023/03/13/chatgpt-and-generative-ai-are-booming-but-at-a-very-expensive-price.html,NVDA,CNBC,"It can cost millions of dollars to train and operate generative AI technologies like ChatGPT, which are being subsidized by tech companies and VCs.","Financial Markets,Manufacturing,Earnings,Technology"
,2023-03-13 08:32:00,Do Options Traders Know Something About NVIDIA  ( NVDA )  Stock We Don't?,https://www.zacks.com/stock/news/2064612/do-options-traders-know-something-about-nvidia-nvda-stock-we-dont,NVDA,Zacks Commentary,Investors need to pay close attention to NVIDIA (NVDA) stock based on the movements in the options market lately.,"Earnings,Financial Markets,Manufacturing"
,2023-03-13 06:20:07,Should You Invest in the Vanguard Information Technology ETF  ( VGT ) ?,https://www.zacks.com/stock/news/2064532/should-you-invest-in-the-vanguard-information-technology-etf-vgt,NVDA,Zacks Commentary,Sector ETF report for ...,"Technology,Financial Markets,Manufacturing"
,2023-03-12 08:38:00,Better AI Stock: Amazon vs. Nvidia,https://www.fool.com/investing/2023/03/12/better-ai-stock-amazon-vs-nvidia/,NVDA,Motley Fool,These companies will likely play significant roles in the development of AI.,"Retail & Wholesale,Financial Markets,Manufacturing,Earnings,Technology"
,2023-03-11 07:00:00,2 Top Warren Buffett Stocks to Buy Right Now,https://www.fool.com/investing/2023/03/11/2-top-warren-buffett-stocks-to-buy-right-now/,NVDA,Motley Fool,These stocks offer a balance of growth and value for long-term investors.,"Technology,Finance,Economy - Monetary,Financial Markets,Manufacturing,Earnings,Mergers & Acquisitions"
,2023-03-10 23:15:00,"Smart TV sticks market size to grow by USD 612.44 million from 2022 to 2027, Growing Penetration of the Internet to boost growth - Technavio",https://www.prnewswire.com/news-releases/smart-tv-sticks-market-size-to-grow-by-usd-612-44-million-from-2022-to-2027--growing-penetration-of-the-internet-to-boost-growth---technavio-301768165.html,NVDA,PR Newswire,Smart TV sticks market size to grow by USD 612.44 million from ... PR ...,"Earnings,Technology,Manufacturing"
,2023-03-10 23:01:10,The VR technology that is creating the metaverse | The Financial Express,https://www.financialexpress.com/blockchain/the-vr-technology-that-is-creating-the-metaverse/3004951/,NVDA,The Financial Express,The VR technology that is creating the metaverse The Financial Express ...,"Technology,Blockchain,Manufacturing"
