id,publish_time,title,article_url,ticker,publisher,description,keywords
,2023-02-05 08:00:00,'Hogwarts Legacy' PC System Requirements Explained: Minimum And Recommended Specs,https://www.forbes.com/sites/erikkain/2023/02/05/hogwarts-legacy-pc-system-requirements-explained-minimum-and-recommended-specs/,NVDA,Forbes,Hogwarts Legacy PC minimum and recommended settings explained.,Manufacturing
,2023-02-04 08:44:47,"Here's how to invest in the AI craze, according to ChatGPT",https://markets.businessinsider.com/news/stocks/chatgpt-ai-stocks-markets-investing-adivce-etfs-microsoft-c3ai-google-2023-2,NVDA,Business Insider,We Asked ChatGPT How to Invest in the AI Craze Sweeping Wall ... - Markets Insider ...,"Retail & Wholesale,Financial Markets,Manufacturing,Technology"
,2023-02-04 08:15:00,"Here's how to invest in the AI craze, according to ChatGPT",https://africa.businessinsider.com/markets/heres-how-to-invest-in-the-ai-craze-according-to-chatgpt/e5gkkc8,NVDA,Business Insider,"I jumped into ChatGPT and asked two questions about getting exposure to AI through the financial markets. ChatGPT's suggestions included well-known companies such as Microsoft, but it also offered assets that aren't tech behemoths or household names. How can I invest in the AI craze?","Retail & Wholesale,Financial Markets,Manufacturing,Technology"
,2023-02-04 08:00:00,Popular AI Like ChatGPT Could Be Just the Beginning for Data Center Stocks Like Nvidia,https://www.fool.com/investing/2023/02/04/popular-ai-like-chatgpt-could-be-just-the-beginnin/,NVDA,Motley Fool,These two semiconductor investors are back to discuss some significant tailwinds for various chip stocks.,"Technology,Financial Markets,Manufacturing"
,2023-02-04 05:00:00,ChatGPT seconds Warren Buffett's and Michael Burry's tips on what it takes to be a good investor - the bot lists patience and discipline among 6 must-have traits,https://markets.businessinsider.com/news/stocks/chatgpt-warren-buffett-michael-burry-stocks-successful-investor-traits-2023-2,NVDA,Business Insider,"ChatGPT Seconds Buffett, Burry Tips on Successful Stock Investor ... - Business Insider ...","Financial Markets,Manufacturing,Technology,Finance"
