id,publish_time,title,article_url,ticker,publisher,description,keywords
,2023-02-17 14:32:30,Here's How Much $1000 Invested In Oracle 20 Years Ago Would Be Worth Today - Oracle  ( NYSE:ORCL ) ,https://www.benzinga.com/news/earnings/23/02/30965077/heres-how-much-1000-invested-in-oracle-20-years-ago-would-be-worth-today,ORCL,Benzinga,"Oracle ORCL has outperformed the market over the past 20 years by 2.27% on an annualized basis producing an average annual return of 10.43%. Currently, Oracle has a market capitalization of $233.99 billion.","Technology,Financial Markets"
,2023-02-17 14:06:29,ORCL: 1 Stock to Buy That's a Big Money Favorite,https://stocknews.com/news/orcl-cvlt-prgs-egan-1-stock-to-buy-thats-a-big-money-favorite/,ORCL,Stocknews.com,"The Labor Department reported a 6% increase in the producer-price index ( PPI ) Yesterday. Although stubborn inflation has returned to haunt the markets in anticipation of a prolonged hawkish stance by the Federal Reserve, investors have still struggled to keep their hands off Oracle Corporation ...","Economy - Monetary,Financial Markets,Earnings,Technology"
,2023-02-16 21:21:53,"YouTube's Wojcicki resigns, joining other high-profile women leaving Big Tech",https://www.scmp.com/tech/big-tech/article/3210501/youtube-ceo-susan-wojcicki-resigns-joining-exodus-high-profile-women-silicon-valley,ORCL,South China Morning Post,"Over nine years running YouTube, Wojcicki grew revenue to US$29 billion and introduced new products like YouTube TV and Shorts, a TikTok competitor.","Financial Markets,Manufacturing,Earnings,Technology"
,2023-02-16 10:18:00,Ceridian Stock: Payroll Player Sees Growth By Offering Early Access To Wages,https://www.investors.com/research/the-new-america/cday-stock-ceridian-sees-growth-path-via-early-access-to-wages/,ORCL,Investors Business Daily,Ceridian Stock: Payroll Player Sees Growth By Offering Early Access ... Investor's Business Daily ...,"IPO,Financial Markets,Earnings,Technology,Finance"
,2023-02-16 07:20:00,"Microsoft just became the hottest name in AI, but Google, NVIDIA, IBM and other rivals are turning up the heat",https://www.marketwatch.com/story/microsoft-just-became-the-hottest-name-in-ai-but-google-nvidia-ibm-and-other-rivals-are-turning-up-the-heat-157509d1,ORCL,MarketWatch,Demand for AI is expected to grow at close to a 20% compound annual growth rate.,"Technology,Financial Markets,Manufacturing"
,2023-02-16 05:53:50,"Low-Code Development Platform Market- North America to dominate the market by 2029, says MMR",https://www.benzinga.com/pressreleases/23/02/g30938278/low-code-development-platform-market-north-america-to-dominate-the-market-by-2029-says-mmr,ORCL,Benzinga,"New York, Feb. 16, 2023 ( GLOBE NEWSWIRE ) -- The report published by Maximize Market Research on ""Low-Code Development Platform Market"" is expected to grow from USD 17.25 Bn in 2021 to USD 122.75 Bn in 2029 at a CAGR of 27.8 percent over the forecast period.","Technology,Financial Markets"
,2023-02-15 04:48:40,Software as a Service Market Exhibits 19.7% CAGR to Hit USD 883.34 Billion by 2029,https://www.benzinga.com/pressreleases/23/02/g30919814/software-as-a-service-market-exhibits-19-7-cagr-to-hit-usd-883-34-billion-by-2029,ORCL,Benzinga,"Pune, India, Feb. 15, 2023 ( GLOBE NEWSWIRE ) -- The global software as a service ( SaaS ) market size was USD 215.10 billion in 2021. The market is projected to grow from USD 251.17 billion in 2022 to USD 883.34 billion by 2029, exhibiting a CAGR of 19.7% during the 2022-2029 period.","Retail & Wholesale,Financial Markets,Earnings,Technology"
,2023-02-15 04:32:30,IoT Cloud Platform Market to grow at 11.9 percent CAGR over 2029 with increased global Emphasis on Industrialization 4.0- Says MMR,https://www.benzinga.com/pressreleases/23/02/g30919755/iot-cloud-platform-market-to-grow-at-11-9-percent-cagr-over-2029-with-increased-global-emphasis-on,ORCL,Benzinga,"SAN FRANCISCO, Feb. 15, 2023 ( GLOBE NEWSWIRE ) -- The report published by Maximize Market Research, a global Information Technology & Telecommunication research firm has published a report on ""IoT Cloud Platform Market"".","Retail & Wholesale,Financial Markets,Manufacturing,Earnings,Technology"
