id,publish_time,title,article_url,ticker,publisher,description,keywords
,2023-02-02 15:30:00,Privileged access management solutions market to grow by 22.91% Y-O-Y from 2022 to 2023: Need for multi-factor authentication  ( MFA )  for privileged accounts will drive growth -Technavio,https://www.prnewswire.com/news-releases/privileged-access-management-solutions-market-to-grow-by-22-91-y-o-y-from-2022-to-2023-need-for-multi-factor-authentication-mfa-for-privileged-accounts-will-drive-growth--technavio-301735882.html,ORCL,PR Newswire,Privileged access management solutions market to grow by 22.91 ... PR ...,"Earnings,Technology,Manufacturing"
,2023-02-02 09:03:54,Revenue Management System Market Growth Report  ( $37.10 Billion )  is Driven by Integration of AI and ML Technologies - Exclusive Study by The Insight Partners,https://www.benzinga.com/pressreleases/23/02/g30688284/revenue-management-system-market-growth-report-37-10-billion-is-driven-by-integration-of-ai-and-ml,ORCL,Benzinga,"New York, Feb. 02, 2023 ( GLOBE NEWSWIRE ) -- According to The Insight Partners, ""Revenue Management System Market Size, Share, Growth and Global Forecast to 2028 - COVID-19 Impact and Global Analysis by Component ( Solution and Services ) , Deployment ( Cloud Based and On-Premise ) , and ...","Earnings,Technology"
,2023-02-01 17:45:19,Oracle  ( ORCL )  Outpaces Stock Market Gains: What You Should Know,https://www.zacks.com/stock/news/2047979/oracle-orcl-outpaces-stock-market-gains-what-you-should-know,ORCL,Zacks Commentary,"Oracle (ORCL) closed the most recent trading day at $90.05, moving +1.8% from the previous trading session.","Earnings,Technology,Financial Markets"
,2023-02-01 13:55:24,ORCL: This Software Stock Is a No-Brainer Buy For 2023,https://stocknews.com/news/orcl-cvlt-prgs-ibex-this-software-stock-is-a-no-brainer-buy-for-2023/,ORCL,Stocknews.com,ORCL: This Software Stock Is a No-Brainer Buy For ...,"Earnings,Technology,Financial Markets"
,2023-02-01 13:12:00,Nova Scotia and Oracle Cerner Begin a New Era in Healthcare,https://www.benzinga.com/pressreleases/23/02/n30673504/nova-scotia-and-oracle-cerner-begin-a-new-era-in-healthcare,ORCL,Benzinga,"New 10-year agreement to provide more efficient, secure, timely access to patient information",Technology
