id,publish_time,title,article_url,ticker,publisher,description,keywords
,2022-12-31 22:00:28,"Globalization, Elon, Profiteering And Boomers. China, The Cloud, Self-Health And Kanye. Re-Generative AI, Ukraine, Tay Tay, And The Dallas Cowboys. All Of That And More In My 23 Predictions For 2023.",https://www.forbes.com/sites/michaelgale/2022/12/31/globalization-elon-profiteering-and-boomers-china-the-cloud-self-health-and-kanye-re-generative-ai-ukraine-tay-tay-and-the-dallas-cowboys-all-of-that-and-more-in-my-23-predictions-for-2023/,META,Forbes,"Putting the obvious aside, the theme for 2023 predictions is more about the underlying changes we are seeing in society, government, technology, business models, geopolitics, and the planet and less about some of the superficial pieces that might be more noise than true signals.","Economy - Monetary,Financial Markets,Manufacturing,Technology,Blockchain"
,2023-01-01 00:00:00,Astounding 2023 New Year's Resolution: Longtime LGBTQ+ and HIV/AIDS activist Nicholas Snow continues broadcasting PromoHomo.TV®--an online TV network based in his bedroom!,https://www.benzinga.com/pressreleases/23/01/n30246792/astounding-2023-new-years-resolution-longtime-lgbtq-and-hivaids-activist-nicholas-snow-continues-b,META,Benzinga,"What began as Facebook Live broadcasts in 2016 has evolved into a full-fledged online television network with multiple broadcast television-style series created for a global audience, streaming to hundreds of thousands of viewers on YouTube, Facebook, LinkedIn, Twitter and at ...","Technology,Financial Markets"
,2023-01-01 03:58:00,"Now, Canada and Australia impose Covid rules on travellers from China",https://www.business-standard.com/article/international/now-canada-and-australia-impose-covid-rules-on-travellers-from-china-123010100104_1.html,META,Business Standard,"Now, Canada and Australia impose Covid rules on travellers from ... Business Standard ...",Technology
,2023-01-01 05:18:20,Top upcoming trends in marketing that brands need to leverage in 2023 | The Financial Express,https://www.financialexpress.com/brandwagon/top-upcoming-trends-in-marketing-that-brands-need-to-leverage-in-2023/2933294/,META,The Financial Express,Top upcoming trends in marketing that brands need to leverage in 2023 The Financial Express ...,"Technology,Financial Markets"
,2023-01-01 05:30:00,The Year Big Tech Stocks Fell From Glory,https://www.wsj.com/articles/the-year-big-tech-stocks-fell-from-glory-11672543952,META,Wall Street Journal,"With interest rates rising sharply, momentum shifted in favor of defensive plays, while the energy sector rallied amid geopolitical strife.","Technology,Financial Markets"
,2023-01-01 06:15:00,"Down 65% in 2022, Is Meta Stock a Buy for 2023?",https://www.fool.com/investing/2023/01/01/down-65-in-2022-is-meta-stock-a-buy-for-2023/,META,Motley Fool,Social media stocks were hammered in 2022 as several headwinds hurt revenue.,Technology
,2023-01-01 08:01:00,"This Company's Sales Soared 2,250% in 9 Years, and Now Its Stock Is Cheaper Than Ever",https://www.fool.com/investing/2023/01/01/this-companys-sales-2250-9-years-stock-cheaper-eve/,META,Motley Fool,"Here's why Meta Platforms is having such a tough 12 months, despite its strong track record of success.","Economy - Monetary,IPO,Financial Markets,Earnings,Technology"
,2023-01-01 08:52:00,Nasdaq Bear Market: 1 Supercharged Growth Stock to Buy Like There's No Tomorrow,https://www.fool.com/investing/2023/01/01/nasdaq-bear-market-1-supercharged-growth-stock-to/,META,Motley Fool,"This disruptive company has been mauled by 2022's bear market, but it's setting the stage for a massive rebound.","Earnings,Technology,Financial Markets"
,2023-01-01 09:00:00,Caesars Sportsbook Goes Live with Mobile and In-person Sports Betting in Ohio - Caesars Entertainment  ( NASDAQ:CZR ) ,https://www.benzinga.com/pressreleases/23/01/n30247264/caesars-sportsbook-goes-live-with-mobile-and-in-person-sports-betting-in-ohio,META,Benzinga,"Sports fans in the Buckeye State can now bet on their favorite sporting events using the Caesars Sportsbook app or at Caesars Sportsbook retail locations in Cleveland and Columbus COLUMBUS, Ohio, Jan. 1, 2023 /PRNewswire/ -- Legalized sports betting is officially underway in the state of Ohio, ...","Real Estate & Construction,Technology,Financial Markets"
,2023-01-01 10:40:53,Is Trump Returning To Facebook? Meta Pushes Back Reinstatement Decision: Report - Meta Platforms  ( NASDAQ:META ) ,https://www.benzinga.com/news/23/01/30247323/is-trump-returning-to-facebook-meta-pushes-back-reinstatement-decision-report,META,Benzinga,"It has been two years since former President Donald Trump was booted off of several social media platforms, including Meta Platform Inc.'s META Facebook and Instagram ( along with Twitter ) in the wake of the Capitol Hill insurrection on Jan. 6, 2021.","Technology,Financial Markets"
,2023-01-01 11:21:44,The Ten Best TV Shows Of 2022,https://www.forbes.com/sites/paultassi/2023/01/01/the-ten-best-tv-shows-of-2022/,META,Forbes,"It's 2023 now and I am just catching up on my year-end best lists for 2022, which includes a very difficult one to make, given how much great TV was released this past year. It's a wide range, from all manner of streaming services, but here is what I would consider the best TV shows of 2022. 10.",Technology
,2023-01-01 12:07:00,"ROSEN, SKILLED INVESTOR COUNSEL, Encourages Daktronics, Inc. Investors to Secure Counsel Before Important Deadline in Securities Class Action - DAKT - Daktronics  ( NASDAQ:DAKT ) ",https://www.benzinga.com/pressreleases/23/01/g30247506/rosen-skilled-investor-counsel-encourages-daktronics-inc-investors-to-secure-counsel-before-import,META,Benzinga,"NEW YORK, Jan. 01, 2023 ( GLOBE NEWSWIRE ) -- WHY: Rosen Law Firm, a global investor rights law firm, reminds purchasers of the securities of Daktronics, Inc. DAKT between March 10, 2022 and December 6, 2022, both dates inclusive ( the ""Class Period"" ) , of the important February 21, 2023 lead ...","Technology,Financial Markets,Manufacturing"
,2023-01-01 13:11:00,Can Nvidia Help Walmart and Target Solve Their Theft Problem?,https://www.fool.com/investing/2023/01/01/can-nvidia-help-walmart-and-target-solve-theft/,META,Motley Fool,"""Shrinkage"" refers to organized theft at a retail store, but it shrinks more than just a retailer's inventory.","Retail & Wholesale,Financial Markets,Manufacturing,Earnings,Technology"
,2023-01-01 16:20:00,"ROSEN, NATIONALLY REGARDED INVESTOR COUNSEL, Encourages Gaia, Inc. Investors to Secure Counsel Before Important Deadline in First Filed Securities Class Action Initiated by the Firm - GAIA - Gaia  ( NASDAQ:GAIA ) ",https://www.benzinga.com/pressreleases/23/01/g30247717/rosen-nationally-regarded-investor-counsel-encourages-gaia-inc-investors-to-secure-counsel-before-,META,Benzinga,"NEW YORK, Jan. 01, 2023 ( GLOBE NEWSWIRE ) -- WHY: Rosen Law Firm, a global investor rights law firm, reminds purchasers of the securities of Gaia, Inc. GAIA between December 27, 2017 and November 7, 2022, both dates inclusive ( the ""Class Period"" ) , of the important February 21, 2023 lead ...","Technology,Financial Markets"
,2023-01-01 16:32:59,"More social media regulation is coming in 2023, members of Congress say",https://www.cnbc.com/2023/01/01/more-social-media-regulation-is-coming-in-2023-members-of-congress-say.html,META,CNBC,Legislators and advocates say they are looking to further regulate social media companies in 2023.,Technology
,2023-01-01 17:16:00,"ROSEN, TRUSTED NATIONAL TRIAL COUNSEL, Encourages Iris Energy Ltd. Investors with Losses to Secure Counsel Before Important Deadline in Securities Class Action - IREN - Iris Energy  ( NASDAQ:IREN ) ",https://www.benzinga.com/pressreleases/23/01/g30247765/rosen-trusted-national-trial-counsel-encourages-iris-energy-ltd-investors-with-losses-to-secure-co,META,Benzinga,"NEW YORK, Jan. 01, 2023 ( GLOBE NEWSWIRE ) -- WHY: Rosen Law Firm, a global investor rights law firm, reminds purchasers of the securities of Iris Energy Ltd. IREN: ( i ) pursuant and/or traceable to the Offering Documents issued in connection with the Company's 2021 initial public offering ( the ...","IPO,Technology,Financial Markets"
,2023-01-02 00:26:15,"Fired during COVID, Bali's low paid now demand double the pay",https://www.aljazeera.com/economy/2023/1/2/bali-workers-fired-during-pandemic-demand-better-pay,META,Al Jareeza,"Fired during COVID, Bali workers now demand double the pay Al Jazeera English ...","Earnings,Technology"
,2023-01-02 03:47:30,The Web3.0 Celebrity: How Artists Can Circumvent Traditional Entertainment Structures And Create Authentic Fan Experience,https://www.forbes.com/sites/joshwilson/2023/01/02/the-web30-celebrity-how-artists-can-circumvent-traditional-entertainment-structures-and-create-authentic-fan-experience/,META,Forbes,"When blockchain technology first emerged, most people saw it as the bedrock that ushered in a new world of decentralized finance. We're now seeing many other uses that can feature across entertainment.","Technology,Blockchain"
,2023-01-02 04:33:00,"Meta to announce decision on Trump's return to Facebook, Instagram: Report",https://www.business-standard.com/article/international/meta-to-announce-decision-on-trump-s-return-to-facebook-instagram-report-123010200486_1.html,META,Business Standard,Meta to announce decision on Trumps return to Facebook ... Business Standard ...,Technology
,2023-01-02 05:30:00,"2 Growth Stocks That Could Soar 135% and 168% From Their 52-Week Lows, According to Wall Street",https://www.fool.com/investing/2023/01/02/2-growth-stocks-could-soar-168-from-52-week-lows/,META,Motley Fool,Certain Wall Street analysts expect these growth stocks to deliver triple-digit returns in 2023.,"Economy - Monetary,Retail & Wholesale,Financial Markets,Earnings,Technology"
,2023-01-02 07:00:00,23 Top Stocks to Buy for 2023,https://www.fool.com/investing/2023/01/02/23-top-stocks-to-buy-for-2023/,META,Motley Fool,Let's start the year with an excellent list of stocks to buy.,"Life Sciences,Retail & Wholesale,Manufacturing,Technology"
,2023-01-02 08:45:00,Better Growth Stock: Zoom Video Communications vs. C3.ai,https://www.fool.com/investing/2023/01/02/better-growth-stock-zoom-video-vs-c3-ai/,META,Motley Fool,Which of these out-of-favor growth stocks will bounce back in 2023?,"Economy - Monetary,Financial Markets,Earnings,Technology"
,2023-01-02 09:05:19,'She-Hulk' Writer Calls It The 'Most Comic-Accurate Show In The MCU',https://www.forbes.com/sites/paultassi/2023/01/02/she-hulk-writer-calls-it-the-most-comic-accurate-show-in-the-mcu/,META,Forbes,"Of all the bouts with ""The Discourse"" over the past year, I don't think I've been more annoyed than watching She-Hulk get slandered since its release this past August, when it's genuinely one of the most interesting, creative, legitimately funny things the MCU has done in years.",Technology
,2023-01-02 09:22:30,'Wednesday' Dethroned In Netflix's Top 10 List For The Third Time By A New Show,https://www.forbes.com/sites/paultassi/2023/01/02/wednesday-dethroned-in-netflixs-top-10-list-for-the-third-time-by-a-new-show/,META,Forbes,"Here's what new show has knocked Wednesday off the #1 spot in Netflix's top 10 list, again.",Technology
,2023-01-02 09:22:39,Instagram Now Lets Users Choose Personal Pronouns In Different Languages - Meta Platforms  ( NASDAQ:META ) ,https://www.benzinga.com/news/23/01/30248499/instagram-now-lets-users-choose-personal-pronouns-in-different-languages,META,Benzinga,"Meta Platforms Inc.'s META Instagram has stepped into 2023 with a new update. What Happened: Instagram users can now add pronouns to their profiles in different languages, including Spanish, Portuguese and French among others. New on #Instagram , now you can add pronouns with different languages ...",Technology
,2023-01-02 11:20:00,3 Reasons Apple Stock Keeps Falling,https://www.fool.com/investing/2023/01/02/3-reasons-why-apple-stock-keeps-falling/,META,Motley Fool,"Down 15% in December, investors might be wondering where the bottom is for Apple stock.","Retail & Wholesale,Financial Markets,Manufacturing,Earnings,Technology"
,2023-01-02 13:16:00,"ROSEN, GLOBALLY RESPECTED INVESTOR COUNSEL, Encourages Core Scientific, Inc. Investors to Secure Counsel Before Important January 13 Deadline in Securities Class Action - CORZ - Core Scientific  ( NASDAQ:CORZ ) ",https://www.benzinga.com/pressreleases/23/01/g30250997/rosen-globally-respected-investor-counsel-encourages-core-scientific-inc-investors-to-secure-couns,META,Benzinga,"NEW YORK, Jan. 02, 2023 ( GLOBE NEWSWIRE ) -- WHY: Rosen Law Firm, a global investor rights law firm, reminds purchasers of the securities of Core Scientific, Inc. CORZ between January 3, 2022 and October 26, 2022, both dates inclusive ( the ""Class Period"" ) , of the important January 13, ...","Technology,Financial Markets"
,2023-01-02 13:46:00,"ROSEN, A TOP RANKED LAW FIRM, Encourages Bird Global, Inc. Investors to Secure Counsel Before Important Deadline in First Filed Securities Class Action Commenced by the Firm - BRDS - Bird Glb  ( NYSE:BRDS ) ",https://www.benzinga.com/pressreleases/23/01/g30251074/rosen-a-top-ranked-law-firm-encourages-bird-global-inc-investors-to-secure-counsel-before-importan,META,Benzinga,"NEW YORK, Jan. 02, 2023 ( GLOBE NEWSWIRE ) -- WHY: Rosen Law Firm, a global investor rights law firm, reminds purchasers of the securities of Bird Global, Inc.","Financial Markets,Manufacturing,Earnings,Technology"
,2023-01-02 13:46:47,"ROSEN, GLOBAL INVESTOR COUNSEL, Encourages Rent the Runway, Inc. Investors With Losses to Secure Counsel Before Important January 13 Deadline in Securities Class Action - RENT - Rent the Runway  ( NASDAQ:RENT ) ",https://www.benzinga.com/pressreleases/23/01/g30251075/rosen-global-investor-counsel-encourages-rent-the-runway-inc-investors-with-losses-to-secure-couns,META,Benzinga,"NEW YORK, Jan. 02, 2023 ( GLOBE NEWSWIRE ) -- WHY: Rosen Law Firm, a global investor rights law firm, reminds purchasers of the securities of Rent the Runway, Inc. RENT pursuant and/or traceable to the Company's initial public offering conducted in October 2021 ( the ""IPO"" ) of the important ...","IPO,Technology,Financial Markets"
,2023-01-02 15:50:00,"ROSEN, NATIONAL TRIAL COUNSEL, Encourages F45 Training Holdings Inc. Investors with Losses to Secure Counsel Before Important Deadline in Securities Class Action - FXLV - F45 Training Holdings  ( NYSE:FXLV ) ",https://www.benzinga.com/pressreleases/23/01/g30251305/rosen-national-trial-counsel-encourages-f45-training-holdings-inc-investors-with-losses-to-secure-,META,Benzinga,"NEW YORK, Jan. 02, 2023 ( GLOBE NEWSWIRE ) -- WHY: Rosen Law Firm, a global investor rights law firm, reminds purchasers of the securities of F45 Training Holdings Inc.","IPO,Retail & Wholesale,Financial Markets,Technology"
,2023-01-02 17:30:00,A shrinking job market | The Financial Express,https://www.financialexpress.com/opinion/a-shrinking-job-market/2934513/,META,The Financial Express,A shrinking job market The Financial Express ...,"Financial Markets,Manufacturing,Earnings,Technology"
,2023-01-05 09:00:00,"JAPAN HOUSE Los Angeles Presents ""Designing With Disaster: Stories From Seven Regenerative Cities""",https://www.benzinga.com/pressreleases/23/01/g30293567/japan-house-los-angeles-presents-designing-with-disaster-stories-from-seven-regenerative-cities,META,Benzinga,"LOS ANGELES, Jan. 05, 2023 ( GLOBE NEWSWIRE ) -- JAPAN HOUSE Los Angeles, a Japanese cultural destination in the heart of Hollywood, announces its upcoming exhibition ""Designing with Disaster: Stories from Seven Regenerative Cities"" on display from January 27 - April 2, 2023.",Technology
,2023-01-05 09:00:00,equipifi Wins Audience Choice Award at 2022 FIS Fintech Accelerator Virtual Demo Day,https://www.prnewswire.com/news-releases/equipifi-wins-audience-choice-award-at-2022-fis-fintech-accelerator-virtual-demo-day-301714042.html,META,PR Newswire,equipifi Wins Audience Choice Award at 2022 FIS Fintech ... PR ...,"Earnings,Technology"
,2023-01-05 09:08:00,"Crypto Banker Dives On Asset Exodus, Fed Seizures",https://www.investors.com/news/silvergate-capital-dives-on-crypto-exodus-fed-seizures/,META,Investors Business Daily,"Silvergate Capital Dives On Crypto Exodus, Fed Seizures | Investor's ... Investor's Business Daily ...","Financial Markets,Earnings,Technology,Finance,Blockchain"
,2023-01-05 09:08:00,Shopify Just Threw a Big Lifeline to Meta Platforms and Alphabet,https://www.fool.com/investing/2023/01/05/shopify-a-big-lifeline-to-meta-platforms-alphabet/,META,Motley Fool,The company's digital advertising tools bypass Apple's privacy measures.,"Earnings,Technology,Retail & Wholesale"
,2023-01-05 09:15:00,"7 Mindsets Launches App Focused on Mindsets Learning and Well-being for Educators, Students and Families",https://www.benzinga.com/pressreleases/23/01/g30294167/7-mindsets-launches-app-focused-on-mindsets-learning-and-well-being-for-educators-students-and-fam,META,Benzinga,"ROSWELL, Ga., Jan. 05, 2023 ( GLOBE NEWSWIRE ) -- 7 Mindsets, the leader in PreK-12 mindsets-based learning and well-being solutions, today announced the launch of an app designed to offer free access to the research-based principles for developing human potential from The 7 Mindsets to Live ...",Technology
,2023-01-05 09:17:22,The Hidden Reason Netflix Keeps Cancelling Shows Like '1899',https://www.forbes.com/sites/paultassi/2023/01/05/the-hidden-reason-netflix-keeps-cancelling-shows-like-1899/,META,Forbes,"""It's 70% gut and 30% data…Most of it is informed hunches and intuition. Data either reinforces your worst notion or it just supports what you want to do either way."" ...",Technology
,2023-01-05 09:20:04,A scandal rocks India's pharmaceutical industry,https://www.economist.com/business/2023/01/05/a-scandal-rocks-indias-pharmaceutical-industry,META,The Economist,Can the world's pharmacy escape a reputation for poor quality control?,Technology
,2023-01-05 09:30:00,How Will Florida Condo Safety Law Impact Housing?,https://www.forbes.com/sites/rogervaldez/2023/01/05/will-florida-condo-safety-law-cause-financial-collapse/,META,Forbes,"In Florida, the legislature needs to force the issue with property owners: catch up with deferred maintenance or face consequences. But this stick approach needs to be accompanied with a carrot. The professionals in Florida are warning of a different kind of collapse, a financial one.","Technology,Financial Markets"
,2023-01-05 09:30:00,CPP Investments Announces Chief Risk Officer,https://www.newswire.ca/news-releases/cpp-investments-announces-chief-risk-officer-898709779.html,META,Canada Newswire,"TORONTO, Jan. 5, 2023 /CNW/ - John Graham, President & CEO, Canada Pension Plan Investment Board ( ) , announced today the appointment of Kristen Walters as Senior Managing Director & Chief Risk Officer ( CRO ) effective January 9, 2023.","Technology,Finance,Financial Markets"
,2023-01-05 09:35:00,"Hidden Worlds Joins Forces with The Islands of The Bahamas to Debut New Immersive Pop-Up Experience, Bringing Awareness to Ocean Conservation",https://www.benzinga.com/pressreleases/23/01/n30294607/hidden-worlds-joins-forces-with-the-islands-of-the-bahamas-to-debut-new-immersive-pop-up-experienc,META,Benzinga,"The educational experience returns to Miami in February 2023 for an 18-day ""Our Ocean, Our Future"" oceanic adventure","Technology,Financial Markets"
,2023-01-05 09:59:50,Sony Has Declared That The Great PS5 Shortage Is Over,https://www.forbes.com/sites/paultassi/2023/01/05/sony-has-declared-that-the-great-ps5-shortage-is-over/,META,Forbes,"Sony's Jim Ryan is going a step further, and is now willing to declare that the expansive PS5 shortage of the first few years of release should effectively be over from this point forward: ...",Technology
,2023-01-05 10:00:00,PROFESSIONAL FIGHTERS LEAGUE PARTNERS WITH JAKE PAUL IN HISTORIC EXCLUSIVE AGREEMENT IN MMA,https://www.benzinga.com/pressreleases/23/01/n30295105/professional-fighters-league-partners-with-jake-paul-in-historic-exclusive-agreement-in-mma,META,Benzinga,"PFL ANNOUNCES NEW PPV SUPER FIGHT DIVISION WITH ""FIGHTER FIRST"" MODEL THAT COMMITS TO SHARE 50% OF THE REVENUE WITH PPV FIGHTERS PAUL AND NAKISA BIDARIAN TO HELP BUILD NEW PFL PPV SUPER FIGHT DIVISION JAKE PAUL SIGNS TO FIGHT IN MMA EXCLUSIVELY FOR PFL","Earnings,Technology,Financial Markets"
,2023-01-05 10:00:00,CES 2023: Thermaltake Presents a New Lineup of CTE  ( Centralized Thermal Efficiency )  PC Chassis,https://www.benzinga.com/pressreleases/23/01/n30295082/ces-2023-thermaltake-presents-a-new-lineup-of-cte-centralized-thermal-efficiency-pc-chassis,META,Benzinga,"A Leap-ahead in thermal solution design and heat dissipation through increased chassis ventilation WALNUT, Calif., Jan. 5, 2023 /PRNewswire-PRWeb/ -- The premium brand for PC Case, Cooling, Power, and memory solutions, is proud to introduce its brand-new CTE ( Centralized Thermal Efficiency ) ...",Technology
,2023-01-05 10:00:00,Central South Carolina Megasite Receives CSX Select Site Designation - CSX  ( NASDAQ:CSX ) ,https://www.benzinga.com/pressreleases/23/01/g30295038/central-south-carolina-megasite-receives-csx-select-site-designation,META,Benzinga,"JACKSONVILLE, Fla., Jan. 05, 2023 ( GLOBE NEWSWIRE ) -- CSX CSX today announced that the Central South Carolina Megasite in Lugoff, South Carolina, has been designated a CSX Select Site.","Technology,Financial Markets"
,2023-01-05 10:00:00,Central South Carolina Megasite Receives CSX Select Site Designation,https://www.globenewswire.com/news-release/2023/01/05/2583904/0/en/Central-South-Carolina-Megasite-Receives-CSX-Select-Site-Designation.html,META,GlobeNewswire,"JACKSONVILLE, Fla., Jan. 05, 2023 ( GLOBE NEWSWIRE ) -- CSX ( NASDAQ: CSX ) today announced that the Central South Carolina Megasite in Lugoff, South Carolina, has been designated a CSX Select Site.","Technology,Financial Markets"
,2023-01-05 10:02:00,Opinion: The worst is over for the stock market,https://www.cnn.com/2023/01/05/opinions/stock-market-prediction-zandi/index.html,META,CNN,"Editor's Note: Mark Zandi is chief economist of Moody's Analytics. The opinions expressed in this commentary are his own. View more opinion on CNN. The worst is over for the stock market, in my view.","Economy - Monetary,Financial Markets,Earnings,Technology"
,2023-01-05 10:19:00,'Big Short' Investor Burry Attacks Software Giant Salesforce,https://www.thestreet.com/technology/big-short-michael-burry-attacks-software-giant-salesforce,META,The Street,The legendary investor says the stock market should have harshly punished the software group.,"Retail & Wholesale,Financial Markets,Earnings,Technology"
,2023-01-05 10:22:18,Report: The Rock Directly Pitched David Zaslav On Black Adam V. Superman As The Future Of DC,https://www.forbes.com/sites/paultassi/2023/01/05/report-the-rock-directly-pitched-david-zaslav-on-black-adam-v-superman-as-the-future-of-dc/,META,Forbes,"According to the new report, The Rock went around essentially everyone to pitch WB Discovery CEO David Zaslav on a grand vision for the DC universe, which would involve a multi-year plan focused on the two characters, which would ultimately lead to a Black Adam versus Superman showdown, with ...",Technology
,2023-01-05 11:00:00,"Glancy Prongay & Murray LLP Reminds Investors of Looming Deadline in the Class Action Lawsuit Against Bird Global, Inc. f/k/a Switchback II Corporation  ( BRDS )  - Bird Glb  ( NYSE:BRDS ) ",https://www.benzinga.com/pressreleases/23/01/g30296565/glancy-prongay-murray-llp-reminds-investors-of-looming-deadline-in-the-class-action-lawsuit-agains,META,Benzinga,"LOS ANGELES, Jan. 05, 2023 ( GLOBE NEWSWIRE ) -- Glancy Prongay & Murray LLP ( ""GPM"" ) reminds investors of the upcoming January 17, 2023 deadline to file a lead plaintiff motion in the class action filed on behalf of investors who purchased or otherwise acquired Bird Global, Inc. f/k/a ...","Financial Markets,Manufacturing,Earnings,Mergers & Acquisitions,Technology"
,2023-01-05 11:05:00,"Synaptics Enables Lenovo ThinkBook Wireless Dock For Seamless, Cable-Free Dual 4K Display Connectivity - Synaptics  ( NASDAQ:SYNA ) ",https://www.benzinga.com/pressreleases/23/01/g30296730/synaptics-enables-lenovo-thinkbook-wireless-dock-for-seamless-cable-free-dual-4k-display-connectiv,META,Benzinga,World's first truly wireless dock drives two UHD 4K/60Hz displays over Wi-Fi 6/6E and includes a 45W charging mat for notebooks and a 10W universal wireless charging mat for smartphones and IoT accessories.,Technology
,2023-01-05 11:51:05,'Willow' Episode 7 Review: This Show Is Its Own Worst Enemy,https://www.forbes.com/sites/erikkain/2023/01/05/willow-episode-7-review-this-show-is-its-own-worst-enemy/,META,Forbes,"Willow continues to undermine everything it actually gets right, much to this reviewer's frustration.",Technology
,2023-01-05 12:00:00,"VICTROLA EXPANDS SONOS-CERTIFIED TURNTABLE LINEUP, UNVEILS VICTROLA STREAM ONYX AT CES 2023 - Sonos  ( NASDAQ:SONO ) ",https://www.benzinga.com/pressreleases/23/01/n30297596/victrola-expands-sonos-certified-turntable-lineup-unveils-victrola-stream-onyx-at-ces-2023,META,Benzinga,"Leading 115-year-old audio brand allows listeners to Connect without Compromise, Victrola Stream Onyx available for pre-order on Amazon starting January 7th","Technology,Retail & Wholesale,Manufacturing"
