id,publish_time,title,article_url,ticker,publisher,description,keywords
9a4f1169-04a9-49c9-aff9-62fca030c929,2023-03-11 09:07:00,Run on Silicon Valley Bank injects some panic into an already slumping stock market,https://www.cnbc.com/2023/03/11/run-on-silicon-valley-bank-injects-some-panic-into-an-already-slumping-stock-market.html,AAPL,cnbc.com,"The burden of proof is growing on the market optimists, Mike Santoli writes.","Investment strategy, Markets, Breaking News: Markets, Economic events, SVB Financial Group, S&P 500 Index, NASDAQ 100 Index, business news"
91c9a8ba-ea09-4a35-908b-aab2e35bc1cd,2023-03-11 10:23:43,Portefeuille d'actions de Gentleman Grower p.3,https://www.devenir-rentier.fr/p553693#p553693,BHPLF,devenir-rentier.fr,Discussion de 55 messages initiée par GentlemanGrower en 2016 et mise à jour en 2023. Page 3 sur 3.,"actions, gentleman grower, portefeuille"
cc9a566c-0ee6-4cb8-b9b6-556e1e131f04,2023-03-11 11:26:24,TWTW Weekly Wrap Up: 5-11 March,https://www.businessworld.in/article/TWTW-Weekly-Wrap-Up-5-11-March-/11-03-2023-468714/,APC.DE,businessworld.in,,", TWTW Weekly Wrap Up, TWTW, Jagdish Mitra, Artificial Intelligence (AI), foxconn, apple"
691b005f-a7cd-4ce2-881a-fe8505e91f71,2023-03-12 12:38:10,Dow Jones Futures Loom: FDIC Ready For Monday After SVB Financial Collapse? Watch These Stocks,https://www.investors.com/market-trend/stock-market-today/dow-jones-futures-fdic-ready-after-svb-financial-collapse-watch-these-bank-stocks/,SMH,investors.com,Dow Jones futures loom with the FDIC racing to limit the fallout from the SVB Financial collapse. Watch JPMorgan and these bank stocks.,
cd6e2ea4-9459-4287-8f34-1660e6b544dd,2023-03-12 17:50:44,Reminiscences Of Silicon Valley Bank: A Personal Recollection,https://www.forbes.com/sites/randybean/2023/03/12/reminiscences-of-silicon-valley-bank-a-personal-recollection/,AAPL,forbes.com,Reminiscences of Silicon Valley Bank: A Personal Recollection.,"Silicon Valley Bank, Information Technology, First National Bank of Boston, United States, Silicon Valley"
5f10824e-f4be-4ae4-bc39-dcc7a05a1f76,2023-03-12 19:40:55,"Biden Is Trapped, The [DS] Big Lie Just Imploded On Them, Justice For All – Ep. 3018",https://x22report.com/biden-is-trapped-the-ds-big-lie-just-imploded-on-them-justice-for-all-ep-3018/,AAPL.BA,x22report.com,,
48896436-b948-4e88-8cee-63345ac1111e,2023-03-13 18:21:03,US stocks end mixed as regional bank shares plunge,https://www.thesundaily.my/business/us-stocks-end-mixed-as-regional-bank-shares-plunge-GC10747155,AAPL,thesundaily.my,NEW YORK: Wall Street equities were mixed on Monday (March 13) at the end of a volatile session as several midsized banking stocks suffered another pu...,
385553b3-e1ff-4c24-8404-e4bb45a221f4,2023-03-13 18:53:33,Wall Street fecha sem orientação apesar da derrapagem do setor bancário,https://www.noticiasaominuto.com/economia/2249425/wall-street-fecha-sem-orientacao-apesar-da-derrapagem-do-setor-bancario,AAPL,noticiasaominuto.com,"A bolsa nova-iorquina encerrou hoje sem orientação clara, com a derrapagem do setor bancário a ser superada graças às empresas com elevada capitalização e à resistência dos valores defensivos, em contexto de recuo acentuado dos rendimentos obrigacionistas.","noticias, nacional, internacional, economia, politica, desporto, fama, mundo, pais, futebol, tecnologia, cultura"
5e16d52f-ab0b-4a4d-a18b-8ed2249620d6,2023-03-13 19:25:02,Обвал в банковском секторе США Дневник Биржевого Трейдера,http://www.plan.ru/?p=29776,FRC,plan.ru,"Все об акциях и биржевой торговле. Инвестиции и спекуляции.  Новости, прогнозы и аналитические обзоры фондового рынка. Торговые стратегии. Фундаментальный и технический анализ ценных бумаг. Управление активами. Инвестиционный портфель. Рекомендации. Интернет трейдинг. Деньги – Акции – Капитал – Финансы – Биржа - ПИФ.","лучший торговый робот, где купить акции газпрома, система интернет трейдинга, договор доверительного управления ценными бумагами, рынок форекс, валютный рынок, рынок акций, ценные бумаги, создание торговой стратегии, торговля на фортс, фьючерсные стратегии, виды акций, портфель акций, опционы ртс, экономист аналитик, формирование инвестиционного портфеля, стратегия управления инвестиционным портфелем, деривативы, венчурное финансирование, котировка акций лукойл, создание торговых роботов, сырьевая биржа, аналитика, скачать торгового робота, товарная биржа, "
40c75d71-a3ae-43a0-9549-b113a46147fb,2023-03-14 19:09:00,PAVmed Provides Business Update and Preliminary Fourth Quarter and Full Year 2022 Financial Results,https://www.prnewswire.com/news-releases/pavmed-provides-business-update-and-preliminary-fourth-quarter-and-full-year-2022-financial-results-301772308.html,PAVM,prnewswire.com,"/PRNewswire/ -- PAVmed Inc. (NASDAQ: PAVM, PAVMZ) (""PAVmed"" or the ""Company""), a diversified commercial-stage medical technology company, operating in the...","PAVmed Inc., Health Care & Hospitals, Medical Pharmaceuticals, Medical Equipment, Earnings"
499eeddd-eac1-4fab-b9a2-202f40940969,2023-03-14 19:28:50,Apple will reportedly postpone some bonuses until later in the year,https://finance.yahoo.com/news/apple-reportedly-postpone-bonuses-until-232850170.html?.tsrc=rss,AAPL,finance.yahoo.com,"Certain corporate Apple employees will have their upcoming bonuses postponed until later in the year, Bloomberg reported on Tuesday. The tech giant is reportedly curbing some hiring as well.",
c8ca27b0-c57f-4c05-91d6-555b6f31ac35,2023-03-14 19:45:00,"United States Gift Card and Incentive Card Market Intelligence and Future Growth Dynamics (Databook) - Q1 2023 Update: Featuring WalMart, Amazon, Target, Costco, Apple & More",https://www.prnewswire.com/news-releases/united-states-gift-card-and-incentive-card-market-intelligence-and-future-growth-dynamics-databook---q1-2023-update-featuring-walmart-amazon-target-costco-apple--more-301772039.html,AAPL,prnewswire.com,"/PRNewswire/ -- The ""United States Gift Card and Incentive Card Market Intelligence and Future Growth Dynamics (Databook) - Q1 2023 Update"" report has been...",Research and Markets
8b340f51-a30c-4a7e-b4e0-1a1418842291,2023-03-15 16:51:08,U.S. Stocks Trim Losses On Late Buying; Nasdaq Ends Slightly Up,https://www.rttnews.com/3350580/u-s-stocks-trim-losses-on-late-buying-nasdaq-ends-slightly-up.aspx?type=ts,AAPL,rttnews.com,"U.S. stocks came off the session's lows on Wednesday, but still ended on a weak note, with bank stocks feeling the brunt of selling pressure..","Nasdaq, Credit Suisse, S&P 500, U.S. retail sales, U.S. Stocks, U.S. producer prices, The Dow"
fb823c85-0621-476c-98d0-9991a1839244,2023-03-15 17:38:12,Portefeuille d'actions d'Elodie01 p.5,https://www.devenir-rentier.fr/p554148#p554148,AAPL,devenir-rentier.fr,Discussion de 108 messages initiée par Elodie01 en 2015 et mise à jour en 2023. Page 5 sur 5.,actions
edb5d529-5dc8-479d-a03f-50f46bbdb681,2023-03-15 17:49:29,Na Wall Street spadki przez Credit Suisse,https://www.pb.pl/na-wall-street-spadki-przez-credit-suisse-1180228,JPMC.BA,pb.pl,"Średnia Przemysłowa Dow Jones spadała na zamknięciu o 0,9 proc. choć większość wchodzących w jej skład spółek kończyło sesję wzrostem kursu. S&P500 stracił 0,7 proc. Nasdaq dzięki odrobieniu strat w końcówce handlu zakończył dzień 0,05 proc. wzrostem.",
17e1e15f-ce06-436c-a0d7-340410d0089f,2023-03-16 17:50:30,"Markets Gain on First Republic Bank Aid, Tech Enthusiasm",https://www.investopedia.com/markets-gain-on-first-republic-bank-aid-tech-enthusiasm-7368120,AAPL,investopedia.com,"U.S. equities indexes moved higher on March 16, 2023, as a group of banks pledged billions to come to the rescue of First Republic Bank (FRC).",
254b77e5-66a3-469e-b611-065f25b58e71,2023-03-16 18:30:10,3 Big Tech Stocks are Holding Up the Entire Market,https://finance.yahoo.com/news/3-big-tech-stocks-holding-223010663.html?.tsrc=rss,MSF.BR,finance.yahoo.com,"One area of the market that has performed well YTD, and held up over the last month is Tech",
ca66600d-b711-4c68-8764-29b13d3174bd,2023-03-16 19:22:08,Is This PayPal's Biggest Threat?,https://finance.yahoo.com/m/71c9d6dc-84ab-3c18-a891-d13b0aac4c59/is-this-paypal%27s-biggest.html?.tsrc=rss,PYPL,finance.yahoo.com,"After posting monster growth in 2020 and 2021, in large part from the pandemic's boost for online shopping and digital transactions, PayPal Holdings (NASDAQ: PYPL) pumped the brakes in 2022, with total payment volume (TPV) and revenue increasing 8% and 9%, respectively, a sharp slowdown from the prior two years.  Like most other businesses, PayPal is dealing with tough comparisons, macroeconomic concerns, and normalization of consumer behavior, which on their own wouldn't be enough to sound the alarm.  Here's why Apple (NASDAQ: AAPL) might be PayPal's biggest threat.",
512d35bd-259b-425f-a505-c6ea3f68e7b5,2023-03-17 16:06:21,US stocks fall but close mostly higher for the week despite ongoing bank fallout,https://markets.businessinsider.com/news/stocks/stock-market-news-today-bank-fallout-tests-resilience-tech-surge-2023-3,AAPL,businessinsider.com,Mega-cap tech stocks became the new safety trade this week and helped power the Nasdaq 100 to its best weekly return since November.,
0a855beb-2fc0-4ffa-bad3-515817c9c518,2023-03-17 16:54:47,Best FAANG Stock to Buy: Facebook vs. Amazon vs. Apple vs. Netflix vs. Google,https://finance.yahoo.com/m/50dd0475-6c79-372f-9beb-82e4b94c7052/best-faang-stock-to-buy%3A.html?.tsrc=rss,AAPL,finance.yahoo.com,"Meta Platforms (NASDAQ: META), Amazon (NASDAQ: AMZN), Apple (NASDAQ: AAPL), Netflix (NASDAQ: NFLX), and Alphabet (NASDAQ: GOOG) (NASDAQ: GOGL) have all done an excellent job growing their businesses and boosting profits.",
1a6cc8f2-585e-4623-a8c6-4cb827f3970f,2023-03-17 19:45:00,From SVB’s sudden collapse to Credit Suisse’s fallout: 8 charts show turbulence in financial markets,https://www.marketwatch.com/story/from-svbs-sudden-collapse-to-credit-suisses-fallout-8-charts-show-turbulence-in-financial-markets-48caa0f3,AAPL,marketwatch.com,A tumultuous week in the U.S. financial markets tied to risks in the banking sector ended on an uncertain note.,"article_normal, Banking, Financial Investment Services, Digital Content Services, Multimedia Content Services, Media Content Distribution, Financial Services, International Banks, Online Service Providers, Investing/Securities, Media/Entertainment, Technology, Private Banking/Wealth Management, Corporate/Industrial News, Equity Markets, Commodity/Financial Market News, Content Types, Factiva Filters, C&E Exclusion Filter, U.S. 2 Year Treasury Note, BX:TMUBMUSD02Y, Gold Continuous Contract, GC00, Gold Apr 2023, GCJ23, Crude Oil Continuous Contract, CL00, Crude Oil WTI (NYM $/bbl) Front Month, CL.1, Crude Oil Apr 2023, CLJ23, Signature Bank, SBNY, SVB Financial Group, SIVB, Bank of America Corp., BAC, Wells Fargo & Co., WFC, Citigroup Inc., C, Credit Suisse Group AG ADR, CS, First Republic Bank, FRC, JPMorgan Chase & Co., JPM, Silvergate Capital Corp., SI, KRE, SPX, COMP, DJIA, DXY, SPDR S&P Regional Banking ETF, U.S. Dollar Index (DXY), S&P 500 Index, NASDAQ Composite Index, Dow Jones Industrial Average, corporate, industrial news, equity markets, commodity, financial market news, content types, factiva filters, c&e exclusion filter, banking, financial investment services, digital content services, multimedia content services, media content distribution, financial services, international banks, online service providers, investing, securities, media, entertainment, technology, private banking, wealth management"
2045814b-feef-4941-a2d5-066d3450e075,2023-03-18 16:50:04,15 Most Promising Long-Term Stocks According to Analysts,https://finance.yahoo.com/news/15-most-promising-long-term-205004653.html?.tsrc=rss,AAPL.MX,finance.yahoo.com,"In this article, we will take a look at the 15 most promising long-term stocks according to analysts. To see more such companies, go directly to 5 Most Promising Long-Term Stocks According to Analysts. Investing in the stock market for the long term is perhaps the surest of the ways to expand your wealth. On […]",
43a3a756-3497-42be-9894-bde5226551a4,2023-03-18 16:50:04,15 Most Promising Long-Term Stocks According to Analysts,https://www.insidermonkey.com/blog/15-most-promising-long-term-stocks-according-to-analysts-1132015/,UNH,insidermonkey.com,"In this article, we will take a look at the 15 most promising long-term stocks according to analysts.",
0c1e0943-1451-4ca6-88f0-980cfea8ae29,2023-03-18 18:15:20,Graham Stephan Stock Portfolio: 10 Stock Picks,https://finance.yahoo.com/news/graham-stephan-stock-portfolio-10-221520485.html?.tsrc=rss,AAPL.BA,finance.yahoo.com,"In this article, we will take a look at the 10 stock picks of Graham Stephan. To see more such companies, go directly to Graham Stephan Stock Portfolio: 5 Stock Picks. Graham Stephan is perhaps one of the most popular celebrities in online wealth creation communities. With over 4.2 million subscribers on YouTube, Stephan actively […]",
93a1b0d9-d7a1-49ec-ab85-4b0c1be8fe5b,2023-03-19 11:37:22,Portefeuille financier d'ArnvaldIngofson p.49,https://www.devenir-rentier.fr/p554502#p554502,AAPL,devenir-rentier.fr,Discussion de 1214 messages initiée par ArnvaldIngofson en 2016 et mise à jour en 2023. Page 49 sur 49.,"action, immobilier, portefeuille"
2944b9a0-30c8-4999-a3a3-28063de7bab0,2023-03-19 13:01:00,"What’s at stake for stocks, bonds as Federal Reserves weighs bank chaos vs. inflation fight",https://www.marketwatch.com/story/whats-at-stake-for-stocks-bonds-as-federal-reserves-weighs-bank-chaos-vs-inflation-fight-c54c06ca,JPM,marketwatch.com,"Markets may be in a vulnerable position ahead of the Federal Reserve’s meeting this week, as traders bet the banking crisis could lead to interest-rate cuts...","article_normal, stocks, bonds, fed, banks, inflation, rates, Banking, Commercial Banking, Financial Investment Services, Investment Advice/Research Services, Banking/Credit, Financial Services, Investing/Securities, Economic Performance/Indicators, Inflation Figures/Price Indices, Monetary Policy, Interest Rates, Economic News, Equity Markets, Debt/Bond Markets, Commodity/Financial Market News, Content Types, Factiva Filters, C&E Exclusion Filter, Fed, economic performance, indicators, inflation figures, price indices, monetary policy, interest rates, economic news, equity markets, debt, bond markets, commodity, financial market news, content types, factiva filters, c&e exclusion filter, banking, commercial banking, financial investment services, investment advice, research services, credit, financial services, investing, securities"
286e5f0b-4a3b-4cf9-9f45-196759e80cce,2023-03-19 14:25:42,Buffett's Berkshire Hathaway speeds up stock buybacks By Reuters,https://www.investing.com/news/stock-market-news/buffetts-berkshire-hathaway-speeds-up-stock-buybacks-3034034,AAPL,investing.com,Buffett's Berkshire Hathaway speeds up stock buybacks,
2ca96406-c1e5-43f0-9343-538610d7dd1e,2023-03-20 17:54:49,"Na Wall Street wzrosty, maleje strach przed kryzysem bankowym",https://www.pb.pl/na-wall-street-wzrosty-maleje-strach-przed-kryzysem-bankowym-1180595,KRE,pb.pl,"Średnia Przemysłowa Dow Jones wzrosła o 1,2 proc. S&P500 zyskał 0,9 proc. Nasdaq Composite zwiększył wartość o 0,4 proc.",
68f1ad12-1030-4204-86be-f54daf013fda,2023-03-20 18:42:45,Dow Jones Futures: First Republic Crashes On New Wall Street Rescue Talks; Fed Meeting Next,https://www.investors.com/market-trend/stock-market-today/dow-jones-futures-first-republic-crashes-on-new-wall-street-rescue-talks-fed-meeting-next/,AAPL,investors.com,"Dow Jones futures: First Republic crashed 47%, as JPMorgan and other big banks made new efforts to stabilize the troubled bank.",
5b5c85b7-c55e-456d-abca-830bbe34f401,2023-03-20 19:30:00,"Flexible Battery Market to grow at a CAGR of 22.79% from 2022 to 2027, the rising popularity of rechargeable printed batteries to be an emerging trend in the market - Technavio",https://www.prnewswire.com/news-releases/flexible-battery-market-to-grow-at-a-cagr-of-22-79-from-2022-to-2027--the-rising-popularity-of-rechargeable-printed-batteries-to-be-an-emerging-trend-in-the-market---technavio-301775155.html,AAPL,prnewswire.com,"/PRNewswire/ -- The global flexible battery market size is estimated to grow by USD 240.47 million from 2022 to 2027, according to Technavio. The market is...",Technavio
d276a259-af59-411e-bfa8-9309edb13718,2023-03-21 17:55:00,"Fox Corp. Cl A stock rises Tuesday, still underperforms market",https://www.marketwatch.com/data-news/fox-corp-cl-a-stock-rises-tuesday-still-underperforms-market-242c25f8-e8823c5c73fa,AMZ.DE,marketwatch.com,"Shares of Fox Corp. Cl A inched 0.90% higher to $33.73 Tuesday, on what proved to be an all-around great trading session for the stock market, with the S&P...","article_normal, Broadcasting, Television Broadcasting, Media/Entertainment, Financial Performance, Share Price Movement/Disruptions, Corporate/Industrial News, Equity Markets, Commodity/Financial Market News, Content Types, Factiva Filters, C&E Exclusion Filter, C&E Industry News Filter, Fox Corp. Cl A, US:FOXA, financial performance, share price movement, disruptions, corporate, industrial news, equity markets, commodity, financial market news, content types, factiva filters, c&e exclusion filter, c&e industry news filter, broadcasting, television broadcasting, media, entertainment"
889785d5-5306-40a3-88f8-a994f17f704d,2023-03-21 18:25:00,"Synchrony Financial stock rises Tuesday, outperforms market",https://www.marketwatch.com/data-news/synchrony-financial-stock-rises-tuesday-outperforms-market-14814120-35aff74d1f84,JPMMV,marketwatch.com,"Shares of Synchrony Financial advanced 5.10% to $29.90 Tuesday, on what proved to be an all-around positive trading session for the stock market, with the...","article_normal, Credit Types/Services, Credit Cards, Banking/Credit, Financial Services, Financial Technology, Electronic Payment Systems, Technology, Financial Performance, Share Price Movement/Disruptions, Corporate/Industrial News, Equity Markets, Commodity/Financial Market News, Content Types, Factiva Filters, C&E Exclusion Filter, C&E Industry News Filter, Synchrony Financial, US:SYF, financial performance, share price movement, disruptions, corporate, industrial news, equity markets, commodity, financial market news, content types, factiva filters, c&e exclusion filter, c&e industry news filter, credit types, services, credit cards, banking, credit, financial services, financial technology, electronic payment systems, technology"
56e942c1-921a-4031-8cd5-f479acda62f4,2023-03-21 18:27:46,Why Is Option Activity Declining In Apple? (NASDAQ:AAPL),https://seekingalpha.com/article/4589143-why-is-option-activity-declining-in-apple,AAPL,seekingalpha.com,"Although not as high as last January, the current puts to calls ratio for Apple is still high on a historical basis. Click here to see our take on AAPL stock.",
276bfd23-c03e-47d0-9412-c44dd066f4b2,2023-03-22 16:40:21,"Bolsas de NY caem, com reação volátil à decisão do Fed e piora na reta final Por Estadão Conteúdo",https://br.investing.com/news/stock-market-news/bolsas-de-ny-caem-com-reacao-volatil-a-decisao-do-fed-e-piora-na-reta-final-1096544,AAPL,br.investing.com,"Bolsas de NY caem, com reação volátil à decisão do Fed e piora na reta final",
b3fb50a6-c475-4010-9f4f-4ec7883e6c5c,2023-03-22 17:47:03,Powell i Yellen popsuli nastroje na Wall Street,https://www.pb.pl/powell-i-yellen-popsuli-nastroje-na-wall-street-1180848,AAPL,pb.pl,"Średnia Przemysłowa Dow Jones i Nasdaq Composite straciły po 1,6 proc. S&P500 spadl o 1,65 proc. i zszedł poniżej 4000 pkt., które przekroczył na  finiszu poprzedniej sesji.",
8374759e-e67b-47b8-bb7f-3533225fa2b9,2023-03-22 18:32:02,L’AD di Paypal vede un miglioramento del mercato Da Investing.com,https://it.investing.com/news/stock-market-news/lad-di-paypal-vede-un-miglioramento-del-mercato-432SI-2130146,SHOP,it.investing.com,L’AD di Paypal vede un miglioramento del mercato,
c72209d7-08d3-478f-a237-7399ec2330b8,2024-09-02 10:30:36,Spending Crypto Anywhere: Bybit Powered by SATOS Brings Crypto Convenience to the Netherlands with Launch of Bybit Card By Chainwire,https://www.investing.com/news/cryptocurrency-news/spending-crypto-anywhere-bybit-powered-by-satos-brings-crypto-convenience-to-the-netherlands-with-launch-of-bybit-card-3596981,AAPL,investing.com,Spending Crypto Anywhere: Bybit Powered by SATOS Brings Crypto Convenience to the Netherlands with Launch of Bybit Card,
652c3731-8205-4f1c-b6b7-38807c19c1a6,2024-09-02 11:30:00,Columbia Global Technology Growth Fund Q2 2024 Commentary (Mutual Fund:CTCAX),https://seekingalpha.com/article/4718540-columbia-global-technology-growth-fund-q2-2024-commentary,AAPL,seekingalpha.com,"Equity markets generated another positive quarter, building from momentum of the prior quarter, as a strong earnings season for U.S.",
28c0bc94-cc1e-4a4e-9d41-4d4dad67361d,2024-09-02 11:34:00,To Buy or Not to Buy Apple Stock Pre Sept. 9 iPhone 16 Event?,https://www.zacks.com/stock/news/2330549/to-buy-or-not-to-buy-apple-stock-pre-sept-9-iphone-16-event?cid=CS-ZC-FT-analyst_blog|most_popular_stocks-2330549,AAPL,zacks.com,"AAPL's AI push, growing Services business and strong liquidity position make its shares attractive for long-term investors.","stock, stocks, investment, investment advice, investing, online trading, online investment, online stock trading, stock market, financial, financial planning, quote, quotes, stock quotes"
cdc3ec72-bf9a-4218-8a59-47b04ec0e798,2024-09-04 17:36:58,Apple Inc. (AAPL): An AI Stock That Broke The Internet This Week,https://www.insidermonkey.com/blog/apple-inc-aapl-an-ai-stock-that-broke-the-internet-this-week-1345863/,AAPL,insidermonkey.com,"We recently compiled a list of the AI News That Broke The Internet This Week. In this article, we are going to take a look at where Apple Inc.",
0a4cec29-8812-49a7-92d4-5be743ff9fe0,2024-09-04 17:38:04,3 Reasons To Buy VIG Instead Of SPY (NYSEARCA:VIG),https://seekingalpha.com/article/4719063-3-reasons-to-buy-vig-instead-of-spy,SPY,seekingalpha.com,SPY has outperformed the Vanguard Dividend Appreciation Index Fund over the long term and over the past several years. Read why VIG ETF is a better investment.,
aaa53c37-3d91-4533-b103-415297f0bbaa,2024-09-04 19:05:33,"US stock market today: S&P 500, Nasdaq down after Nvidia, Apple, Intel, US Steel shares fall. Check full list",https://economictimes.indiatimes.com/news/international/us/us-stock-market-today-sp-500-nasdaq-down-after-nvidia-apple-intel-us-steel-shares-fall-check-full-list/articleshow/113075963.cms,AAPL,economictimes.indiatimes.com,"US stock market today traded in red as Nvidia, Apple, Intel, US Steel stocks fell.","S&P 500 Nasdaq Dow Jones, US market, US market today, US stock market, US stock market today, stock market, stock market today"
afad9e05-d146-4af7-aa33-5d230650cb33,2024-09-06 18:08:22,QQQ Vs. QQQM: Key Differences And When To Choose These ETFs,https://www.forbes.com/sites/investor-hub/article/qqq-vs-qqqm-etfs-key-differences/,AAPL,forbes.com,"Wondering what the differences are between the ETFs QQQM and QQQ? You aren’t alone. To help, we explain what the key differences to know are.","QQQ vs QQQM, QQQM vs QQQ, What is QQQM vs QQQ, Nasdaq, Forbes"
213d12fd-1a2e-4a7e-9582-03657164c07a,2024-09-06 18:08:38,Dow Jones Futures: Stock Market Has Worst Week In Over A Year; Apple iPhone 16 Leads AI Events,https://www.investors.com/market-trend/stock-market-today/dow-jones-futures-bearish-signals-apple-iphone-16-ai-events/,SMH,investors.com,"Dow Jones futures: The stock market had its worst week in over a year, flashing a bearish signal. The Apple iPhone 16 leads key AI events.",
c90816d5-858a-478d-98f0-53fdbd9da315,2024-09-06 19:52:30,"Smart Look At The Week Ahead: US Inflation, Apple, Adobe And Oracle",https://thesmartinvestor.com.sg/smart-look-at-the-week-ahead-us-inflation-apple-adobe-and-oracle/,AAPL,thesmartinvestor.com.sg,"The US will announce inflation numbers for August. The headline inflation rate is expected to dip from 2.9% to 2.7%, whilst the core inflation rate could be unchanged at 3.2%. Whatever",
f016d5d3-5d34-4b9a-8f90-ce6718c23403,2024-09-07 16:42:38,Dow Jones Futures: Stock Market Has Worst Week In Over A Year; Apple iPhone 16 On Deck,https://www.investors.com/market-trend/stock-market-today/dow-jones-futures-bearish-signals-apple-iphone-16-ai-events/?src=A00220&yptr=yahoo,SMH,finance.yahoo.com,"Dow Jones futures: The stock market had its worst week in over a year, flashing a bearish signal. The Apple iPhone 16 leads key AI events.",
1c83642b-8b55-47ff-8862-d048929e057e,2024-09-07 16:55:00,Playing It Safe,https://www.zerohedge.com/markets/playing-it-safe,AAPL,zerohedge.com,"ZeroHedge - On a long enough timeline, the survival rate for everyone drops to zero",
