id,publish_time,title,article_url,ticker,publisher,description,keywords
cb704605-61c7-4672-adef-15bf13774d2f,2022-01-15 18:17:00,Panasonic введет четырехдневную рабочую неделю,https://news.finance.ua/ru/news/-/506777/panasonic-vvedet-chetyrehdnevnuyu-rabochuyu-nedelyu,AMZ.DE,finance.ua,Японская компания Panasonic даст работникам возможность работать четыре дня в неделю вместо до сих пор традиционных пяти.,
256da209-4a6e-4da1-b673-0f4ee8f24f40,2022-01-16 10:34:21,"Walmart shuffles executives, names new merchandising chief",https://www.livemint.com/companies/walmart-shuffles-executives-names-new-merchandising-chief-11642346944100.html,WMT,livemint.com,Retail giant says chief customer officer Janey Whiteside is leaving,Walmart
dff92dd9-765d-4e30-8b9e-2058addb9bb2,2022-01-16 11:42:00,Weekly Commentary: Kaufman Knows Inflation,https://seekingalpha.com/article/4479906-weekly-commentary-kaufman-knows-inflation,VOW3.DE,seekingalpha.com,"U.S. inflation hits 39-year high of 7%, sets stage for fed hike. Read more.",
92c13ff1-2d31-4f9a-8f9d-61edc10dfc75,2022-01-16 17:01:42,Chinese EVs Find a Niche Making Short-Haul Deliveries in Japan,https://financialpost.com/pmn/business-pmn/chinese-evs-find-a-niche-making-short-haul-deliveries-in-japan,AMZ.DE,financialpost.com,"(Bloomberg) — Logistics companies in Japan, striving to cut costs and make the most out of the pandemic-inspired online shopping boom, are finding an unlikely…",
a379199e-139f-4735-b84d-ccc0e08193bf,2022-01-17 14:00:00,Outlook Consumer Electronics Extended Warranty Global Market to 2030 - Expansion of Products and Services Presents Opportunities,https://www.prnewswire.com:443/news-releases/outlook-consumer-electronics-extended-warranty-global-market-to-2030---expansion-of-products-and-services-presents-opportunities-301462143.html,0HIN.L,prnewswire.com,"/PRNewswire/ -- The ""Consumer Electronics Extended Warranty Market By Product Type, Distribution Channel, and Coverage Type: Global Opportunity Analysis and...",Research and Markets
c4a52700-3cbe-4743-8c6f-ffbbb9298485,2022-01-17 17:00:44,Lawsuit against Amazon filed in tornado swarm that left 6 dead in Illinois warehouse By Reuters,https://www.investing.com/news/stock-market-news/lawsuit-against-amazon-filed-in-tornado-swarm-that-left-6-dead-in-illinois-warehouse-2740662,AMZN,investing.com,Lawsuit against Amazon filed in tornado swarm that left 6 dead in Illinois warehouse,
0d54b446-6249-4cf5-b0ce-5a6cd0b666df,2022-01-17 17:30:18,"Streaming Wars: What Can Netflix Do to Stay Ahead of Disney, Apple, and The Rest?",https://www.thestreet.com/investing/streaming-wars-what-can-netflix-do-to-stay-ahead-of-disney-apple,AAPL,thestreet.com,Streaming video giant Netflix has come a long way from its early days of mailing physical copies of DVDs to its customers across the country.,"Streaming, Entertainment, STOCKS, INVESTING, Movies, Media, Technology, Stocks, Technology, Media, Investing, Streaming, Entertainment"
7fa97e47-8160-46ad-8e91-e24224338063,2022-01-18 17:38:09,"Asset Planning Services Inc Buys TC Energy Corp, Bank of America Corp, Apple Inc, Sells TC Energy Corp",https://www.gurufocus.com/news/1619946/asset-planning-services-inc--buys-tc-energy-corp-bank-of-america-corp-apple-inc-sells-tc-energy-corp,0QZZ.L,gurufocus.com,GuruFocus Article or News written by insider and the topic is about:,"GuruFocus, Article, News, insider, SCHM, TRP, BAC, AAPL, TRP, "
b1aa9ea2-46d0-404d-abd7-bcae0fa5e0b6,2022-01-18 17:38:18,"Thomasville National Bank Buys Flowers Foods Inc, Vanguard Total Corporate ETF, Intuit Inc, Sells Vanguard Information Technology ETF, iShares TIPS Bond ETF, iShares MSCI Emerging Markets ETF",https://www.gurufocus.com/news/1619960/thomasville-national-bank-buys-flowers-foods-inc-vanguard-total-corporate-etf-intuit-inc-sells-vanguard-information-technology-etf-ishares-tips-bond-etf-ishares-msci-emerging-markets-etf,0QZZ.L,gurufocus.com,GuruFocus Article or News written by insider and the topic is about:,"GuruFocus, Article, News, insider, FLO, UNP, BIV, MDLZ, VTC, INTU, PYPL, DAR, TCBC, QCOM, TIP, BLK, VOX, WRK, IEP, IBM, "
070cda57-f9c9-4c43-bd70-9e56c84c21c5,2022-01-18 17:38:19,"Searcy Financial Services Inc Buys First Trust Financials AlphaDEX Fund, Apple Inc, CVS Health Corp, Sells First Trust International IPO ETF, The Walt Disney Co",https://www.gurufocus.com/news/1619962/searcy-financial-services-inc--buys-first-trust-financials-alphadex-fund-apple-inc-cvs-health-corp-sells-first-trust-international-ipo-etf-the-walt-disney-co,AMZN.MX,gurufocus.com,GuruFocus Article or News written by insider and the topic is about:,"GuruFocus, Article, News, insider, FXO, AAPL, CVS, BRK.B, ACWV, FDN, NVDA, AMZN, ARKK, FB, CFFN, FPXI, "
1aabd38a-1ce3-419d-9991-ca385091f47f,2022-01-19 17:23:55,Amazon unveils 'Lord of the Rings' subtitle that hints at storyline,https://www.businesstoday.in/latest/trends/story/amazon-unveils-lord-of-the-rings-subtitle-that-hints-at-storyline-319668-2022-01-19,AMZN,businesstoday.in,Amazon's Prime Video revealed the full name of the fantasy series on Wednesday ahead of its planned streaming debut of September 2.,"Amazon, Amazon Prime Video, Lord of the Rings, Middle earth fantasy series, Lord of the Rings: The Rings of Power, Lord of the Rings OTT series"
95405537-43cb-48c0-ba9e-4cc52e99d836,2022-01-19 17:38:26,"Community Capital Management, LLC Buys Fidelity National Financial Inc, Quanta Services Inc, Global Payments Inc, Sells Amazon.com Inc, Apple Inc, Meta Platforms Inc",https://www.gurufocus.com/news/1621068/community-capital-management-llc-buys-fidelity-national-financial-inc-quanta-services-inc-global-payments-inc-sells-amazoncom-inc-apple-inc-meta-platforms-inc,V.SW,gurufocus.com,GuruFocus Article or News written by insider and the topic is about:,"GuruFocus, Article, News, insider, GPN, JACK, LAD, SSNC, BERY, VMW, FNF, PWR, ABC, ZWS, LEN.B, UHS, DLTR, NVDA, BMY, V, O, ALL, "
e1f22510-66c9-41b5-99a8-db358a5cdd72,2022-01-19 17:38:30,"Belmont Capital, LLC Buys Compass Inc, Amazon.com Inc, Microsoft Corp, Sells SoFi Technologies Inc, SoFi Technologies Inc, BlackRock MuniHoldings New Jersey Quality Fund Inc",https://www.gurufocus.com/news/1621076/read,ADBE34.SA,gurufocus.com,GuruFocus Article or News written by insider and the topic is about:,"GuruFocus, Article, News, insider, MSFT, UNH, AMZN, GDX, XLV, XOM, COMP, TYO, LLY, F, ON, MUJ, TEAM, ADBE, BNKU, BLK, KWEB, "
54ad8b7e-e0f1-42eb-9d61-3850c48695a5,2022-01-20 17:38:04,"Chapman Investment Management, LLC Buys Charles Schwab Corp, Tesla Inc, KLA Corp, Sells Fidelity National Information Services Inc, Gilead Sciences Inc, Coca-Cola Co",https://www.gurufocus.com/news/1622317/chapman-investment-management-llc-buys-charles-schwab-corp-tesla-inc-kla-corp-sells-fidelity-national-information-services-inc-gilead-sciences-inc-cocacola-co,TSLA34.SA,gurufocus.com,GuruFocus Article or News written by insider and the topic is about:,"GuruFocus, Article, News, insider, TSLA, BRK.B, MTB, CVX, SCHW, KLAC, WAL, TGT, SPGI, JNJ, GILD, MCD, "
f965cff4-ca5a-4513-b48c-d2dd28840c53,2022-01-20 17:38:19,"Reitz Capital Advisors LLC Buys PIMCO Enhanced Low Duration Active Exchange-Traded, Schwab U.S. Mid-Cap ETF, Schwab U.S. Small-Cap ETF, Sells JPMorgan Ultra-Short Income ETF, Schwab U.S. Tips ETF, Bla",https://www.gurufocus.com/news/1622342/read,TSLAD.BA,gurufocus.com,GuruFocus Article or News written by insider and the topic is about:,"GuruFocus, Article, News, insider, LDUR, SCHM, SCHA, SCHX, VOO, JPM, ALB, CAT, FTEC, AMZN, GE, FEN, NTR, TSLA, "
055fb960-00bf-411c-bd13-3d9142655ec2,2022-01-20 17:58:52,Google U.S. lobbying jumps 27% as lawmakers aim to rein in Big Tech,https://www.marketscreener.com/quote/stock/ALPHABET-INC-24203373/news/Google-U-S-lobbying-jumps-27-as-lawmakers-aim-to-rein-in-Big-Tech-37603545/,AAPL.BA,marketscreener.com,"Alphabet Inc's Google reported 27% higher U.S. lobbying expenditures for 2021 compared to 2020, spending $9.6 million for the year, according to the Senate lobbying disclosure database.... | January 20,  2022","ALPHABET INC. stock exchange, news, information, press release, alphabet, google, reported, higher, lobbying, expenditures, for, 2021, compared, to, spending, million, the, according, senate, disclosure | GOOGL | US02079K3059"
ab5282fa-442a-4392-93b9-9bf438f57117,2022-01-21 17:38:21,"Mastrapasqua Asset Management Inc Buys Ford Motor Co, Cheniere Energy Inc, Jefferies Financial Group Inc, Sells Comcast Corp, Global Payments Inc, Fair Isaac Corp",https://www.gurufocus.com/news/1623128/mastrapasqua-asset-management-inc-buys-ford-motor-co-cheniere-energy-inc-jefferies-financial-group-inc-sells-comcast-corp-global-payments-inc-fair-isaac-corp,AMZN.MX,gurufocus.com,GuruFocus Article or News written by insider and the topic is about:,"GuruFocus, Article, News, insider, F, JEF, ELAN, LMT, K, WBA, LNG, MKSI, TXN, CVX, ABBV, SCHB, GPN, FICO, LHCG, VRTX, UHS, PYPL, "
7682dc68-a1d5-44d7-b7cc-d4f76ce270e8,2022-01-21 17:39:00,Google Seeks Dismissal of Ad Practices Suit,https://www.wsj.com/articles/google-seeks-dismissal-of-ad-practices-suit-11642787310?mod=rss_Technology,MSFT.MI,online.wsj.com,The search giant said that the states’ complaint focused on outdated conduct that didn’t preclude competition and that the practices were largely abandoned as the company’s ad tech business evolved.,"Digital Marketing, Internet Search Engines, Advertising/Marketing/Public Relations, Business/Consumer Services, Online Service Providers, Marketing, Technology, Corporate Crime/Legal Action, Advertising, Anti-Competition Issues, Corporate/Industrial News, Content Types, Factiva Filters, C&E Executive News Filter, C&E Industry News Filter, SYND, WSJ-PRO-WSJ.com, Alphabet, GOOGL, Meta Platforms, FB, corporate crime, legal action, marketing, advertising, anti-competition issues, corporate, industrial news, content types, factiva filters, c&e executive news filter, c&e industry news filter, digital marketing, internet search engines, public relations, business, consumer services, online service providers, technology"
2ffbdd20-9437-45b8-9182-c2bf30d3b761,2022-01-21 17:43:35,"Intel's move into Ohio brings new tech kudos, competition for talent By Reuters",https://www.investing.com/news/stock-market-news/intels-move-into-ohio-brings-new-tech-kudos-competitionfor-talent-2745355,AMZN.MX,investing.com,"Intel's move into Ohio brings new tech kudos, competition for talent",
20879684-1faa-4a88-b2f0-015517595ef8,2022-01-22 10:01:10,Morgan Stanley’s Top 10 Stock Picks for 2022,https://www.insidermonkey.com/blog/morgan-stanleys-top-10-stock-picks-for-2022-1021302/,AMZN,insidermonkey.com,"In this article, we will be taking a look at Morgan Stanley's top 10 stock picks for 2022.",
f35f7071-5a4f-45d6-b2e5-6a138068487d,2022-01-22 13:52:53,Why Does Bitcoin's Price Rise and Fall?,https://www.thestreet.com/investing/cryptocurrency/why-does-bitcoins-price-rise-and-fall,AMZN,thestreet.com,The cryptocurrency has been incredibly volatile.,"Cryptocurrency, Cryptocurrency, Bitcoin, CRYPTOCURRENCY, Bitcoin, INVESTING, Dogecoin, Elon Musk"
3bb99330-00ad-4b78-a3ca-7b2d715a7127,2022-01-22 18:06:00,"Mark Cuban Takes On Walgreens, CVS, Amazon in Crowded Drug Space",https://www.thestreet.com/investing/mark-cuban-cost-plus-drug-challenges-online-rivals-walgreens-cvs-amazon?puc=flipboard2&cm_ven=FLIPBOARD2,AMZN,flipboard.com,The Dallas-based online pharmacy on Wednesday debuted its services with a goal to help shield consumers from inflated drug prices.,"Pharmaceuticals, Investing, Stocks, Pharmaceuticals, Technology, INVESTING, Technology, Online, TECHNOLOGY, Retail, Retail, STOCKS, Investing Stocks"
89741a96-4170-4006-8334-c5eb0646507b,2022-01-23 10:20:41,"Davidson Capital Management Inc. Buys 12 Shares of Amazon.com, Inc. (NASDAQ:AMZN)",https://etfdailynews.com/news/davidson-capital-management-inc-buys-12-shares-of-amazon-com-inc-nasdaqamzn/,AMZN,etfdailynews.com,"Davidson Capital Management Inc. grew its stake in shares of Amazon.com, Inc. (NASDAQ:AMZN) by 2.9% in the 3rd quarter, according to its most recent disclosure with the Securities and Exchange Commission (SEC). The institutional investor owned 425 shares of the e-commerce giant’s stock after acquiring an additional 12 shares during the quarter. Amazon.com comprises approximately […]",
034ce129-ee67-4f04-ba9b-8ad83c225de0,2022-01-23 13:52:00,Kohl’s Can’t Find Relief From Investor Pressure,https://www.wsj.com/articles/kohls-cant-find-relief-from-investor-pressure-11642956350?mod=pls_whats_news_us_business_f,ADS.MI,online.wsj.com,"In a letter, Engine Capital urged Kohl’s to run a sale process following Starboard Value’s bid, as activists remain unsatisfied with the pace of the the department-store chain’s turnaround.","Retail/Wholesale, Clothing Stores, Specialty Retailing, Mixed Retailing, Department Stores, Etailing, Financial Investment Services, Investment Advice/Research Services, Clothing/Textiles, Consumer Goods, E-commerce, Financial Services, Online Service Providers, Investing/Securities, Leisure/Travel Goods, Retail, Sports Goods, Sports Clothing/Footwear, Technology, Ownership Changes, Acquisitions/Mergers/Shareholdings, Corporate Actions, Corporate/Industrial News, Partnerships/Collaborations, Content Types, Factiva Filters, C&E Industry News Filter, SYND, WSJ-PRO-WSJ.com, Engine Capital, Kohl’s, KSS, Starboard Value, Joel Bines, Michelle Gass, Jonathan Duskin, Neil Saunders, Eddie Lampert, ownership changes, acquisitions, mergers, shareholdings, corporate actions, corporate, industrial news, partnerships, collaborations, content types, factiva filters, c&e industry news filter, retail, wholesale, clothing stores, specialty retailing, mixed retailing, department stores, etailing, financial investment services, investment advice, research services, clothing, textiles, consumer goods, e-commerce, financial services, online service providers, investing, securities, leisure, travel goods, sports goods, sports clothing, footwear, technology"
203a9d92-7d44-4f3d-847b-b1ebc0b9df9e,2022-01-23 13:56:41,"Amazon offers help, Future unimpressed",https://www.livemint.com/companies/news/amazon-offers-help-future-unimpressed-11642964013846.html,AMZN,livemint.com,"Future  directors  to  ask  if  Samara  is  owned,  controlled  by resident  Indians","Amazon.com Inc, debt-laden Future Group, Future Group, Mukesh Ambani, Reliance Industries Ltd, Samara Capital"
4c2117d8-945b-4d0f-8135-1f566b701229,2022-01-24 17:38:19,"Falcon Wealth Planning Buys ISHARES TRUST, Vanguard Total International Bond ETF, VANGUARD BD IDX FD, Sells Dimensional International Core Equity Market ETF, JPMorgan Chase, Dimensional U.S. Core Equi",https://www.gurufocus.com/news/1624561/falcon-wealth-planning-buys-ishares-trust-vanguard-total-international-bond-etf-vanguard-bd-idx-fd-sells-dimensional-international-core-equity-market-etf-jpmorgan-chase-dimensional-us-core-equity-2-etf,CELH,gurufocus.com,GuruFocus Article or News written by insider and the topic is about:,"GuruFocus, Article, News, insider, PFF, BNDX, BND, AMZN, TSLA, IEMG, DFIV, CELH, DFAX, PG, VOT, VO, DFAI, DFAC, VZ, SNDL, "
59567227-68fe-40c3-98f9-e0eb8d502935,2022-01-24 17:38:23,"MEMBERS Trust Co Buys JPMorgan Ultra-Short Income ETF, Apple Inc, General Electric Co, Sells The Home Depot Inc, Marathon Petroleum Corp, The Walt Disney Co",https://www.gurufocus.com/news/1624570/members-trust-co-buys-jpmorgan-ultrashort-income-etf-apple-inc-general-electric-co-sells-the-home-depot-inc-marathon-petroleum-corp-the-walt-disney-co,IEFA,gurufocus.com,GuruFocus Article or News written by insider and the topic is about:,"GuruFocus, Article, News, insider, JPST, AAPL, AMZN, GOOGL, DE, TSLA, DFUS, PPTY, GE, RSP, SHOP, PM, VIG, KD, "
4d7c1ed4-d6f3-47e5-8f40-46146db84498,2022-01-24 17:38:23,"Mkd Wealth Coaches, Llc Buys iShares MSCI EAFE ETF, Stellantis NV, iShares MSCI Intl Quality Factor ETF, Sells Flagstar Bancorp Inc, Salesforce.com Inc, iShares Core Moderate Allocation ETF",https://www.gurufocus.com/news/1624571/mkd-wealth-coaches-llc-buys-ishares-msci-eafe-etf-stellantis-nv-ishares-msci-intl-quality-factor-etf-sells-flagstar-bancorp-inc-salesforcecom-inc-ishares-core-moderate-allocation-etf,AGG,gurufocus.com,GuruFocus Article or News written by insider and the topic is about:,"GuruFocus, Article, News, insider, MSFT, GOOG, AAPL, AMZN, F, FB, EFA, STLA, IQLT, ACN, BRK.B, QYLD, FBC, CRM, AOM, VINO, "
773f140b-7608-48e9-b79c-7a14e3c2d31a,2022-01-25 17:38:26,"Tran Capital Management, L.p. Buys Block Inc, Signature Bank, PayPal Holdings Inc, Sells Fiserv Inc, Catalent Inc, Ball Corp",https://www.gurufocus.com/news/1625662/read,0J1G.L,gurufocus.com,GuruFocus Article or News written by insider and the topic is about:,"GuruFocus, Article, News, insider, PYPL, CLVT, SQ, SBNY, ENJY, DHRPA.PFD, KMX, GWRE, "
4014bf10-aaf0-4302-a863-0245dd8c884f,2022-01-25 18:16:09,Microsoft’s slowing cloud growth casts shadow over report,https://financialpost.com/investing/microsofts-slowing-cloud-growth-casts-shadow-over-report,AAPL.BA,financialpost.com,Microsoft shares dropped about 4.7 per cent in extended trading after declining 2.7 per cent to US$288.49 at the close in New York,
9df1f2ef-28b6-4b7a-926e-bb5ffebb2687,2022-01-25 18:57:00,"Microsoft offers strong forecast, lifting shares",https://www.reuters.com/business/microsoft-beats-quarterly-revenue-estimates-cloud-strength-2022-01-25/,AMZN,news.google.com,"Microsoft Corp on Tuesday forecast revenue for the current quarter broadly ahead of Wall Street targets, driven in part by its Intelligent Cloud unit.","MTPIX, BACT, BLR, CLOUDC, CMPNY, GEN, ITSE, ITSE08, NEWS1, PUBL, PXP, RES, RESF, SEMI, SOCI, SOFW, SOFW1, SWIT, TECH, TECH08, TEEQ, TEEQ08, TMT, WWW, AMERS, US, NAMER, TOPNWS, ENT, INTGAM, NETSV, TOPCMB, FIN, HOT, STX, MTGFX"
42b22347-ca8f-49a9-97d2-3cd68a828a0b,2022-01-26 17:38:24,"Hellman Jordan Management Co Inc Buys Tenable Holdings Inc, Cisco Systems Inc, iShares Biotechnology ETF, Sells Industrial Select Sector SPDR, Five9 Inc, Direxion Daily Financial Bull 3x Shares",https://www.gurufocus.com/news/1626721/hellman-jordan-management-co-inc--buys-tenable-holdings-inc-cisco-systems-inc-ishares-biotechnology-etf-sells-industrial-select-sector-spdr-five9-inc-direxion-daily-financial-bull-3x-shares,NVDAD.BA,gurufocus.com,GuruFocus Article or News written by insider and the topic is about:,"GuruFocus, Article, News, insider, GTLS, GM, TNA, LABU, HUM, AMZN, TENB, CSCO, IBB, HRI, ALB, VC, FAS, CMCSA, UPS, BIDU, SOXL, FCX, "
0b2c88d1-7f68-4c7e-ac17-7ff83c7e3862,2022-01-26 17:38:28,"Birinyi Associates Inc Buys ASML Holding NV, American Express Co, JPMorgan Chase, Sells Meta Platforms Inc, Lam Research Corp, The Trade Desk Inc",https://www.gurufocus.com/news/1626727/birinyi-associates-inc-buys-asml-holding-nv-american-express-co-jpmorgan-chase-sells-meta-platforms-inc-lam-research-corp-the-trade-desk-inc,AAPL.BA,gurufocus.com,GuruFocus Article or News written by insider and the topic is about:,"GuruFocus, Article, News, insider, AXP, JPM, RH, WSM, AB, ASML, PANW, ORCL, TXN, TTD, DASH, VZ, TGT, PLTR, LLY, "
bc823893-2695-44be-87c3-c84ad87a5f03,2022-01-26 18:36:55,Amazon workers eligible to hold union election at New York warehouse -NLRB By Reuters,https://www.investing.com/news/stock-market-news/amazon-workers-meet-requirements-to-hold-union-election-at-new-york-warehouse-nlrb-2749704,AMZN,investing.com,Amazon workers eligible to hold union election at New York warehouse -NLRB,
caf534fd-feb6-4ec0-b30b-90404f500547,2022-01-27 17:38:03,"Private Advisory Group LLC Buys PowerShares QQQ Trust Ser 1, Lululemon Athletica Inc, FIRST TR EXCH TRD, Sells International Business Machines Corp, iShares MSCI China ETF, FIRST TR EXCH TRD",https://www.gurufocus.com/news/1627597/private-advisory-group-llc-buys-powershares-qqq-trust-ser-1-lululemon-athletica-inc-first-tr-exch-trd-sells-international-business-machines-corp-ishares-msci-china-etf-first-tr-exch-trd,AMZN,gurufocus.com,GuruFocus Article or News written by insider and the topic is about:,"GuruFocus, Article, News, insider, FB, TIP, BILL, MRK, PFE, VNQ, QQQ, LULU, FNK, ETSY, XRT, DWAS, IBM, MCHI, FNY, VG, ALB, COF, "
0ffcbf86-5d67-4c4d-af71-f80ac0f2c9ef,2022-01-27 17:38:09,"Bessemer Group Inc Buys NVIDIA Corp, Intuit Inc, Northrop Grumman Corp, Sells PayPal Holdings Inc, Comcast Corp, Bristol-Myers Squibb Co",https://www.gurufocus.com/news/1627600/bessemer-group-inc-buys-nvidia-corp-intuit-inc-northrop-grumman-corp-sells-paypal-holdings-inc-comcast-corp-bristolmyers-squibb-co,AMZN,gurufocus.com,GuruFocus Article or News written by insider and the topic is about:,"GuruFocus, Article, News, insider, NVDA, INTU, NOC, ADBE, SPGI, VMC, NU, WFCPL.PFD, TREE, NTGR, PK, IDU, PGX, EMB, FEZ, KBE, TCS, MMYT, "
40f4a757-7956-4d56-b925-aa9d460a9bdb,2022-01-27 17:38:22,"Cambiar Investors Llc Buys iShares MSCI EAFE ETF, Barclays PLC, Constellation Brands Inc, Sells Itau Unibanco Holding SA, ASML Holding NV, Biogen Inc",https://www.gurufocus.com/news/1627619/read,STZ,gurufocus.com,GuruFocus Article or News written by insider and the topic is about:,"GuruFocus, Article, News, insider, EFA, IWD, RTX, SYY, GPS, PENN, BCS, STZ, ATVI, BAH, COLD, AMED, ITUB, BIIB, BAX, LUV, ULTA, BBBY, "
bc63c132-9b36-4055-a1fd-415524e60f4b,2022-01-28 17:38:24,"Tillar-Wenstrup Advisors, LLC Buys VanEck Investment Grade Floating Rate ETF, Union Pacific Corp, Apple Inc, Sells Vanguard Mortgage-Backed Securities ETF, Vanguard Short-Term Corporate Bond ETF, Gold",https://www.gurufocus.com/news/1628402/read,GSIE,gurufocus.com,GuruFocus Article or News written by insider and the topic is about:,"GuruFocus, Article, News, insider, FLTR, AAPL, PG, MSFT, BRK.B, UNP, PEP, COST, NKE, INTC, MCD, VMBS, VCSH, "
19d95423-4b95-4ec2-b424-a3097242c86a,2022-01-28 17:38:25,"Meritage Portfolio Management Buys Fidelity National Financial Inc, ASML Holding NV, Materials Select Sector SPDR, Sells Illumina Inc, Dropbox Inc, General Motors Co",https://www.gurufocus.com/news/1628404/meritage-portfolio-management-buys-fidelity-national-financial-inc-asml-holding-nv-materials-select-sector-spdr-sells-illumina-inc-dropbox-inc-general-motors-co,AMZN,gurufocus.com,GuruFocus Article or News written by insider and the topic is about:,"GuruFocus, Article, News, insider, LRCX, MRNA, CSCO, CVX, NWE, BMY, FNF, ASML, XLB, VCSH, GPI, VLUE, TT, NOMD, XLC, MNST, QRVO, ERIC, "
a5525115-c762-48cf-864e-2fdacfdf6da7,2022-01-28 17:41:00,"Top Stock Reports for Amazon, Verizon & Oracle",https://www.zacks.com/research-daily/1859160/top-stock-reports-for-amazon-verizon-oracle?cid=CS-ZC-FT-research_daily-1859160,VZ,zacks.com,"Today's Research Daily features new research reports on 16 major stocks, including Amazon.com, Inc. (AMZN), Verizon Communications Inc. (VZ), and Oracle Corporation (ORCL).","stock, stocks, investment, investment advice, investing, online trading, online investment, online stock trading, stock market, financial, financial planning, quote, quotes, stock quotes"
7758b6ad-ab35-4078-bae6-8e2226a0647a,2022-01-29 07:00:00,"Amazon, UPS, Exxon Are on Deck to Report Earnings in Coming Week",https://www.wsj.com/articles/amazon-ups-exxon-are-on-deck-to-report-earnings-in-coming-week-11643457605?mod=pls_whats_news_us_business_f,AMZ.DE,online.wsj.com,"Other heavyweights set to report quarterly results in the week ahead include tech’s Alphabet and Meta Platforms, and auto makers GM and Ford.","Energy, Crude Oil/Natural Gas Upstream Operations, Pharmaceuticals, Machinery, Metalworking Machinery, Retail/Wholesale, Food Retailing, Supermarkets/Grocery Stores, Specialty Retailing, Etailing, Couriers/Messengers, Healthcare/Life Sciences, Freight Transport/Logistics, E-commerce, Fossil Fuels, Industrial Goods, Online Service Providers, Integrated Oil/Gas, Media/Entertainment, Retail, Social Media Platforms/Tools, Technology, Transportation/Logistics, Financial Performance, Earnings, Corporate/Industrial News, Supply Chain, Content Types, Factiva Filters, C&E Industry News Filter, SYND, WSJ-PRO-WSJ.com, General Motors, GM, Alphabet, GOOGL, L3Harris Technologies, LHX, Apple, AAPL, Amazon.com, AMZN, Exxon Mobil, XOM, Meta Platforms, FB, Tractor Supply, TSCO, United Parcel Service, UPS, Activision Blizzard, ATVI, Honeywell International, HON, Advanced Micro Devices, AMD, Bristol Myers Squibb, BMY, Clorox, CLX, Emerson Electric, EMR, Ford Motor, F, Google, Match Group, MTCH, Exxon, Facebook, Bristol-Myers Squibb, financial performance, earnings, corporate, industrial news, supply chain, content types, factiva filters, c&e industry news filter, energy, crude oil, natural gas upstream operations, pharmaceuticals, machinery, metalworking machinery, retail, wholesale, food retailing, supermarkets, grocery stores, specialty retailing, etailing, couriers, messengers, healthcare, life sciences, freight transport, logistics, e-commerce, fossil fuels, industrial goods, online service providers, integrated oil, gas, media, entertainment, social media platforms, tools, technology, transportation"
3318d426-8c0f-4623-bb54-9ebdc133df2d,2022-01-29 11:12:00,Intel tumbles as investments weigh on profit forecast,https://businessmirror.com.ph/2022/01/30/intel-tumbles-as-investments-weigh-on-profit-forecast/,AMZN,businessmirror.com.ph,"Intel Corp. shares fell on Thursday after the company gave a disappointing profit forecast, fueling concern that Chief Executive Officer Pat Gelsinger’s costly turnaround plan will weigh heavily on the chipmaker’s financial performance.  Earnings will be 80 cents a share in the first quarter, excluding some items, Intel said Wednesday.…",
