id,publish_time,title,article_url,ticker,publisher,description,keywords
61a001e1-26a3-45db-b17d-40833bb44285,2022-01-02 07:45:22,CES to now end sooner than planned as Omicron cases surge,https://economictimes.indiatimes.com/tech/tech-bytes/ces-to-now-end-sooner-than-planned-as-omicron-cases-surge/articleshow/88649779.cms,GOOGL.BA,economictimes.indiatimes.com,"""The step was taken as an additional safety measure to the current health protocols that have been put in place for CES,"" the event organiser Consumer Technology Association said on Friday, announcing the event will now end on Jan. 7.","ces 2022, ces 2022 dates, omicron, omicron cases, covid-19"
0b822dd9-35c0-4968-bb94-b3f2c1263022,2022-01-02 15:01:37,"Amazon Driver Rescues 4-Month-Old And Parents From Colorado Wildfire, Family Says They 'Could Be Dead' Otherwise",https://www.benzinga.com/news/22/01/24855732/amazon-driver-rescues-4-month-old-and-parents-from-colorado-wildfire-family-says-they-could-be-dead,AMZN.SN,benzinga.com,A Colorado family says they,
d2867658-88ad-45e7-89e1-17b8ce80886d,2022-01-02 17:19:00,"Top 10 Most Searched Tickers On Benzinga Pro In 2021: Tesla, Apple, AMC, GameStop And More",https://markets.businessinsider.com/news/stocks/top-10-most-searched-tickers-on-benzinga-pro-in-2021-tesla-apple-amc-gamestop-and-more-1031073243,AAPL,markets.businessinsider.com,"Many of Benzinga’s most read stories in 2021 centered on the world of cryptocurrency, with Dogecoin (CRYPTO: DOGE) receiving huge interest f...",
bbc0df10-2abb-4faa-a44f-cbb4b7aea5e4,2022-01-03 17:42:19,The Rocket Science of Investing – Armageddon Yet to Arrive,https://investingcaffeine.com/2022/01/03/the-rocket-science-of-investing-armageddon-yet-to-arrive/,AAPL.BA,investingcaffeine.com,"In the face of an incredibly scary global pandemic, the stock market completed a phenomenal year (S&P 500 rocketed +27%) closing at a new all-time monthly record high, after also posting incredible results in 2020 (+16%) and 2019 (+29%). Naturally, the follow-on question I get most is, “What about next year?” And to this question,…",
7c0bbb42-b407-4adb-858a-2846a3143f49,2022-01-03 17:53:07,"Apple becomes first company to hit $3 trillion market value, then slips",https://financialpost.com/pmn/business-pmn/apple-becomes-first-company-to-hit-3-trillion-market-value-then-slips-2,AAPL.NE,financialpost.com,"Apple Inc on Monday became the first company to hit a $3 trillion stock market value, before ending the day a hair below that milestone, as investors bet the…",
482123a8-b1d7-4776-a682-1a167e84ffe7,2022-01-03 17:55:36,"Apple becomes first company to hit $3 trillion market value, then slips",https://www.marketscreener.com/quote/stock/APPLE-INC-4849/news/Apple-becomes-first-company-to-hit-3-trillion-market-value-then-slips-37454863/,GOGLD.BA,marketscreener.com,"Apple Inc on Monday became the first company to hit a $3 trillion stock market value, before ending the day a hair below that milestone, as investors bet the iPhone maker will keep launching... | January  3,  2022","APPLE INC. stock exchange, news, information, press release, apple, inc, on, monday, became, the, first, company, to, hit, trillion, stock, market, before, ending, day, hair, below, that, as, investors, bet, iphone, maker, will, keep | AAPL | US0378331005"
a4aad7b2-b3d1-4f3c-9f5c-24009c6d38bd,2022-01-04 17:38:05,"Silverleafe Capital Partners, LLC Buys Amazon.com Inc, Vanguard Total Bond Market ETF, Pacer Lunt Large Cap Alternator ETF, Sells Quadratic Interest Rate Volatility And Inflation H, BTC iShares MSCI E",https://www.gurufocus.com/news/1608790/read,SMH,gurufocus.com,GuruFocus Article or News written by insider and the topic is about:,"GuruFocus, Article, News, insider, AMZN, SMH, MSFT, FAS, SOXL, FHLC, BND, ALTL, FIDU, CIBR, UWM, UCYB, IVOL, EZU, CRUZ, EURL, AXL, GTBP, "
70c0317a-b8bc-4629-84cc-71bf170d3a90,2022-01-04 17:46:38,The Rocket Science of Investing -- Armageddon Yet to Arrive,https://www.gurufocus.com/news/1608794/the-rocket-science-of-investing--armageddon-yet-to-arrive,AMZ.DE,gurufocus.com,"GuruFocus Article or News written by Wade W. Slome, CFA, CFP and the topic is about: In the face of an incredibly scary global pandemic, the stock market completed a phenomenal year","GuruFocus, Article, News, Wade W. Slome, CFA, CFP, Warren Buffett, AMZN, AAPL, GOOG, GOOGL"
7b589651-b32a-4ea5-838b-ebd1ffab0e77,2022-01-04 18:01:18,"RBC Chooses Amazon, M&T, UnitedHealth As Top 2022 Stocks",https://www.thestreet.com/investing/rbc-chooses-amazon-mt-unitedhealth-top-stocks,BAMKF,thestreet.com,"'Our U.S. equity strategy team expects 2022 to be a year of solid but more moderate returns relative to 2021,' RBC said.","Banking, Energy, Stock, Health, Technology, Utilities, INVESTING, Utilities, Health Care, STOCKS, Investing Stocks, Financial Services, Technology, Investing, Amazon, Energy, Financial Services, Stocks"
6b7d0fe6-7b2b-448c-9c51-13ab0e5e0668,2022-01-05 17:44:37,"Stocks slump, Treasury yields rise on fear of a faster Fed pullback",https://www.theedgemarkets.com/article/stocks-slump-treasury-yields-rise-fear-faster-fed-pullback,APC.DE,theedgemarkets.com,BOSTON (Jan 6): U.S. stocks slid and Treasury yields jumped on Wednesday after meeting minutes released by the Federal Reserve indicated that it might not only raise interest rates sooner than expected but could also reduce its overall asset holdings to tame high inflation.,
20e93411-6ac8-4b78-b14a-ba21d5581b2e,2022-01-05 17:51:40,Rumble Announces AMC Ape Matt Kohrs Joining Platform And Record Site Numbers With Rand Paul Joining,https://markets.businessinsider.com/news/stocks/rumble-announces-amc-ape-matt-kohrs-joining-platform-and-record-site-numbers-with-rand-paul-joining-1031080392,AMZ.DE,markets.businessinsider.com,"Video platform Rumble shared several company updates Wednesday, including new user metrics and the addition of a well-known investor to the platfo...",
d1eb363c-2f2d-4d0b-92b1-212f34b6ce1b,2022-01-05 18:02:28,Factbox-U.S. automakers line up EV models to take on Tesla By Reuters,https://www.investing.com/news/stock-market-news/factboxus-automakers-line-up-ev-models-to-take-on-tesla-2731686,AMZ.DE,investing.com,Factbox-U.S. automakers line up EV models to take on Tesla,
2e5467db-224b-4059-8cc4-afffbf71498a,2022-01-06 17:53:35,"GameStop shares surge on plan to enter NFT, crypto markets",https://www.marketscreener.com/quote/stock/GAMESTOP-CORP-12790/news/GameStop-shares-surge-on-plan-to-enter-NFT-crypto-markets-37485180/,AMZN,marketscreener.com,"GameStop Corp is launching a division to develop a marketplace for nonfungible tokens  and establish cryptocurrency partnerships, a source familiar with the matter said on Thursday, boosting the... | January  6,  2022","GAMESTOP CORP. stock exchange, news, information, press release, gamestop, corp, is, launching, division, to, develop, marketplace, for, nonfungible, tokens, and, establish, cryptocurrency, source, familiar, with, the, matter, said, on, boosting | GME | US36467W1099"
042cb7c0-7a4f-45c1-a922-6a64a14edddf,2022-01-06 17:57:00,GameStop Entering NFT and Cryptocurrency Markets as Part of Turnaround Plan,https://www.wsj.com/articles/gamestop-entering-nft-and-cryptocurrency-markets-as-part-of-turnaround-plan-11641504417?mod=rss_Technology,AMZN,online.wsj.com,"The retailer is launching a division dedicated to the buzzy new technologies, according to people familiar with its plans, pushing the company into much-hyped areas as it tries to turn around its core videogame business.","kwexclusive, Computers/Consumer Electronics, Software, Applications Software, Retail/Wholesale, Specialty Retailing, Hobby/Toy/Game Stores, Blockchain Technology, Banking/Credit, Consumer Goods, Computing, Financial Services, Financial Technology, Games Software, Leisure/Travel Goods, Retail, Technology, Virtual Currencies/Cryptocurrencies, Corporate Strategy/Planning, Financial Performance, Earnings, New Products/Services, Capacity/Facilities, Corporate/Industrial News, Products/Services, Facility Openings, Content Types, Factiva Filters, C&E Industry News Filter, SYND, WSJ-PRO-WSJ.com, GameStop Cl A, GME, OpenSea, Ubisoft Entertainment S.A., UBI.FR, Zynga Cl A, ZNGA, Square Enix Holdings, 9684.TO, Ryan Cohen, Matt Furlong, corporate strategy, planning, financial performance, earnings, new products, services, capacity, facilities, corporate, industrial news, products, facility openings, content types, factiva filters, c&e industry news filter, computers, consumer electronics, software, applications software, retail, wholesale, specialty retailing, hobby, toy, game stores, blockchain technology, banking, credit, consumer goods, computing, financial services, financial technology, games software, leisure, travel goods, technology, virtual currencies, cryptocurrencies"
a08c7306-1d31-4138-8228-b4c1b582dc7a,2022-01-06 18:30:00,GameStop Entering NFT and Cryptocurrency Markets as Part of Turnaround Plan,https://www.wsj.com/articles/gamestop-entering-nft-and-cryptocurrency-markets-as-part-of-turnaround-plan-11641504417?mod=pls_whats_news_us_business_f,CHWY,online.wsj.com,"The retailer is launching a division dedicated to the buzzy new technologies, according to people familiar with its plans, pushing the company into much-hyped areas as it tries to turn around its core videogame business.","kwexclusive, Computers/Consumer Electronics, Software, Applications Software, Retail/Wholesale, Specialty Retailing, Hobby/Toy/Game Stores, Blockchain Technology, Banking/Credit, Consumer Goods, Computing, Financial Services, Financial Technology, Games Software, Leisure/Travel Goods, Retail, Technology, Virtual Currencies/Cryptocurrencies, Corporate Strategy/Planning, Financial Performance, Earnings, New Products/Services, Capacity/Facilities, Corporate/Industrial News, Products/Services, Facility Openings, Content Types, Factiva Filters, C&E Industry News Filter, SYND, WSJ-PRO-WSJ.com, GameStop Cl A, GME, OpenSea, Ubisoft Entertainment S.A., UBI.FR, Zynga Cl A, ZNGA, Square Enix Holdings, 9684.TO, Ryan Cohen, Matt Furlong, corporate strategy, planning, financial performance, earnings, new products, services, capacity, facilities, corporate, industrial news, products, facility openings, content types, factiva filters, c&e industry news filter, computers, consumer electronics, software, applications software, retail, wholesale, specialty retailing, hobby, toy, game stores, blockchain technology, banking, credit, consumer goods, computing, financial services, financial technology, games software, leisure, travel goods, technology, virtual currencies, cryptocurrencies"
d6bca841-cdf4-4579-b435-4e49564cea60,2022-01-07 17:38:05,"Vigilare Wealth Management Buys BTC iShares MSCI USA Min Vol Factor ETF, Coca-Cola Co, Guardant Health Inc, Sells iShares Russell 2000 ETF, Verizon Communications Inc, First Trust NASDAQ Clean Edge Gr",https://www.gurufocus.com/news/1611681/vigilare-wealth-management-buys-btc-ishares-msci-usa-min-vol-factor-etf-cocacola-co-guardant-health-inc-sells-ishares-russell-2000-etf-verizon-communications-inc-first-trust-nasdaq-clean-edge-green-energy-idx-fd,TGTX,gurufocus.com,GuruFocus Article or News written by insider and the topic is about:,"GuruFocus, Article, News, insider, USMV, PFE, TGTX, UNH, BA, VB, KO, GH, LIN, WM, DAL, MRNA, QCLN, DKNG, LYB, MINT, SHY, MBB, "
60a58e9c-b0c2-41b7-b4a2-1935a00dc6c0,2022-01-07 18:20:00,Berkshire Hathaway: The Next Trillion-Dollar Company?,https://www.gurufocus.com/news/1611727/berkshire-hathaway-the-next-trilliondollar-company,AMZ.DE,gurufocus.com,GuruFocus Article or News written by Margaret Moran and the topic is about: The rotation back to value favors Warren Buffett's storied conglomerate,"GuruFocus, Article, News, Margaret Moran, Warren Buffett, BRK.A, BRK.B, AAPL, MSFT, AMZN, GOOG, GOOGL, TSLA, F, GM, NVDA, FB"
cb40bacb-8d51-4222-be92-67f9b29b6b58,2022-01-07 18:24:30,Here's Credit Suisse's Monthly Top Stock List,https://www.thestreet.com/investing/heres-credit-suisse-monthly-top-stock-list,AMZ.DE,thestreet.com,"The new names on the list are Disney, Discover Financial Services, Emerson Electric and BioMarin Pharmaceutical.","Stock, Amazon, STOCKS, Investing Stocks, Microsoft, Stocks, Investing, INVESTING, Walt Disney"
82e81fb0-50c1-47d9-a1ef-2a3371a95d7d,2022-01-08 16:42:09,"Top 10 Stock Market Moving Headlines From Last Week: Tesla, Ark Innovation ETF, Bitcoin And More - Tesla Motors (TSLA)",https://www.benzinga.com/markets/cryptocurrency/22/01/24960446/top-10-stock-market-moving-headlines-from-last-week-tesla-ark-innovation-etf-bitcoin-and-m,TSLA34.SA,benzinga.com,Benzinga debuted a new show on its YouTube channel Friday. The show will air every Friday and recap the top events of the week for stock traders.,
822a3a96-6270-4148-9c68-0dc5b9d99398,2022-01-08 16:43:05,"Top 10 Stock Market Moving Headlines From Last Week: Tesla, Ark Innovation ETF, Bitcoin And More",https://markets.businessinsider.com/news/stocks/top-10-stock-market-moving-headlines-from-last-week-tesla-ark-innovation-etf-bitcoin-and-more-1031088848,1QZ.DE,markets.businessinsider.com,Benzinga debuted a new show on its YouTube channel Friday. The show will air every Friday and recap the top events of the week for stock traders. ...,
862833f6-cead-47c5-aafd-4d6b6a4ae56c,2022-01-08 17:19:52,10 Dividend Stocks in Adage Capital’s Portfolio,https://www.insidermonkey.com/blog/10-dividend-stocks-in-adage-capitals-portfolio-1018798/,AMZ.DE,insidermonkey.com,"In this article, we discuss the 10 dividend stocks in Adage Capital's Portfolio.",
889b7917-0fcc-4141-8bcf-4f59ea466187,2022-01-09 07:48:42,"Russell Investments Group Ltd. Buys 5,546 Shares of Amazon.com, Inc. (NASDAQ:AMZN)",https://etfdailynews.com/news/russell-investments-group-ltd-buys-5546-shares-of-amazon-com-inc-nasdaqamzn/,AMZN,etfdailynews.com,"Russell Investments Group Ltd. raised its holdings in Amazon.com, Inc. (NASDAQ:AMZN) by 1.8% during the 3rd quarter, Holdings Channel reports. The firm owned 312,214 shares of the e-commerce giant’s stock after buying an additional 5,546 shares during the quarter. Amazon.com makes up about 1.7% of Russell Investments Group Ltd.’s holdings, making the stock its 3rd […]",
64c5bbea-0ce3-4c63-9e4c-a42c2464399a,2022-01-09 08:00:00,Electric-Vehicle Race Heats Up as Detroit Makes Its Move,https://www.wsj.com/articles/electric-vehicle-race-heats-up-as-detroit-makes-its-move-11641733202?mod=rss_Technology,AMZN,online.wsj.com,"GM, Ford and Chrysler-owned Stellantis are looking to close the gap versus startups with initiatives such as new battery-powered pickups and electric-van sales to Amazon.","Motor Vehicles, Passenger Cars, Alternative Fuel Vehicles, Motor Vehicle Parts, Retail/Wholesale, Etailing, Audiovisual Production, Television Program Production, Automotive, E-commerce, Online Service Providers, Media/Entertainment, Retail, Technology, Financial Performance, Earnings, Sales Figures, New Products/Services, Corporate/Industrial News, Products/Services, Content Types, Factiva Filters, C&E Industry News Filter, SYND, WSJ-PRO-WSJ.com, Volkswagen Non-Vtg Pfd., VOW3.XE, Amazon.com, AMZN, Chrysler, Ford Motor, F, General Motors, GM, Stellantis N.V., STLA.MI, Ford, Carlos Tavares, Dan Levy, Mary Barra, financial performance, earnings, sales figures, new products, services, corporate, industrial news, products, content types, factiva filters, c&e industry news filter, motor vehicles, passenger cars, alternative fuel vehicles, motor vehicle parts, retail, wholesale, etailing, audiovisual production, television program production, automotive, e-commerce, online service providers, media, entertainment, technology"
d28fff65-6ef2-40b0-b566-43f0c01b9068,2022-01-09 15:46:53,New Agreement Heightens Optimism Surrounding Amazon,https://www.gurufocus.com/news/1611947/read,STLA,gurufocus.com,GuruFocus Article or News written by Howard Riell and the topic is about: Analyst likens online retailer to a 'coiled spring',"GuruFocus, Article, News, Howard Riell, AMZN, STLA"
b1364003-4f35-44f9-a305-b2aa2e6a46d2,2022-01-10 17:21:01,A Volatile Ride For Tech Stocks And Crypto As Worries About Inflation Resurface,https://www.valuewalk.com/a-volatile-ride-for-tech-stocks-and-crypto-as-worries-about-inflation-resurface/,AAPL,valuewalk.com,A volatile ride for tech stocks. NVIDIA (NASDAQ:NVDA) and Mastercard (NYSE:MA) registered falls of more than 5% before recovering slightly.,
54710d40-1514-4368-9a6e-cdceac98bd1b,2022-01-10 17:38:04,"Harbor Investment Advisory, Llc Buys Vanguard Short-Term Inflation-Protected Securities, SPDR MSCI USA StrategicFactors SM ETF, Vanguard Total Stock Market ETF, Sells FIGS Inc, Annaly Capital Manageme",https://www.gurufocus.com/news/1613206/harbor-investment-advisory-llc-buys-vanguard-shortterm-inflationprotected-securities-spdr-msci-usa-strategicfactors-sm-etf-vanguard-total-stock-market-etf-sells-figs-inc-annaly-capital-management-inc-selectquote-inc,^XMHQ-IV,gurufocus.com,GuruFocus Article or News written by insider and the topic is about:,"GuruFocus, Article, News, insider, VTIP, QUS, VTI, ACWX, VEU, BKNG, AVTR, OLED, XMHQ, CTRA, JKE, GVI, PFIX, FPF, BHP, CIEN, PDP, PRF, "
9be491f4-cc94-4c57-9791-9de12751b934,2022-01-10 17:38:08,"Crossmark Global Holdings, Inc. Buys Cigna Corp, Honda Motor Co, Crown Castle International Corp, Sells Eli Lilly and Co, Bank of America Corp, RELX PLC",https://www.gurufocus.com/news/1613209/crossmark-global-holdings-inc-buys-cigna-corp-honda-motor-co-crown-castle-international-corp-sells-eli-lilly-and-co-bank-of-america-corp-relx-plc,HMC,gurufocus.com,GuruFocus Article or News written by insider and the topic is about:,"GuruFocus, Article, News, insider, CI, HMC, ERIC, CCI, PG, TGNA, FERG, FSV, BAH, WOLF, AA, BRKR, KOF, DOC, FLGT, VSTO, STMP, KSU, "
216f097f-5641-4d30-b658-92324e365fc7,2022-01-11 17:35:02,Tech Rebounds With Risk Appetite -- Tech Roundup,https://www.marketscreener.com/quote/index/NASDAQ-COMP-4944/news/Tech-Rebounds-With-Risk-Appetite-Tech-Roundup-37522715/,AMZN.SN,marketscreener.com,"Shares of technology companies recouped some of their recent losses as risk appetite rebounded. 

  The Nasdaq Composite staged one of its biggest comebacks in recent years Monday, finishing in the... | January 11,  2022","NASDAQ COMP. stock exchange, news, information, press release, shares, of, technology, companies, recouped, some, their, recent, losses, as, risk, appetite, the, nasdaq, composite, staged, one, its, biggest, comebacks, in, years, finishing, in | COMP | XC0009694271"
ef85a99a-23dc-43b4-9190-7ee7c8b191e1,2022-01-11 18:00:00,Data Center Market to Grow by USD 519.34 Bn | Adoption of Multi-cloud and Network Upgrades to Support 5G will Drive Growth | Technavio,https://www.prnewswire.com:443/news-releases/data-center-market-to-grow-by-usd-519-34-bn--adoption-of-multi-cloud-and-network-upgrades-to-support-5g-will-drive-growth--technavio-301457200.html,AMZN.MX,prnewswire.com,/PRNewswire/ -- The data center market is expected to grow by USD 519.34 billion from 2020 to 2025. The market is anticipated to witness healthy growth at a...,Technavio
859d6c95-afce-4d97-9103-a4bd5a30f807,2022-01-11 18:49:12,Amazon workers in Alabama to vote by mail in do-over union election,https://www.foxbusiness.com/economy/amazon-workers-in-alabama-to-vote-by-mail-in-re-run-union-election,AMZN,foxbusiness.com,"Amazon workers in Bessemer, Alabama, will be able to vote by mail in a do-over union election, the National Labor Relations Board announced Tuesday.",
88d9d37b-01b2-4e55-aa89-07b4f73ba9a1,2022-01-12 15:00:05,NFL viewership rises 10% as close games bring fans back,https://adage.com/article/media/nfl-viewership-rises-10-close-games-bring-fans-back/2392766,DISND.BA,adage.com,The uptick comes after ratings fell 7% last season.,
c59a2b1d-625e-4a76-8398-ce64b2903536,2022-01-12 17:38:15,"Bridge Creek Capital Management LLC Buys Amazon.com Inc, Teleflex Inc, Walmart Inc, Sells Bank of New York Mellon Corp, Sylvamo Corp",https://www.gurufocus.com/news/1615508/bridge-creek-capital-management-llc-buys-amazoncom-inc-teleflex-inc-walmart-inc-sells-bank-of-new-york-mellon-corp-sylvamo-corp,JPM,gurufocus.com,GuruFocus Article or News written by insider and the topic is about:,"GuruFocus, Article, News, insider, AMZN, TFX, WMT, TSLA, O, HSY, BK, SLVM, "
0cccea58-63d4-4ffc-838d-4ca2bff91d9e,2022-01-12 17:38:17,"State of Alaska, Department of Revenue Buys Realty Income Corp, Bio-Rad Laboratories Inc, Monolithic Power Systems Inc, Sells , Change Healthcare Inc, Texas Pacific Land Corp",https://www.gurufocus.com/news/1615512/state-of-alaska-department-of-revenue-buys-realty-income-corp-biorad-laboratories-inc-monolithic-power-systems-inc-sells--change-healthcare-inc-texas-pacific-land-corp,MPWR,gurufocus.com,GuruFocus Article or News written by insider and the topic is about:,"GuruFocus, Article, News, insider, O, BIO, PRU, MPWR, ORLY, CRUS, SNDR, ONL, AA, ACI, FNF, LYLT, KSU, CHNG, ZM, COR, VER, ANAT, "
acf2de2b-e28f-47c7-a2a8-088338b5f1c0,2022-01-13 18:00:00,"Artificial Intelligence Platforms Market to grow by USD 17.29 bn | Evolving Opportunities with Alphabet Inc., Amazon.com Inc. & Microsoft Corp. | 17000+ Technavio Reports",https://www.prnewswire.com:443/news-releases/artificial-intelligence-platforms-market-to-grow-by-usd-17-29-bn--evolving-opportunities-with-alphabet-inc-amazoncom-inc--microsoft-corp--17000-technavio-reports-301459560.html,GOOGL.BA,prnewswire.com,/PRNewswire/ -- 68% of the growth will originate from North America for the artificial intelligence platforms market. The US is the key market for artificial...,Technavio
98e2142c-b907-478a-bad5-b9a363c05169,2022-01-13 18:30:00,Online Grocery Delivery Services Market to grow by USD 800 bn| Increased Popularity & Adoption of e-commerce Platform to Boost Growth | 17000+ Technavio Reports,https://www.prnewswire.com:443/news-releases/online-grocery-delivery-services-market-to-grow-by-usd-800-bn-increased-popularity--adoption-of-e-commerce-platform-to-boost-growth--17000-technavio-reports-301459562.html,AMZ.DE,prnewswire.com,"/PRNewswire/ -- The ""Online Grocery Delivery Services Market by End-user (Individuals and Others) and Geography (APAC, Europe, North America, South America,...",Technavio
da823d1b-637a-4a10-b9d6-8164f6ec1f46,2022-01-13 18:42:00,"Worried about a bubble? Why you should overweight U.S. equities this year, according to Goldman Sachs",https://www.marketwatch.com/story/worried-about-a-bubble-why-you-should-overweight-u-s-equities-this-year-according-to-goldman-sachs-11642117373,AAPL.NE,marketwatch.com,"Investors should favor U.S. equities this year even as valuations are historically high and the Federal Reserve moves toward tightening its monetary policy,...","article_normal, Financial Investment Services, Security Brokering/Dealing, Internet Search Engines, Financial Services, Online Service Providers, Investing/Securities, Technology, Monetary Policy, Economic News, Equity Markets, Commodity/Financial Market News, Content Types, Factiva Filters, C&E Exclusion Filter, Apple Inc., AAPL, Netflix Inc., NFLX, Amazon.com Inc., AMZN, Tesla Inc., TSLA, Alphabet Inc. Cl C, GOOG, monetary policy, economic news, equity markets, commodity, financial market news, content types, factiva filters, c&e exclusion filter, financial investment services, security brokering, dealing, internet search engines, financial services, online service providers, investing, securities, technology"
95fe6acc-30e9-4614-bcde-b6b3e50fd17f,2022-01-14 17:45:48,US Billionaire Bill Miller Bets 50% of His Wealth in Bitcoin,https://www.thestreet.com/investing/cryptocurrency/fund-manager-bill-miller-says-50-personal-wealth-in-bitcoin,AMZ.DE,thestreet.com,Star fund manager Bill Miller says 'bitcoin is the only economic entity where supply isn't affected by demand.',"INVESTING, Cryptocurrency, Bitcoin, CRYPTOCURRENCY, Bitcoin, Cryptocurrency, STOCKS"
c7243f70-c0a1-47f5-acef-19b42b0db440,2022-01-14 18:42:54,Netflix augmente le prix de son abonnement mensuel aux États-Unis et au Canada,https://www.zonebourse.com/actualite-bourse/Netflix-augmente-le-prix-de-son-abonnement-mensuel-aux-Etats-Unis-et-au-Canada--37551913/,NFLX34.SA,zonebourse.com,"Netflix Inc a augmenté le prix de son abonnement mensuel de 1 à 2 dollars par mois aux États-Unis selon le plan, a annoncé vendredi la société, pour aider à payer de nouveaux programmes afin d'être...",
3ea4e2de-9d0c-447b-8687-7797b8b83a59,2022-01-14 18:59:16,"Netflix raises monthly subscription prices in U.S., Canada",https://www.foxbusiness.com/lifestyle/netflix-raises-monthly-subscription-prices-u-s-canada,NFLX34.SA,foxbusiness.com,"Netflix Inc has raised its monthly subscription price by $1 to $2 per month in the United States depending on the plan, the company said on Friday, to help pay for new programming to compete in the crowded streaming TV market.",
489d424d-bee2-420b-bc53-310d42c16eff,2022-01-15 16:54:18,10 Penny Stocks that Pay Dividends,https://www.insidermonkey.com/blog/10-penny-stocks-that-pay-dividends-1016956/,YRI.TO,insidermonkey.com,"Penny stocks usually trade under $5 per share. Generally, most penny stocks are traded through over-the-counter, or OTC, transactions or similar methods.",
c1ed32ae-f8eb-4b15-b398-7f4d1aed98ff,2022-01-15 17:39:44,Apple to require employee proof of COVID-19 booster,https://www.foxbusiness.com/technology/apple-to-require-employee-proof-of-covid-19-booster,AAPL.BA,foxbusiness.com,Apple Inc will require retail and corporate employees to provide proof of a COVID-19 booster shot,
