id,publish_time,title,article_url,ticker,publisher,description,keywords
b0514b7e-27ae-4b7c-97a1-9eb4d5ec5c50,2022-01-29 16:08:41,"Fort L.P. Has $227,000 Stock Position in Amazon.com, Inc. (NASDAQ:AMZN)",https://etfdailynews.com/news/fort-l-p-has-227000-stock-position-in-amazon-com-inc-nasdaqamzn/,AMZN,etfdailynews.com,"Fort L.P. lowered its holdings in Amazon.com, Inc. (NASDAQ:AMZN) by 52.4% during the third quarter, according to its most recent filing with the Securities & Exchange Commission. The fund owned 69 shares of the e-commerce giant’s stock after selling 76 shares during the quarter. Fort L.P.’s holdings in Amazon.com were worth $227,000 at the end […]",
3820d1b3-04d1-4c17-8b62-183f1b4104f0,2024-09-02 08:00:36,The Art of Valuation: Discovering Amazon.com Inc's Intrinsic Value,https://www.gurufocus.com/news/2514436/the-art-of-valuation-discovering-amazoncom-incs-intrinsic-value,AMZN,gurufocus.com,"In this article, we will take a look into Amazon.com Inc's (AMZN) DCF analysis, a reliable and data-driven approach to estimating its intrinsic value. Instead o","GuruFocus, Article, News, GuruFocus Research, AMZN"
abbda893-aa65-4259-a1cb-5952bfbef0e2,2024-09-02 08:11:06,"Tech market values fall on AI costs and recession fears; Eli Lilly, Berkshire gain By Reuters",https://www.investing.com/news/economy-news/tech-market-values-fall-on-ai-costs-and-recession-fears-eli-lilly-berkshire-gain-3596942,AMZN,investing.com,"Tech market values fall on AI costs and recession fears; Eli Lilly, Berkshire gain",
bf7ba340-8d38-41bd-b8bf-fd5303f9295d,2024-09-02 10:00:00,"Smart Home Market Surges to USD 1048.72 Billion by 2031, Propelled by 23.60% CAGR - Verified Market Research®",https://www.globenewswire.com/news-release/2024/09/02/2939118/0/en/Smart-Home-Market-Surges-to-USD-1048-72-Billion-by-2031-Propelled-by-23-60-CAGR-Verified-Market-Research.html,AMZN.MX,globenewswire.com,"The Smart Home Market is driven by increasing consumer demand for convenience, energy efficiency, and enhanced security. The proliferation of IoT devices...","Verified Market Research, Smart Home Market, IoT devices, smart technologies, AI and voice assistants, market research analysis, market forecast"
0a4cec29-8812-49a7-92d4-5be743ff9fe0,2024-09-04 17:38:04,3 Reasons To Buy VIG Instead Of SPY (NYSEARCA:VIG),https://seekingalpha.com/article/4719063-3-reasons-to-buy-vig-instead-of-spy,SPY,seekingalpha.com,SPY has outperformed the Vanguard Dividend Appreciation Index Fund over the long term and over the past several years. Read why VIG ETF is a better investment.,
7b118703-9288-4a02-b813-8b579ee42049,2024-09-04 18:29:43,S&P500 i Nasdaq nadal spadają,https://www.pb.pl/s-p500-i-nasdaq-nadal-spadaja-1224635,AMZN,pb.pl,"Średnia Przemysłowa Dow Jones wzrosła o 0,1 proc. S&P500 spadł o prawie 0,2 proc., a Nasdaq Composite kończył sesję 0,3 proc. stratą.",
d2a67f78-60db-44db-b907-e0335643c10f,2024-09-04 19:13:09,FNGU: Derisking May Impact This Fund (NYSEARCA:FNGU),https://seekingalpha.com/article/4719077-fngu-derisking-may-impact-this-fund,SNOW,seekingalpha.com,MicroSectors™ FANG+™ Index 3X Leveraged is not suitable for buy-and-hold with recent bearish sentiment suggesting a SELL rating. Learn more on FNGU ETN here.,
40a00dcf-e920-412c-88ef-fc8f25f4944c,2024-09-06 16:35:30,"Рынок акций США закрылся падением, Dow Jones снизился на 1,01% От Investing.com",https://ru.investing.com/news/stock-market-news/article-2500414,WHLR,ru.investing.com,"Рынок акций  США закрылся падением, Dow Jones снизился на 1,01%",
28212ead-900f-439e-b86d-c52ac0a2f637,2024-09-06 16:35:41,"Ações fecharam o pregão em queda e o Índice Dow Jones Industrial Average recuou 1,01% Por Investing.com",https://br.investing.com/news/stock-market-news/eua--acoes-fecharam-o-pregao-em-queda-e-o-indice-dow-jones-industrial-average-recuou-101-1334487,WHLR,br.investing.com,"E.U.A. - Ações fecharam o pregão em queda e o Índice Dow Jones Industrial Average recuou 1,01%",
272986c9-6b8a-4fca-ab2a-ca4a27ce0c19,2024-09-06 17:30:23,Trade Overview: Where Gurus Found Value in the 2nd Quarter,https://www.gurufocus.com/news/2518469/trade-overview-where-gurus-found-value-in-the-2nd-quarter,LNDAF,gurufocus.com,"With the latest round of 13F filings released over the past month, investors and market watchers alike are interested in seeing where the major hedge fund manag","GuruFocus, Article, News, Sydnee Gatewood, George Soros, Tweedy Browne, MSFT, GOOGL, META, UNH, AAPL, CVS, XOM, TSM, NTRA, MOH, NWSA, PXD, SWAV, STLA, XMAD:LDA, SPY"
40898410-7846-48f4-a219-6a20c65b3469,2024-09-07 05:48:55,Do Analysts Believe That Amazon.com Inc (AMZN) Is The Safest Stock to Invest In Now?,https://www.insidermonkey.com/blog/do-analysts-believe-that-amazon-com-inc-amzn-is-the-safest-stock-to-invest-in-now-1346920/,AMZ.DE,insidermonkey.com,We recently compiled a list titled Starter Stock Portfolio: 10 Safe Stocks To Invest In Now.,
c4202b1b-03d2-44b6-9f19-78fc11eaa3bc,2024-09-07 10:00:00,MercadoLibre Stock: Fade The Rally Before Jumping Back In (NASDAQ:MELI),https://seekingalpha.com/article/4719694-mercadolibre-fade-the-rally-before-jumping-back-in-meli-stock,AMZN,seekingalpha.com,"Learn why MercadoLibre's high growth potential and strong performance metrics make it a compelling investment opportunity, despite its premium valuation. Read more here.",
6eb2acee-f94c-4f92-bdae-ac65ee9a8e1e,2024-09-07 10:00:00,Shopify: Bullish Despite Macro Headwinds - Reiterate Buy (NYSE:SHOP),https://seekingalpha.com/article/4719538-shopify-bullish-despite-macro-headwinds-reiterate-buy,SHOP.TO,seekingalpha.com,SHOP's uptrend continues to imply robust bullish support despite the uncertain macroeconomic outlook and the supposedly tightened discretionary spending.,
e166f274-11c8-4148-8d1c-39484f88ce77,2024-09-08 07:47:15,"ETV: Decent For Income, But Not As Good At Protecting Against Inflation As Other Options",https://seekingalpha.com/article/4719768-etv-decent-for-income-not-good-at-protecting-against-inflation-as-other-options,AAPL,seekingalpha.com,"Eaton Vance Tax-Managed Buy-Write Opportunities Fund offers a high yield of 9.08%, selling index call options on S&P 500 and NASDAQ-100. Read more on ETV CEF here.",
144ae678-fda3-4bee-aa04-1a3644a9c466,2024-09-08 10:45:00,Sea Limited: Still Dirt Cheap Despite The Recent Rally (NYSE:SE),https://seekingalpha.com/article/4719748-sea-limited-still-dirt-cheap-despite-the-recent-rally,AMZN,seekingalpha.com,Sea Limited has demonstrated its successful reversal from the previous cash burn. Read why we reiterate our buy rating on SE stock.,
c8a4569c-5c3a-44df-8c54-e18c87fe7a30,2024-09-08 16:28:24,"Amazon.com, Inc. (AMZN): A Magic Formula Stock You Should Pay Attention To",https://www.insidermonkey.com/blog/amazon-com-inc-amzn-a-magic-formula-stock-you-should-pay-attention-to-1347983/,AMZN,insidermonkey.com,"We recently compiled a list of the 10 Best Magic Formula Stocks For The Rest Of 2024. In this article, we are going to take a look at where Amazon.com, Inc.",
b3380543-d997-4a9d-833c-822519927287,2024-09-09 16:39:01,FXD: Factor-Based Consumer Discretionary ETF You Should Avoid (NYSEARCA:FXD),https://seekingalpha.com/article/4720011-fxd-factor-based-consumer-discretionary-etf-you-should-avoid,LMO.DE,seekingalpha.com,First Trust Consumer Discretionary AlphaDEX Fund is a highly volatile consumer discretionary ETF with a high 0.61% expense ratio and $1.43 billion in assets. Learn more about FXD ETF here.,
53d5b8cf-db3f-4a19-a296-ed4ad4a23577,2024-09-09 16:41:42,"Google aimed to control web ad tech, US prosecutor says as trial begins",https://www.livemint.com/news/world/google-aimed-to-control-web-ad-tech-us-prosecutor-says-as-trial-begins-11725914502620.html,AMZN.MX,livemint.com,"TECH-ANTITRUST/GOOGLE-ADTECH (UPDATE 1, PIX):UPDATE 1-Google aimed to control web ad tech, US prosecutor says as trial begins","Google, antitrust, online advertising, Justice Department, competition"
13dfc536-2ebd-445a-8124-4bc8616f15e2,2024-09-09 18:43:10,"Amazon.com, Inc. (AMZN) Goldman Sachs Communacopia + Technology Conference (Transcript)",https://seekingalpha.com/article/4720036-amazon-com-inc-amzn-goldman-sachs-communacopia-technology-conference-transcript,NVDA.MI,seekingalpha.com,"Amazon.com, Inc. (NASDAQ:AMZN) Goldman Sachs Communacopia + Technology Conference September 9, 2024 4:05 PM ETCompany ParticipantsMatt Garman - CEO of...",
