id,publish_time,title,article_url,ticker,publisher,description,keywords
632373bb-666b-42f0-ac91-6f6a337a6fdd,2023-02-09 17:58:04,"ROSEN, GLOBALLY RECOGNIZED INVESTOR COUNSEL, Encourages International Business Machines Corporation Investors with Losses to Secure Counsel Before Important Deadline in Securities Class Action Commenc",https://www.asiaone.com/business/rosen-globally-recognized-investor-counsel-encourages-international-business-machines,IBM.MX,asiaone.com,"ROSEN, GLOBALLY RECOGNIZED INVESTOR COUNSEL, Encourages International Business Machines Corporation Investors with Losses to Secure Counsel Before Important Deadline in Securities Class Action Commenced by the Firm – IBM
 
 GlobeNewswire
 
 February 09, 2023
 
 
 
 NEW YORK, Feb. 10, 2023 (GLOBE NEWSWIRE) -- WHY: Rosen Law Firm, a global investor rights law firm, reminds...",
1efe59cc-de9a-436e-9bbe-23d3eb4c1d37,2023-02-09 17:34:00,Xerox Holdings Corp. stock underperforms Thursday when compared to competitors,https://www.marketwatch.com/data-news/xerox-holdings-corp-stock-underperforms-thursday-when-compared-to-competitors-a82508-f4031f820899,IBM,marketwatch.com,"Shares of Xerox Holdings Corp. slid 1.56% to $16.44 Thursday, on what proved to be an all-around poor trading session for the stock market, with the S&P 500...","article_normal, Xerox Holdings, XRX, Xerox Holdings Corp., US:XRX"
309c44c5-a1dc-4b12-a2a9-3cda2d075aaf,2023-02-09 12:20:00,Orthopedic Software Global Market Report 2022 - Sector to Reach $427.3 Million by 2027 at a CAGR of 6.44%,https://www.prnewswire.com/news-releases/orthopedic-software-global-market-report-2022---sector-to-reach-427-3-million-by-2027-at-a-cagr-of-6-44-301742420.html,MDRX,prnewswire.com,"/PRNewswire/ -- The ""Orthopedic Software Market: Global Industry Trends, Share, Size, Growth, Opportunity and Forecast 2022-2027"" report has been added to...",Research and Markets
