id,publish_time,title,article_url,ticker,publisher,description,keywords
cc2388a8-bb2c-4c64-87af-fcb0bde9038c,2023-03-01 14:22:00,"ROSEN, A LEADING INVESTOR RIGHTS LAW FIRM, Encourages International Business Machines Corporation Investors to Secure Counsel Before Important Deadline in Securities Class Action Initiated by the Firm",https://www.asiaone.com/business/rosen-leading-investor-rights-law-firm-encourages-international-business-machines,IBM.MX,asiaone.com,"ROSEN, A LEADING INVESTOR RIGHTS LAW FIRM, Encourages International Business Machines Corporation Investors to Secure Counsel Before Important Deadline in Securities Class Action Initiated by the Firm – IBM
 
 GlobeNewswire
 
 March 01, 2023
 
 
 
 NEW YORK, March 01, 2023 (GLOBE NEWSWIRE) -- WHY: Rosen Law Firm, a global investor rights law firm, reminds...",
690f57f2-cee1-4b58-bdfb-d5b7de6255d6,2023-03-01 14:22:00,"ROSEN, A LEADING INVESTOR RIGHTS LAW FIRM, Encourages International Business Machines Corporation Investors to Secure Counsel Before Important Deadline in Securities Class Action Initiated by the Firm",https://www.globenewswire.com/news-release/2023/03/01/2618627/673/en/ROSEN-A-LEADING-INVESTOR-RIGHTS-LAW-FIRM-Encourages-International-Business-Machines-Corporation-Investors-to-Secure-Counsel-Before-Important-Deadline-in-Securities-Class-Action-Ini.html,IBM,globenewswire.com,"NEW YORK, March  01, 2023  (GLOBE NEWSWIRE) -- WHY: Rosen Law Firm, a global investor rights law firm, reminds purchasers of the securities of...","The Rosen Law Firm PA, Big Blue, IBM, International Business Machine, Computer, IBM Cloud, Class Action"
d458bcea-3d0b-41d6-be63-96c05cff0f76,2023-03-01 07:57:12,IBM Fortifies Regional Presence With New Japan Innovation Hub,https://finance.yahoo.com/news/ibm-fortifies-regional-presence-japan-125712043.html?.tsrc=rss,IBM.DE,finance.yahoo.com,"IBM is developing the Cebu Japan Innovation Hub in the Philippines CIC, which serves more than 200 clients worldwide with automation, analytics and AI services.",
