id,publish_time,title,article_url,ticker,publisher,description,keywords
057f6c7e-abb6-4ebd-a50c-75a71feac4e9,2023-03-21 18:15:00,Electronic Clinical Outcome Assessment Solutions Market Report 2023: Sector to Reach $6.27 Billion by 2032 with a Rise in Clinical Trials and Increased Acceptance of eCOA Solutions,https://www.prnewswire.com/news-releases/electronic-clinical-outcome-assessment-solutions-market-report-2023-sector-to-reach-6-27-billion-by-2032-with-a-rise-in-clinical-trials-and-increased-acceptance-of-ecoa-solutions-301777512.html,ORC.DE,prnewswire.com,"/PRNewswire/ -- The ""Electronic Clinical Outcome Assessment Solutions Market Share, Size, Trends, Industry Analysis Report, By Delivery Mode; By End-Use; By...",Research and Markets
a4a87c01-b4ad-4648-975b-1444f5143147,2023-03-21 17:33:39,Nvidia turns to AI cloud rental to spread new technology By Reuters,https://www.investing.com/news/economy/nvidia-turns-to-ai-cloud-rental-to-spread-new-technology-3036169,APC.DE,investing.com,Nvidia turns to AI cloud rental to spread new technology,
17ce3891-44c4-4f32-9051-07c9e985ca2b,2023-03-21 11:32:05,Manchester & London Investment Trust Plc - Half-year Report,https://www.marketscreener.com/quote/stock/MANCHESTER-LONDON-INVES-4001805/news/Manchester-London-Investment-Trust-Plc-Half-year-Report-43302708/,AAPL,marketscreener.com,"21 March 2023

MANCHESTER AND LONDON INVESTMENT TRUST PLC



The Company today announces its Half-yearly report for the six months ended 31 January 2023. A copy of the Half-Yearly Report can be... | March 21,  2023","MANCHESTER & LONDON INVESTMENT TRUST PLC stock exchange, news, information, press release, 21, march, and, london, investment, trust, company, today, announces, its, report, for, the, six, months, ended, 31, january, copy, of, can | MNL | GB0002258472"
