ticker,sentiment,sentiment_score,news_id,time,title,article_url
INTC,positive,0.9051143527030945,37uAK5azPV9RaU-XPUTCC5B-_8NpbTUYpX39hvPBgOw,2024-03-13 16:21:15,AI Tailwinds Boost Super Micro Computer Analyst's Bull Case: 'Expect Strong Revenue Growth',https://www.benzinga.com/analyst-ratings/analyst-color/24/03/37662430/ai-tailwinds-boost-super-micro-computer-analysts-bull-case-expect-strong-revenue-gr
INTC,neutral,0.0,MSCnlUaOZN87UNW_JOlVePiX0DGBcWMz1m5VZHiQlns,2024-03-13 10:20:06,Should First Trust Dow 30 Equal Weight ETF (EDOW) Be on Your Investing Radar?,https://www.zacks.com/stock/news/2239700/should-first-trust-dow-30-equal-weight-etf-edow-be-on-your-investing-radar
INTC,neutral,0.0,ivB9_S0xx3joCYdHZMHOiubLd90zoDPDSkIsJ8kkVGM,2024-03-13 10:20:05,Should You Invest in the First Trust Indxx NextG ETF (NXTG)?,https://www.zacks.com/stock/news/2239706/should-you-invest-in-the-first-trust-indxx-nextg-etf-nxtg
INTC,neutral,0.0,0iMP5aH9isHin4BHLT82B5_osa5CfzCY--VqVKVl-zA,2024-03-12 18:07:58,Artificial Intelligence: A New Battlefield For US-China Supremacy,https://www.benzinga.com/markets/asia/24/03/37630329/artificial-intelligence-a-new-battlefield-for-us-china-supremacy
INTC,positive,0.9120294451713562,cpHK7v0rpvPAGrkYjObAsG1DZ8EikKgFz9MMOwN2KRY,2024-03-12 17:03:39,Oracle's Stock Value Surges As Company Enters 'Hypergrowth' Phase,https://www.benzinga.com/markets/equities/24/03/37628280/oracles-stock-value-surges-as-company-enters-hypergrowth-phase
INTC,neutral,0.0,aSjjI1ASkv8TBET311FU5I-94ZdxR8gHVDQ067UmIOg,2024-03-12 12:15:00,Nvidia's Price Just Keeps Growing -- Is It Headed for a Stock Split?,https://www.fool.com/investing/2024/03/12/nvidias-price-growing-headed-stock-split/
INTC,positive,0.9085719585418701,XRD2ZaRhYlCW7YSGXmL6t-hXD3-96396UpDikBDxwGE,2024-03-12 11:05:00,Intel Will Have 1 Critical Advantage Over TSMC and Samsung in 2025,https://www.fool.com/investing/2024/03/12/intel-will-have-1-critical-advantage-over-tsmc-and/
INTC,neutral,0.0,TzVrq6Onc9wJVdUBsmLVx-nSV3IB88AHmnRVrpF9gZc,2024-03-12 11:05:00,Nvidia Has Added $1 Trillion to Its Market Cap in 50 Days. Here's Why Its Growth Isn't Done.,https://www.fool.com/investing/2024/03/12/nvidia-has-added-1-trillion-to-its-market-cap-in-5/
INTC,neutral,0.0,Ch2Rn9FXdMhtH22kkjSQb_nzRcJmgXRTNCicIO55sXo,2024-03-12 10:50:00,2 Magnificent Artificial Intelligence (AI) Stocks to Buy Right Now,https://www.fool.com/investing/2024/03/12/2-magnificent-artificial-intelligence-ai-stocks-to/
INTC,positive,0.7084873914718628,HlkUnsiNXK6_uGYp-HAD7FAoMIX0Rwd89Pm5XcfDjzw,2024-03-11 21:45:17,Why the Market Dipped But Intel (INTC) Gained Today,https://www.zacks.com/stock/news/2238889/why-the-market-dipped-but-intel-intc-gained-today
INTC,positive,0.7794144153594971,cM6CxkzmwfQHcoBZAwRo3hnpL5QKI3a8_fhOHvA1esA,2024-03-11 21:14:15,Nvidia's Rocket Ship Valuation: Hope You Packed A Parachute!,https://seekingalpha.com/article/4677434-nvidia-rocket-ship-valuation-hope-you-packed-a-parachute
INTC,neutral,0.0,kd94L3qT97Jeo4fH1EnyYBE5eG8JSPTSJiyHswTeoWo,2024-03-11 17:19:00,Nvidia might not be Wall Street’s favorite AI stock anymore,https://www.marketwatch.com/story/nvidia-might-not-be-wall-streets-favorite-ai-stock-anymore-511bb86b
INTC,positive,0.5681381225585938,VOfATbsL-bt1QNijkugr-xjRW1v6fJ03LaVFb7A1xxY,2024-03-11 16:31:02,Is Nvidia Stock Becoming Too Volatile To Buy? Best-Performing Stock On S&P 500 Tests Investors' Nerves,https://www.benzinga.com/news/earnings/24/03/37593551/is-nvidia-stock-becoming-too-volatile-to-buy-best-performing-stock-on-s-p-500-tests-investors-nerve
INTC,negative,-0.971782922744751,uU49Wmakt4WraYy0OkwHAYvE5ZBR32ru4ePYof0VGy4,2024-03-11 13:23:00,"Stock Market News for Mar 11, 2024",https://www.zacks.com/stock/news/2238530/stock-market-news-for-mar-11-2024
INTC,positive,0.5537029504776001,t7_fKJqPaGFse0izpb7-IQEZuRj7G3hMCDTt27RcmN4,2024-03-11 09:28:00,2 No-Brainer Dividend Stocks to Buy Right Now for Less Than $200,https://www.fool.com/investing/2024/03/11/2-no-brainer-dividend-stocks-to-buy-right-now-for/
INTC,neutral,0.0,1YcIUCX0UFxqyoYeU4LvRqoJNMkBpHxnZbRKBQoe-G0,2024-03-09 17:55:00,‘There is a battle looming in 2024’: Qualcomm wants to become ‘the Nvidia of AI’ on your smartphone and computer,https://www.marketwatch.com/story/there-is-a-battle-looming-in-2024-qualcomm-wants-to-become-the-nvidia-of-ai-on-your-smartphone-8c49a103
INTC,neutral,0.0,3RLNXjnk6eWZOdaD3X1CU3mKCU7_HKdFVa6ZsDmS7YE,2024-03-09 14:00:00,You Won't Believe What Intel's CEO Just Said,https://www.fool.com/investing/2024/03/09/you-wont-believe-what-intels-ceo-just-said/
INTC,positive,0.913939356803894,ynmQvd9vZ4e_2h_vcvWkNcXWE43xJzmHO9QjEhD0ZUk,2024-03-09 11:31:00,25 of the best-performing stocks in the S&P 500 appear to be better values than they were a year ago. Nvidia is one of them.,https://www.marketwatch.com/story/25-of-the-best-performing-stocks-in-the-s-p-500-appear-to-be-better-values-than-they-were-a-year-ago-nvidia-is-one-of-them-488ec988
INTC,neutral,0.0,v5gBj3cUrtuWWPUFrCtqSUxami1wbQNQV0d6cb2f1yE,2024-03-09 10:06:00,4 Awe-Inspiring Growth Stocks You'll Regret Not Buying in the New Nasdaq Bull Market,https://www.fool.com/investing/2024/03/09/nasdaq-bull-market-4-growth-stocks-regret-not-buy/
INTC,positive,0.9523575305938721,1y1Vhc6bdo-Jl-NJZhXpDSPSrZABV6fX4uIyVqk-2oE,2024-03-08 17:10:00,Semiconductor ETFs Hit New High,https://www.zacks.com/stock/news/2238225/semiconductor-etfs-hit-new-high
INTC,neutral,0.0,3QquoccX9D2HdrFNj_rb9ObpSoaIMTYek8jZ_1NckUc,2024-03-08 16:11:00,Astera Labs aims to raise up to $534 million in IPO that’s a play on the AI boom,https://www.marketwatch.com/story/cloud-software-provider-astera-labs-to-offer-17-8-million-shares-in-planned-ipo-priced-at-27-to-30-each-f243c03a
INTC,positive,0.9488688707351685,s13uALLjxobWSDknYRUzhZQnLEbz2vy82Iya6DdfavA,2024-03-08 11:23:00,Taiwan Semiconductor shares climb after chipmaker posts early 2024 sales jump,https://www.marketwatch.com/story/taiwan-semiconductor-shares-climb-after-chipmaker-posts-early-2024-sales-jump-0aed549f
INTC,neutral,0.0,zFoZo9lDbiQBvfAG1fX1npY32NSJs2syuPrQiPlve7M,2024-03-08 11:20:06,Should iShares MSCI USA Value Factor ETF (VLUE) Be on Your Investing Radar?,https://www.zacks.com/stock/news/2237780/should-ishares-msci-usa-value-factor-etf-vlue-be-on-your-investing-radar
INTC,positive,0.5551754236221313,t41LwMBaLcCAuvW5QVwypYrHwQeUm3pgbOFUEH0cmf0,2024-03-08 11:20:04,Is First Trust NASDAQ Semiconductor ETF (FTXL) a Strong ETF Right Now?,https://www.zacks.com/stock/news/2237787/is-first-trust-nasdaq-semiconductor-etf-ftxl-a-strong-etf-right-now
INTC,positive,0.9216116666793823,-i_iYkrX1o3jR4-DYspj8M4KPaIHwbh34zP_u3S4ewE,2024-03-08 10:06:00,"Stock Market News for Mar 8, 2024",https://www.zacks.com/stock/news/2237745/stock-market-news-for-mar-8-2024
INTC,positive,0.9297716617584229,dPfwtvzubJlD4rppmKbLC4OMg5xCJXt8e8x43mGwbzI,2024-03-08 05:28:52,Tracking David Tepper's Appaloosa Management Portfolio - Q4 2023 Update,https://seekingalpha.com/article/4676894-tracking-david-teppers-appaloosa-management-portfolio-q4-2023-update
INTC,neutral,0.0,tSzM_2sl2961Qtjv1rvycMXBW-wJAFlVs3qRCFY369M,2024-03-07 20:22:56,"Why Broadcom, Micron, and Intel Stock Are Jumping Today",https://www.fool.com/investing/2024/03/07/why-broadcom-micron-and-intel-stock-are-jumping-to/
INTC,positive,0.7979696989059448,z3aVM6xb_nJGzvyk1vZHujeCfY5qHwERIsx14euwJUI,2024-03-07 18:22:18,"Nvidia, AMD, and Broadcom Poised for AI Boom, Mizuho Analyst Says",https://www.benzinga.com/news/24/03/37542447/nvidia-amd-and-broadcom-poised-for-ai-boom-mizuho-analyst-says
INTC,neutral,0.0,r_FUStwrQXlG76DLQ8_-2XK87jfYYOIg0pEAtLG3uu0,2024-03-07 12:30:00,Best AI Stock: Nvidia Stock vs. Intel Stock,https://www.fool.com/investing/2024/03/07/best-ai-stock-nvidia-stock-vs-intel-stock/
INTC,negative,-0.9619641304016113,Me_c7vVtk-gBdFt1E4RKaMuqsqYLAdBOjEAaM8alT6g,2024-03-06 21:18:45,"Nvidia Tops in Popularity Among S&P 500 Semiconductor Stocks, Analyst Sees Room for Growth",https://www.benzinga.com/news/24/03/37521115/nvidia-tops-in-popularity-among-s-p-500-semiconductor-stocks-analyst-sees-room-for-growth
INTC,positive,0.832712709903717,ZUO7poKWz5gB6nrMiShPAGVTY1n2Vkz9FG1KJTmLHl4,2024-03-06 13:02:00,"Taiwan Semiconductor: Japan Bet, AI Demand to Keep Countering Geopolitical Risks",https://www.investing.com/analysis/taiwan-semiconductor-japan-bet-ai-demand-to-keep-countering-geopolitical-risks-200646608
INTC,negative,-0.9722788333892822,2B8S5shn63V6k60ZXKGZDB0cMPzZJtj5fovWqSMp4fc,2024-03-06 11:29:00,"Stock Market News for Mar 6, 2024",https://www.zacks.com/stock/news/2236441/stock-market-news-for-mar-6-2024
INTC,neutral,0.0,vuBVyNTCx-6AgLRsPWsEauUjmtgvPdgykv9mnVLtNPE,2024-03-06 10:30:00,Nvidia and 7 Other Semiconductor Stocks That Can Benefit From Artificial Intelligence (AI) Robots,https://www.fool.com/investing/2024/03/06/nvidia-and-7-other-semiconductor-stocks-that-can-b/
INTC,positive,0.8492962121963501,C02qIAkz2Sj9rzXzvg-FBgmw6ja2u6GglBL5CuBnjKY,2024-03-06 03:44:47,Nvidia: Time To Admit My Big Mistake (Rating Upgrade),https://seekingalpha.com/article/4676178-nvidia-stock-time-to-admit-big-mistake-upgrade-buy
INTC,neutral,0.0,NzdEr_icuXeyRhTlaJZ4kkVtf_ZDxA3DS80X-lvLams,2024-03-05 14:00:14,Intel Corporation (INTC) Is a Trending Stock: Facts to Know Before Betting on It,https://www.zacks.com/stock/news/2235927/intel-corporation-intc-is-a-trending-stock-facts-to-know-before-betting-on-it
INTC,positive,0.7603029012680054,U_t0kH5xdXFSG0sT1EFMnTeUrPQaWvNsUYvFTZBBzHA,2024-03-05 12:50:00,1 Top AI Stock to Buy Before 2025 (Hint: It's Not Nvidia),https://www.fool.com/investing/2024/03/05/1-top-ai-stock-to-buy-before-2025-hint-its-not-nvi/
INTC,neutral,0.0,Xy1RqR1BtvwefPn4nFEU-dkG5ItylD6D0N4R84ApVBE,2024-03-05 11:30:00,1 Mind-Blowing Quote That Shows Why This Artificial Intelligence (AI) Stock is a No-Brainer Buy Right Now,https://www.fool.com/investing/2024/03/05/1-mind-blowing-quote-that-shows-why-this-ai-stock/
INTC,neutral,0.0,r8dZeItEVHT0feuCzJtofmL43qVi8e4MNKF38tpQn2E,2024-03-04 22:10:04,Nvidia and These Tech Giants Just Invested in This Artificial Intelligence (AI) and Robotics Start-Up,https://www.fool.com/investing/2024/03/04/nvidia-and-these-tech-giants-just-invested-in-this/
INTC,neutral,0.0,s8Zyqrqd2sInehTgNEQ9I1lAt4QQfHpdk9aKWKVTBYc,2024-03-04 14:34:50,"Super Micro Computer Joins S&P 500 Index: An 'AI Winner At Premium Valuation,' Analyst Says",https://www.benzinga.com/analyst-ratings/analyst-color/24/03/37457654/super-micro-computer-joins-s-p-500-index-an-ai-winner-at-premium-valuation-analyst-
INTC,neutral,0.0,U_rWRnQuV_aPWYHIvTxga3p78FNc5cC8kZ4H7BR1Lqo,2024-03-04 10:20:00,"The Zacks Analyst Blog Highlights Apple, Meta Platforms, Intel, Brokers Group and ICON",https://www.zacks.com/stock/news/2235016/the-zacks-analyst-blog-highlights-apple-meta-platforms-intel-brokers-group-and-icon
INTC,negative,-0.9544639587402344,eHlSEdlQy7RRNF8DgWyjpKSQd5sgD2GE93x-usFb--c,2024-03-02 18:20:00,U.S.-China tensions over Taiwan threaten to derail Nvidia and other tech giants,https://www.marketwatch.com/story/u-s-china-tensions-over-taiwan-threaten-to-derail-nvidia-and-other-tech-giants-6563a363
INTC,positive,0.6258609890937805,frlJiDiQFbfzQzNvOkASZQis0GP9Aoh7OCb64rqgEAU,2024-03-02 16:15:00,Will Super Micro Computer Be Worth More Than Intel by 2027?,https://www.fool.com/investing/2024/03/02/will-super-micro-computer-be-worth-more-than-intel/
INTC,positive,0.7931779623031616,4J-JOGcZflYWpz4wleVe8DMAJ5rkkHpcV_X1wwqnsbw,2024-03-02 14:15:00,2 Top Tech Stocks That Could Make You a Millionaire,https://www.fool.com/investing/2024/03/02/2-top-tech-stocks-that-could-make-you-a-millionair/
INTC,positive,0.6657878756523132,pX26nTT_WISF13A0d0HmkCo6moO4Fo3I0RbEqibW1AM,2024-03-02 12:36:00,"AI, software and semiconductor stocks are too popular for their own good",https://www.marketwatch.com/story/most-ai-software-and-semiconductor-stocks-are-a-crowded-trade-right-now-79782d90
INTC,neutral,0.0,Xja8Tpzu30__XXl6tQdttMr-QBY_wpFRpqrGb3nexN8,2024-03-02 11:43:00,Nvidia’s stock sees one advantage that only two other chip makers share,https://www.marketwatch.com/story/nvidias-stock-sees-one-advantage-that-only-two-other-chip-makers-share-aa00cb6a
INTC,positive,0.49348148703575134,uDZB3izsGvVSxQlA3_KTCcCFTq0c3xhTUecQU8-5QzQ,2024-03-02 10:31:00,Nvidia’s next mission: Make even more financial history,https://www.marketwatch.com/story/nvidias-next-mission-make-even-more-financial-history-d91ea466
INTC,positive,0.9031944274902344,cbPISknZavfcrbJwKYnHOhHoxJQtFtzccFLluvtnhxY,2024-03-01 22:45:12,Intel (INTC) Beats Stock Market Upswing: What Investors Need to Know,https://www.zacks.com/stock/news/2234902/intel-intc-beats-stock-market-upswing-what-investors-need-to-know
INTC,neutral,0.0,Wfh2UGw-adHVCEHp7XxwqDRNiupHEmpvz-CVNqCY3WQ,2024-03-01 17:46:00,"Top Analyst Reports for Apple, Meta Platforms & Intel",https://www.zacks.com/research-daily/2234682/top-analyst-reports-for-apple-meta-platforms-intel
INTC,positive,0.9266470074653625,jSN9xcVZ5v7kjO78jSDAV0ea7E2Td2IqyyTGrx_9Jno,2024-03-01 16:03:00,"Why Dell’s stock is having its best day on record, lifting Nvidia, AMD shares",https://www.marketwatch.com/story/why-dells-stock-is-having-its-best-day-on-record-and-lifting-nvidia-amd-shares-aca64e8c
INTC,neutral,0.0,vQY1f3lmb-UGvnue7Zf6YAIw-4S215MLIVA7LWXy0dw,2024-03-01 00:45:00,What's Going on With Intel Stock?,https://www.fool.com/investing/2024/02/29/whats-going-on-with-intel-stock/
INTC,neutral,0.0,VEfdbPeqfKnzOBbRlmpISHBHtasJChmBdpybTSZn9QA,2024-02-29 13:02:00,Amazon Stock: Why It's Finally Included in the Dow Index,https://www.investing.com/analysis/amazon-stock-why-its-finally-included-in-the-dow-index-200646465
INTC,neutral,0.0,zOIz_VBzb-LBc0X1QyMVzRzuSTWRfUiYCoODw99galU,2024-02-29 09:50:00,A Macro Shift At Hand,https://seekingalpha.com/article/4674701-a-macro-shift-at-hand
INTC,neutral,0.0,vNe6PpZSVYULpCZzHY8nl0K4PkajhqKqvCMsoozaza8,2024-02-28 18:24:08,AMD Could Soon Have Its 'Nvidia Moment' (Rating Upgrade),https://seekingalpha.com/article/4674334-amd-could-soon-have-its-nvidia-moment-rating-upgrade
INTC,neutral,0.0,WQP_ZzLVZni_KOIFh_4h1qnD3KxNNBmw07vE2iFlX9Y,2024-02-28 11:12:00,"1 Unstoppable Multibagger Up 950% in the Last Decade That Is Secretly Powering the ""Magnificent Seven""",https://www.fool.com/investing/2024/02/28/1-unstoppable-multibagger-up-950-in-the-last-decad/
INTC,neutral,0.0,wP6fc-pLKBKiwbKqhQuH-UVoCZAAHybh1FXM9Vqwxs8,2024-02-27 16:00:00,"What Nvidia, AMD, and Intel Stock Investors Should Know About the Latest Semiconductor Updates",https://www.fool.com/investing/2024/02/27/what-nvidia-amd-and-intel-stock-investors-should-k/
INTC,neutral,0.0,QDca9YLJVFX6uA92TVn3hbBKxkPmVOc3ZOx1O1opIY4,2024-02-27 13:51:00,Keysight (KEYS) Solution to Help Validate Intel mMIMO Design,https://www.zacks.com/stock/news/2232275/keysight-keys-solution-to-help-validate-intel-mmimo-design
INTC,neutral,0.0,u0-ReSXlAPtm3rxMfE0keT-eZh7eDY7ChXCa3DotTZ0,2024-02-27 11:45:00,Chip Wars: Will AMD or Broadcom Stock Make You Richer?,https://www.fool.com/investing/2024/02/27/chip-wars-will-amd-or-broadcom-stock-make-you-rich/
INTC,neutral,0.0,9SkMTc0oHlc5V3kK-AgoNRF8rZR5rxvY_1P7aU4mQTs,2024-02-27 10:33:00,An Entire Market Chasing One Stock - Can It End Well?,https://www.investing.com/analysis/an-entire-market-chasing-one-stock--can-it-end-well-200646381
INTC,positive,0.914411187171936,CqfK5SLm6jsr_m_lPHXv8WcvD-FJcy5lZv_yBO0YTIM,2024-02-27 09:00:00,Huge News for Intel Stock Investors,https://www.fool.com/investing/2024/02/27/huge-news-for-intel-stock-investors/
INTC,positive,0.8552495241165161,wOEYXFIpaepLNXnXlNuD0SEabEIwtb7SnQsoI4mPW8I,2024-02-27 02:45:00,Super Micro’s stock price may already fully reflect the AI boom — but even that still has legs,https://www.marketwatch.com/story/super-micros-stock-price-may-already-fully-reflect-the-ai-boom-but-even-that-still-has-legs-11d32a3f
INTC,positive,0.943953275680542,8R0HoBHJNP1lWFMxWObnPG7iReyPLsFmtovvtCA30Q4,2024-02-26 17:40:26,"Arm Is Strategically Shifting Towards AI, Increased Royalties - Analyst Forecasts",https://www.benzinga.com/news/24/02/37317239/arm-is-strategically-shifting-towards-ai-increased-royalties-analyst-forecasts
INTC,neutral,0.0,SJ56PDoV1h8KTE1_2ro481HfqXNtiWI6LsFs_WBoero,2024-02-25 16:11:00,2 Dividend-Paying Tech Stocks to Buy in February 2024,https://www.fool.com/investing/2024/02/25/2-dividend-paying-tech-stocks-to-buy-february-2024/
INTC,positive,0.878292441368103,jqzYj2rF71s6goSCqJ1T6qufy2fZRITtwjyBmnNDy2U,2024-02-25 14:00:00,Intel Bridges AI Chip Gap,https://seekingalpha.com/article/4673260-intel-bridges-ai-chip-gap
INTC,neutral,0.0,3s5uJ4AiHVMny4rJFixiuDBXH4FdCj6e7pSM9gXWXQk,2024-02-25 12:40:00,You Don't Have to Buy Nvidia to Benefit From Its Explosive Artificial Intelligence (AI) Growth. You Can Buy These 2 Stocks Instead.,https://www.fool.com/investing/2024/02/25/you-dont-have-to-buy-nvidia-to-benefit-from-its-ex/
INTC,negative,-0.5064023733139038,Fxc0CO6kESRnZFMtjmnkCGG9MkClIPJSsvfPSdb-bww,2024-02-25 07:39:01,Qualcomm May Not Experience As Strong Of An AI Wave As Competitors,https://seekingalpha.com/article/4673224-qualcomm-may-not-experience-as-strong-of-an-ai-wave-as-competitors
INTC,positive,0.5217629075050354,v1Fd11gTt_X7d2GJkAHqe1yCiIUBjuc_pXxGbd4FchA,2024-02-24 18:13:00,Forget Nvidia: AMD Could Be Super Micro Computer's New Best Friend,https://www.fool.com/investing/2024/02/24/forget-nvidia-amd-could-be-super-micro-computers-n/
INTC,positive,0.8925182819366455,Wyy1iYD4DAJNqjIxiMrw8mB_iUkWLI2OE7S98ORStqQ,2024-02-24 15:49:00,Is This Small Chip Stock Better Than AMD and Intel?,https://www.fool.com/investing/2024/02/24/is-1-small-chip-stock-better-than-amd-and-intel/
INTC,positive,0.833342969417572,M4c6MiQ_hHVu20pJbYFgeMWbRg3u1tRu0w8OPU-dmYs,2024-02-24 14:12:00,OpenAI’s Sam Altman has plans for AI that could mean big money for Intel,https://www.marketwatch.com/story/openais-sam-altman-has-plans-for-ai-that-could-mean-big-money-for-intel-b73ba0c9
INTC,positive,0.7930452227592468,s9v365kI2pJmE-_p8wwGd98Xe6Gl1TYgFpMjVuUZknE,2024-02-24 13:20:00,"Intel Foundry Wins ""Magnificent Seven"" Customer as Backlog Rockets Past $15 Billion",https://www.fool.com/investing/2024/02/24/intel-foundry-wins-magnificent-seven-customer-as-b/
INTC,positive,0.8114098310470581,YMS2NNjaObDBI49fkoP-F_f5oSgrm69cT9QZvyGZ-As,2024-02-24 12:38:00,Nvidia’s growth and Intel’s chip-making plans depend on AI fulfilling its promise,https://www.marketwatch.com/story/nvidias-growth-and-intels-chip-making-plans-depend-on-ai-fulfilling-its-promise-a0c64e66
INTC,neutral,0.0,VP_nuV-RImVYhR-hdQsSQGzau3GPaHqumTKD-xMrlz0,2024-02-24 10:38:00,Nvidia’s sheer dominance can be summed up by this one underrated number,https://www.marketwatch.com/story/nvidias-sheer-dominance-can-be-summed-up-by-this-one-underrated-number-16c5cdf4
INTC,positive,0.810912549495697,_g0JGXYjtwyz8F9irxLRxcTiYvkTo7a6WkXXjk_KXxI,2024-02-24 10:17:00,Nvidia is the ‘Magnificent One’ now — but these rivals are closing in,https://www.marketwatch.com/story/nvidia-is-the-magnificent-1-now-but-these-rivals-are-closing-in-3a382a8b
INTC,neutral,0.0,TlVaKGlQOBkm10gfLcp4AhQmDBg6mMtenHSd0kxO-_g,2024-02-23 20:28:30,"Intel Foundry Day Takeaway: Revenue Scale Is 'Several Years' Away, Analysts Say",https://www.benzinga.com/analyst-ratings/analyst-color/24/02/37293049/intel-foundry-day-takeaway-revenue-scale-is-several-years-away-analysts-say
INTC,neutral,0.0,ayWgKsm-wi9kF3ZPbXQxut7daWTJdRGsFK0shHA-NTQ,2024-02-23 20:06:59,Best Semiconductor Stock: Intel vs. Taiwan Semiconductor,https://www.fool.com/investing/2024/02/23/best-semiconductor-stock-intel-vs-taiwan-semicondu/
INTC,neutral,0.0,_DBQPlbQuZwaDtwwPqIWSjr6KVkXDe3qONhffHvk7Rc,2024-02-23 14:00:18,Investors Heavily Search Intel Corporation (INTC): Here is What You Need to Know,https://www.zacks.com/stock/news/2230776/investors-heavily-search-intel-corporation-intc-here-is-what-you-need-to-know
INTC,positive,0.6954157948493958,U-7gsDu8tXrUxiZ6vb-Otde5WF-6woXLhlvbI_BycnY,2024-02-23 13:00:00,You Won't Believe What Intel's CEO Just Said,https://www.fool.com/investing/2024/02/23/you-wont-believe-what-intels-ceo-just-said/
INTC,positive,0.7440364956855774,rwWXVhQVypRCvv7wSqtTM5-8axJt-L-Doilz0Hqgntk,2024-02-22 21:43:31,"10+ Stocks, ETFs To Ride On Nvidia's Record-Breaking Success",https://www.benzinga.com/news/24/02/37273346/10-stocks-etfs-to-ride-on-nvidias-record-breaking-success
INTC,neutral,0.0,T8HN7R0AS24sOvMw-_p5QEh4U1viXNSAjQXeDd9MWIw,2024-02-22 19:37:00,"Intel Outlines Future in Foundry and Process Leadership, Analyst Sees Steady Performance",https://www.benzinga.com/news/24/02/37269650/intel-outlines-future-in-foundry-and-process-leadership-analyst-sees-steady-performance
INTC,neutral,0.0,oBoKr_-4ByMtKv4ACKm_GlICJ99wsgdz-dT_sbJUhLA,2024-02-22 18:01:32,"Why ASML Stock and Applied Materials Just Popped, But Intel Dropped",https://www.fool.com/investing/2024/02/22/asml-stock-and-applied-materials-popped-intel-drop/
INTC,negative,-0.9703634977340698,aPxfXawN86OryvD_EnWaqYypKDMzHc6q9DM8oXgGQNc,2024-02-22 14:24:00,"Stock Market News for Feb 22, 2024",https://www.zacks.com/stock/news/2230076/stock-market-news-for-feb-22-2024
INTC,positive,0.9306713342666626,pRsgdfXnQMOGhiSNPPkAlhMLy2cH99eswsxY80EZYDs,2024-02-22 13:16:00,"US Funds to Propel Chip Development, Semiconductor Ecosystem",https://www.zacks.com/stock/news/2229925/us-funds-to-propel-chip-development-semiconductor-ecosystem
INTC,positive,0.8353745341300964,X5sEswnIPfNa9fxKEuG_DTcqCRiJG9MxdlznPAW8YGI,2024-02-22 13:05:00,"Nokia (NOK), Intel Team Up to Drive Energy Efficiency in 5G",https://www.zacks.com/stock/news/2229911/nokia-nok-intel-team-up-to-drive-energy-efficiency-in-5g
INTC,positive,0.9007719159126282,atp_qkFbjOz0OqLz2Ub9s84QERBF0ro3MKNWvNlaMak,2024-02-22 05:11:10,"Nvidia Q4: Good Quarter, Still Watching Competitive Threats",https://seekingalpha.com/article/4672234-nvidia-q4-earnings-good-quarter-still-watching-competitive-threats
INTC,neutral,0.0,wpLEMzoS0s1VAqQDqYCBN8hJRGfOkzxcyCprGvrMrLY,2024-02-21 22:46:48,Missed Out on Super Micro Computer Stock? Buy This Magnificent AI Stock Instead,https://www.fool.com/investing/2024/02/21/missed-out-on-super-micro-computer-stock-buy-this/
INTC,neutral,0.0,ZoOiU7QaEjYngZH_MeVLW3R8GPcF4GH0GZ1YdPlPoyM,2024-02-21 15:08:13,Amazon To Join Dow Jones Industrial Average: Does Venerable Index Membership Still Matter?,https://www.benzinga.com/markets/equities/24/02/37237785/amazon-to-join-dow-jones-industrial-average-does-venerable-index-membership-still-matter
INTC,positive,0.9041488170623779,5j2NMcUGn6ayksvW09EJp2VSAenWApq0EnuPbo0aRz0,2024-02-21 13:07:00,Intel (INTC) to Augment Portfolio With Expanded Partnership,https://www.zacks.com/stock/news/2229074/intel-intc-to-augment-portfolio-with-expanded-partnership
INTC,neutral,0.0,e6KiakurKC0J2ubqnKuB1qF_PmKJeRE_FWOHDZQQBoA,2024-02-21 11:20:07,Should You Invest in the First Trust NASDAQ Semiconductor ETF (FTXL)?,https://www.zacks.com/stock/news/2228992/should-you-invest-in-the-first-trust-nasdaq-semiconductor-etf-ftxl
INTC,positive,0.8367017507553101,nf2r3CxZ0T3IQVD3dMrfv-TInLpkT7s1ehUR5bFo-4Y,2024-02-21 09:45:00,Better Artificial Intelligence (AI) Stock: AMD vs. Intel,https://www.fool.com/investing/2024/02/21/better-artificial-intelligence-ai-stock-amd-vs-int/
INTC,positive,0.9239495396614075,CWuUR0QJBPDPX4mjs-BOqkoOzUJIxuJe941hKXTfS14,2024-02-20 20:51:00,Intel’s stock rises as a big week for its manufacturing business kicks off,https://www.marketwatch.com/story/intels-stock-rises-as-a-big-week-for-its-manufacturing-business-kicks-off-bd7e7de0
INTC,neutral,0.0,k5vJ5BAPJ3UM0QUz8hExQ6Csev2BR837j_aNOJ9eGJI,2024-02-20 20:33:36,Why Intel Is Gaining During a Bearish Day for Artificial Intelligence (AI) Stocks,https://www.fool.com/investing/2024/02/20/intel-gaining-bearish-day-artificial-intelligence/
INTC,positive,0.6062162518501282,7jXr-vcjxhQ0DaZEHd-dzHE8nrX6bRE8yNmF3B0ki80,2024-02-20 18:45:00,AI stocks in the S&P 500 have outperformed this year — and not just the ‘Magnificent Seven’,https://www.marketwatch.com/story/ai-stocks-in-the-s-p-500-have-outperformed-this-year-and-not-just-the-magnificent-seven-0faeee1d
INTC,neutral,0.0,bTGuecdA0GeYeokpIVjZ9uWIU_ARNEKQjZsLjg2W2iI,2024-02-20 15:28:32,Is Intel the Best Artificial Intelligence (AI) Semiconductor Stock to Buy Before It Skyrockets?,https://www.fool.com/investing/2024/02/20/is-intel-the-best-artificial-intelligence-ai-semic/
INTC,neutral,0.0,U5yoy90Q5qBX8g-YBC-ExmpFwAXcDGAoF-A_NClnaOg,2024-02-20 15:21:47,Nvidia and Intel Stock Investors Have an Intense Week Ahead,https://www.fool.com/investing/2024/02/20/intel-and-nvidia-stock-investors-have-an-intense-w/
INTC,negative,-0.006483829021453858,Oq-l2x4ugsQkQW2nXzmALtANW7If-aTskKY_Uk1amwc,2024-02-20 12:40:09,"US Stocks Set For Weaker Open On Mixed Retail Earnings, But Analyst Shrugs Off Weakness As 'Scary Moments' In Great Years",https://www.benzinga.com/news/earnings/24/02/37209438/us-stocks-set-for-weaker-open-on-mixed-retail-earnings-but-analyst-shrugs-off-weakness-as-scary-mom
INTC,positive,0.5409129858016968,RJZFbuqOpIOQsr4iGghj63Xm9OnblnrXBYT3Pigkhb4,2024-02-16 16:32:55,"Hotter Producer Price Index, The Power Of 'Picks And Shovels' Play",https://www.benzinga.com/24/02/37182458/hotter-producer-price-index-the-power-of-picks-and-shovels-play
INTC,negative,0.09290553132692973,V0AwkbmTeaYSjS2JuVhuuDGvyRgoPgKfHrrJ2PmwbwI,2024-02-16 15:00:38,Analyst Ratings For Intel,https://www.benzinga.com/insights/analyst-ratings/24/02/37180610/analyst-ratings-for-intel
INTC,neutral,0.0,zbR5r0hB7OeIU67wWaBFNgm-4ymQHNZoSA462KiUzhI,2024-02-16 13:05:00,"Zacks Value Trader Highlights: The Progressive, Ryder System, East West Bancorp, Intel and Hewlett Packard",https://www.zacks.com/stock/news/2227415/zacks-value-trader-highlights-the-progressive-ryder-system-east-west-bancorp-intel-and-hewlett-packard
