ticker,sentiment,sentiment_score,news_id,time,title,article_url
INTC,neutral,0.0,uSMg3vdbtnFj5zNHPI0wBlnpx8Wdi2SzsDxFr5n1TfU,2023-05-05 05:26:40,"'Tell Me You're Pausing, Without Telling Me You're Pausing' Stock Market...",https://seekingalpha.com/article/4600321-tell-me-you-are-pausing-without-telling-me-you-are-pausing-stock-market
INTC,negative,-0.7514299154281616,D7yYMcsg5RwREOcIhwgiOU-yoXW23AGpjmk5fEDE2CI,2023-05-04 20:59:08,Is Intel Stock Still Too Risky Even After Better-Than-Expected Earnings?,https://www.fool.com/investing/2023/05/04/is-intel-stock-still-too-risky-after-earnings/
INTC,negative,-0.9562214016914368,8ZU7FvALugDI-mhGzqr3TXOkuBjgmE53vNjdhuV4eXc,2023-05-04 20:16:00,Qualcomm Plunges as China Rebound Fails to Materialize,https://www.investing.com/analysis/qualcomm-plunges-as-china-rebound-fails-to-materialize-200637816
INTC,neutral,0.0,zY68ls0OTgXlQePMREKtA-d2NLOHztBEMVvC70YHDUw,2023-05-04 10:05:00,4 Stocks That Made Investors a Fortune in the Midst of U.S. Banking Crisis,https://www.investing.com/analysis/4-stocks-that-made-investors-a-fortune-in-the-midst-of-us-banking-crisis-200637789
INTC,neutral,0.0,RILokHZ-pCe7nci-_2SJ7HnJ42Ue37W6n_ktRBDy_IE,2023-05-04 10:00:00,AMD Treads Water In AI Where Intel Sinks -- Is Either Stock A Buy?,https://www.fool.com/investing/2023/05/04/amd-treads-water-in-ai-where-intel-sinks-is-either/
INTC,positive,0.9264057874679565,0XgTuuTlsj05qF488dzNTIHs3h4ARFnW2Rn37wwUDqw,2023-05-04 04:27:00,Is Japan Springing Into Bloom?,https://seekingalpha.com/article/4599736-is-japan-springing-into-bloom
INTC,negative,-0.9727635383605957,20fhMwTsZ7U-AyCH5XovRNrztReL4pGpTIhffRIOG4Y,2023-05-04 00:11:00,Qualcomm stock sinks as weak smartphone demand pushes inventory drawdown out to 'at least the next couple quarters',https://www.marketwatch.com/story/qualcomm-stock-slides-as-outlook-falls-short-of-wall-street-expectations-91247b4b
INTC,negative,-0.07969812154769898,0nn_bhNat5LxM4BlifcY-bwA5f2lNnltBYZEX-EF1FM,2023-05-03 17:25:00,US Stocks Edge Slightly Higher As Investors Brace For Fed's Interest Rate Decision: JPMorgan Analysts See 1% Rally On Most Probable Outcome,https://www.benzinga.com/news/earnings/23/05/32182340/nasdaq-s-p-500-futures-tick-up-ahead-of-fed-decision-today-jpmorgan-analysts-see-1-rally-on-most-pr
INTC,negative,-0.7909143567085266,uQ98KHJ3ItABY5K3Lj5_jHw_lxMvSdCP1A3QMtsiGNM,2023-05-03 13:30:00,AMD Earnings: Intel Was Right About One Thing,https://www.fool.com/investing/2023/05/03/amd-earnings-following-intels-path/
INTC,negative,-0.951913595199585,EllFVwvdEIFl5hKBQntnykBYxqSygAtGVDXpQ9BbvPU,2023-05-03 12:47:00,"AMD stock skids, with upbeat second-half view 'likely not a slam dunk'",https://www.marketwatch.com/story/amd-stock-skids-with-upbeat-second-half-view-likely-not-a-slam-dunk-65287b65
INTC,neutral,0.0,SBoMafx7r2O4pETK6tU1L2pmSPx-pb9z82jvkTtXDOI,2023-05-03 12:00:00,Best Dividend Stock to Buy: Intel vs. IBM,https://www.fool.com/investing/2023/05/03/best-dividend-stock-to-buy-intel-vs-ibm/
INTC,negative,-0.9626582860946655,NGJFX7kPxtomBiNAewCAcTsz592xIJGV_yJyHYc7Guw,2023-05-03 11:38:00,"AMD stock is sliding after earnings, and these numbers show why",https://www.marketwatch.com/story/amd-stock-is-sliding-after-earnings-and-these-numbers-show-why-43246062
INTC,neutral,0.0,Wr2VasvrBXy-E2RjrclrdnSAMcMnpv7UKTF-nOvONEw,2023-05-03 09:05:00,3 Best Tech Stocks to Buy in May,https://www.fool.com/investing/2023/05/03/3-best-tech-stocks-to-buy-in-may/
INTC,negative,-0.974951982498169,ssJms516HrfrGMZnBTsG72duHg1SbTxdkhMUCznwJeA,2023-05-03 00:20:00,"'AI for us is broader than cloud,' AMD CEO tells analysts, but chip maker still needs PC recovery to improve margins",https://www.marketwatch.com/story/amd-stock-slides-as-outlook-overshadows-better-than-expected-results-3cead1e5
INTC,positive,0.8878002762794495,--jDRg3T0QCa7_maxauEySIBGWjExhcxoLtEQmA1vHU,2023-05-02 15:02:52,What's Happening With AMD Stock Today,https://www.benzinga.com/news/23/05/32161766/whats-happening-with-amd-stock-today
INTC,neutral,0.0,2HpB8A2_2_NZyxhYsUEtwj-1xqMaSbFMwuMvTkOxUlE,2023-05-02 13:00:14,Investors Heavily Search Intel Corporation (INTC): Here is What You Need to Know,https://www.zacks.com/stock/news/2087978/investors-heavily-search-intel-corporation-intc-here-is-what-you-need-to-know
INTC,positive,0.7703549861907959,h730362N0EOyVce4LmDZDkO1sGScrDwAi-86APMpl7k,2023-05-02 12:46:00,"Apple and 10 other stocks tied to China supply chains are at risk, but 7 others may benefit, says Morgan Stanley",https://www.marketwatch.com/story/more-than-90-of-apples-production-is-still-in-china-why-morgan-stanley-says-thats-a-problem-20a48e7c
INTC,neutral,0.0,22M_gPIE20ZXSOuzxoytK8YeylZJV2EOFpxN61UTVN4,2023-05-02 12:25:00,Is Block Stock a Buy After Diversifying Into Bitcoin Mining?,https://www.fool.com/investing/2023/05/02/is-block-stock-a-buy-after-bitcoin-mining/
INTC,negative,-0.9696555137634277,hYEhjBaoiuhGZ7VyiznVbCKPBf1L3b6gddT0f5SklG0,2023-05-02 12:00:00,2 Huge Reasons Intel Stock Is Under Pressure,https://www.fool.com/investing/2023/05/02/2-huge-reasons-intel-stock-is-under-pressure/
INTC,negative,-0.9140597581863403,GNTmSwuwvDuQLS_7JSyqSCYulPVn5uH_n084O37b2FM,2023-05-02 11:42:00,AMD faces doubts after Intel earnings: Is the bar set too high?,https://www.marketwatch.com/story/amd-faces-doubts-after-intel-earnings-is-the-bar-set-too-high-fb5085e8
INTC,neutral,0.0,00Q91_AvETR2wItgkcNLvOA_eKVjQDCy-v92FQ-3_mc,2023-05-02 10:20:09,Should Invesco S&P Ultra Dividend Revenue ETF (RDIV) Be on Your Investing Radar?,https://www.zacks.com/stock/news/2087828/should-invesco-sp-ultra-dividend-revenue-etf-rdiv-be-on-your-investing-radar
INTC,negative,-0.6171649098396301,3Q2lDt7OXYOtqsVRjOBamAgXx_erxfE4Jwr5ANSR3QE,2023-05-02 09:25:00,Is Intel Stock a Buy Now?,https://www.fool.com/investing/2023/05/02/is-intel-stock-a-buy-now/
INTC,negative,-0.7882174849510193,ntmiRMoqcNBIyCuDfGe_N5sXTAx3r2vggX_wSOpXAKw,2023-05-01 19:48:00,'It is hard to see how you can prevent the bad actors from using it for bad things': Google's former 'Godfather of AI' warns of misuse after quitting tech giant,https://www.marketwatch.com/story/it-is-hard-to-see-how-you-can-prevent-the-bad-actors-from-using-it-for-bad-things-googles-former-godfather-of-ai-warns-of-misuse-after-quitting-tech-giant-efad3c05
INTC,negative,-0.959822952747345,q54laBWWYav3aKyAGI2aYL8pykpiuYlEUZ2Zf109zSo,2023-05-01 17:30:04,Intel: Mega Turnaround Starts Now,https://seekingalpha.com/article/4598556-intel-mega-turnaround-starts-now
INTC,positive,0.9432810544967651,5aGqXyjecZ9SmlJmxKarnnoJjfQCLFyt9Yn9FFoT3B4,2023-05-01 13:40:00,"Stock Market News for May 1, 2023",https://www.zacks.com/stock/news/2087416/stock-market-news-for-may-1-2023
INTC,neutral,0.0,uVnzX7s9J9Fs1pRjhLBkc0CiWT3jmSODjgBGXOgP8kw,2023-05-01 11:30:00,3 Stocks to Avoid This Week,https://www.fool.com/investing/2023/05/01/3-stocks-to-avoid-this-week/
INTC,positive,0.9490439295768738,x1tmCLKd5RLWxcYlSWHAbtz-lJdREGrClGYAPXb3FhU,2023-05-01 10:07:45,S&P Records Second Straight Monthly Gain; Market Volatility Decreases Further,https://www.benzinga.com/news/earnings/23/05/32111808/s-p-records-second-straight-monthly-gain-market-volatility-decreases-further
INTC,negative,-0.9214275479316711,aMIAADNGp7oKFyh0VJBx3yDAIwns70p0k6PiiMwccnw,2023-04-30 14:30:57,Will Apple Join The Party After Big Tech's Earnings Outperformed Last Week? Here's What One Analyst Says.,https://www.benzinga.com/analyst-ratings/analyst-color/23/04/32101989/will-apple-join-the-party-after-big-techs-earnings-outperformed-last-week-heres-wha
INTC,positive,0.8983169198036194,qSrbZwFGvgoCM7UkCRo7udf_gpPORnyvO9TE3m-NE-Y,2023-04-30 14:27:00,3 Rebounding Tech Stocks That Have Proven They're Here to Stay,https://www.fool.com/investing/2023/04/30/3-rebounding-tech-stocks-are-here-to-stay/
INTC,neutral,0.0,RHx5JRM43mmxstjy1qAHVsUOL0NO9UzgpFomFhW3UVc,2023-04-30 12:58:00,"1 Stock to Buy, 1 Stock to Sell This Week: Apple, AMD",https://www.investing.com/analysis/1-stock-to-buy-1-stock-to-sell-this-week-apple-amd-200637654
INTC,neutral,0.0,FUXK_SmeXzSI4dhbvnQA7L-uJpavt-XYl2V4DU8YjOQ,2023-04-30 10:30:00,AI Winners Aren't Who You Think,https://www.fool.com/investing/2023/04/30/ai-winners-arent-who-you-think/
INTC,neutral,0.0,sg3lzMqydQW1MWb29ACGWuHz-w6C1ivRxroS_sm8-ZQ,2023-04-29 15:33:00,2 Extraordinary Growth Stocks to Buy at a Discount,https://www.fool.com/investing/2023/04/29/2-extraordinary-growth-stocks-to-buy-at-a-discount/
INTC,positive,0.8245871067047119,NtDVbMkB2FYocrFFH7TajVzqzmfJImnALBTIr5KGM88,2023-04-29 14:50:00,"Intel may have hit bottom, but Wall Street remains concerned about its margins",https://www.marketwatch.com/story/intel-may-have-hit-bottom-but-wall-street-remains-concerned-about-its-margins-db80d1f8
INTC,negative,-0.7996346354484558,-hRZb2hnYpd8bvk_FSadkGhLWl56hSLqYjyL97YYncI,2023-04-29 13:25:00,"Stock investors are right to be cautious now, and being bearish is even smarter",https://www.marketwatch.com/story/stock-investors-are-right-to-be-cautious-now-and-being-bearish-is-even-smarter-e5e7539c
INTC,positive,0.9232056140899658,ZdEsHYxgdYH6gDheG9dDZG75Ai_dn1YYwlo3nHK2pbw,2023-04-28 20:35:00,"Dow advances over 250 points to book best month since January on earnings,  as bank concerns, Fed decision loom",https://www.marketwatch.com/story/u-s-stock-futures-lower-as-investors-weigh-up-amazon-cloud-worries-fed-inflation-gauge-looms-def5c765
INTC,neutral,0.0,qhwBoVtXsrQ4op0AyK90lzWNks4M5U4K_YR2W4XqSs4,2023-04-28 19:33:45,Intel (INTC) Q1 2023 Earnings Call Transcript,https://www.fool.com/earnings/call-transcripts/2023/04/28/intel-intc-q1-2023-earnings-call-transcript/
INTC,negative,-0.9701247811317444,9vHIoUwpKrhlVc9pbuV9A5GVVdEjsF9IvV0bZCnFK8c,2023-04-28 18:51:29,"Attention Investors! Buy Mobileye At Current Levels, Analysts Say Post Q1 Results Snubbing Softness In Chinese EV Demand",https://www.benzinga.com/news/23/04/32087828/attention-investors-buy-mobileye-at-current-levels-analysts-say-post-q1-results-snubbing-softness-in
INTC,negative,-0.5280857086181641,Tlk3iN2B4msAhYb3a-UOmb-9kGNj59cul_aBd_Ap7Og,2023-04-28 17:41:00,"US Equities Rebound, On Track For Weekly Gains: Energy And Financial Sectors Outperform",https://www.benzinga.com/news/earnings/23/04/32078437/nasdaq-s-p-500-futures-slide-as-amazon-other-tech-earnings-disappoint-analyst-sees-fed-spoiling-the
INTC,positive,0.8485807180404663,nJil0gNB-GLx5QS5CCtBrzJKGYOh_Ubuqt7rD_Dt6i0,2023-04-28 15:26:43,"Intel Analysts Dive Into Solid Results, Mixed Guidance",https://www.benzinga.com/analyst-ratings/analyst-color/23/04/32085202/intel-analysts-dive-into-solid-results-mixed-guidance
INTC,negative,-0.9164251089096069,LUN0og-exraG1meS4jB2gcp2BA-OnmyXQRbjiAKGXjc,2023-04-28 15:10:00,Intel Q1 Earnings Put These ETFs in Focus,https://www.zacks.com/stock/news/2086977/intel-q1-earnings-put-these-etfs-in-focus
INTC,negative,-0.18442374798986647,4L-kkRrZFrMBAYTk54O_LLIPEEDDZGg6_NurWjvR57M,2023-04-28 15:00:31,"Benzinga's Top Ratings Upgrades, Downgrades For April 28, 2023",https://www.benzinga.com/analyst-ratings/upgrades/23/04/32085664/benzingas-top-ratings-upgrades-downgrades-for-april-28-2023
INTC,positive,0.9392208456993103,4P_2-OHWzNqJrzxdZHrCellkH6bQhRAkahQV5ZB548k,2023-04-28 14:44:17,"Intel, Saia, Charter Communications And Other Big Stocks Moving Higher On Friday",https://www.benzinga.com/news/23/04/32085162/intel-saia-charter-communications-and-other-big-stocks-moving-higher-on-friday
INTC,negative,-0.9741233587265015,VL2kAMAumExxJpwu7ZNQo2LcC8AQKOd0nlkZCcw-io8,2023-04-28 14:42:00,"Intel (INTC) Q1 Loss Narrower Than Expected, Revenues Fall",https://www.zacks.com/stock/news/2087011/intel-intc-q1-loss-narrower-than-expected-revenues-fall
INTC,negative,-0.9680591225624084,ZKNZA1A4mC5DBicR-iw8rMEcVlQJ5KkUuNvMV7pkRFQ,2023-04-28 14:37:07,"Economic Growth Slows, Inflation Persists, Stocks Rally",https://www.benzinga.com/economics/macro-economic-events/23/04/32084939/economic-growth-slows-inflation-persists-stocks-rally
INTC,negative,-0.5017338991165161,L8bfVTmOr6SaWPZ2k890aNHTRS3sU-60OGTs0a9yIzM,2023-04-28 14:00:00,Intel Earnings: Don't Let the Stock's Reaction Fool You,https://www.fool.com/investing/2023/04/28/intel-earnings-dont-let-the-stocks-reaction-fool-y/
INTC,positive,0.9464634656906128,o4Fxhhd5163UfZ6IKzoxjgCOUCov2tG1xBKPhBHqpto,2023-04-28 12:26:00,"Intel tops Wall Street estimates, CEO says data-center business is improving",https://www.marketwatch.com/story/intel-tops-wall-street-estimates-but-a-little-short-on-outlook-daf7d8ef
INTC,negative,-0.9753467440605164,o4Gd-D1KKB6Ta6NW7a3hoRqy1SkHRJltbT0Iks-Qfs0,2023-04-28 11:53:35,"Intel Gets Price Target Bumps By Analysts After Upbeat Q1 Results, Shares Gain",https://www.benzinga.com/news/earnings/23/04/32080631/intel-gets-price-target-bumps-by-analysts-after-upbeat-q1-results-shares-gain
INTC,positive,0.7245514392852783,ZusJVVlQCrgUzUxob-Dv5st89oKc1uzEK-90VoOIscg,2023-04-28 11:48:00,"Intel earnings mark a 'small step' forward, but a 'potentially lethal combination' lurks",https://www.marketwatch.com/story/intel-earnings-mark-a-small-step-forward-but-a-potentially-lethal-combination-lurks-cab1aa78
INTC,negative,-0.9653148055076599,dGLiUfnDiw6_lGg0YkEiaA1sBOHdhMXN0gSF4Cb4MTo,2023-04-28 08:06:41,"Amazon, Exxon Mobil And 3 Stocks To Watch Heading Into Friday",https://www.benzinga.com/news/earnings/23/04/32076028/amazon-exxon-mobil-and-3-stocks-to-watch-heading-into-friday
INTC,neutral,0.0,95YhoiKNruF2HhysKRfuqmDZs3dmgO08cvVF8Yjam-g,2023-04-28 05:10:28,Intel Corporation 2023 Q1 - Results - Earnings Call Presentation,https://seekingalpha.com/article/4597637-intel-corporation-2023-q1-results-earnings-call-presentation
INTC,neutral,0.0,eVGehblWFK-w06493pnyIYZm57DZD0J60lSsYz75eLs,2023-04-27 23:30:09,Here's What Key Metrics Tell Us About Intel (INTC) Q1 Earnings,https://www.zacks.com/stock/news/2086598/heres-what-key-metrics-tell-us-about-intel-intc-q1-earnings
INTC,neutral,0.0,Cdnd3I8cayKKCUK88c72s4SESli-dW_Yh3We2hYU390,2023-04-27 22:29:09,Did Intel Finally Bottom? -- What Investors Should Know About Its Latest Earnings Results,https://www.fool.com/investing/2023/04/27/did-intel-finally-bottom-what-investors-should-kno/
INTC,positive,0.9385156631469727,LSjKTWHK3lHmqHpB2JgPFPvFPCE-rKySjchpm7MtUUw,2023-04-27 22:06:00,"Markets Close in the Green; AMZN, INTC & More Beat on Earnings",https://www.zacks.com/stock/news/2086492/markets-close-in-the-green-amzn-intc-more-beat-on-earnings
INTC,negative,-0.670324444770813,RE4B10QggkHRCrOiZu6LCKKMSnXxp3jckyOd5RCLslo,2023-04-27 21:35:15,"Intel (INTC) Reports Q1 Loss, Tops Revenue Estimates",https://www.zacks.com/stock/news/2086416/intel-intc-reports-q1-loss-tops-revenue-estimates
INTC,negative,-0.9674580097198486,V62B7448hC4HKQz3WbTsTN4xr7S9nNAvxrGJ1jUbNUA,2023-04-27 20:36:07,"Intel Q1 Earnings Highlights: Revenue And EPS Beat, AI Update, Guidance And More",https://www.benzinga.com/news/earnings/23/04/32061119/intel-q1-earnings-highlights-revenue-and-eps-beat-ai-update-guidance-and-more
INTC,positive,0.38929104804992676,C2SAt49wjxGcfGbAO1rPEXAw0O7IC2TTfCory4komoE,2023-04-27 17:56:00,"Stocks Rise On Strong Earnings, Expectation Of Fed Rate Hikes Ending: Analyst Says 'No Earnings Recession In Cards Yet'",https://www.benzinga.com/news/earnings/23/04/32041361/us-stocks-eye-higher-open-as-meta-q1-uplifts-tech-sector-analyst-says-no-earnings-recession-in-card
INTC,positive,0.6865907907485962,f0rlAu4kp-bkhygc4GKnZVoQppOoI1ls-pqfvPAzg6Q,2023-04-27 14:15:00,Where Will AMD Be in 5 Years?,https://www.fool.com/investing/2023/04/27/where-will-amd-be-in-5-years/
INTC,negative,-0.931875467300415,AKX9mkyt2fPKn0KZagG09d4_hJuXyQvxbpH6Y4dgsrQ,2023-04-27 13:33:02,Debt Limit Bill Heads To Senate To Be Rejected,https://www.benzinga.com/economics/macro-economic-events/23/04/32046950/debt-limit-bill-heads-to-senate-to-be-rejected
INTC,negative,-0.9383093118667603,Q1YeKsj4ysEVmRP7c85nqRipOQSgp9-ZOKLnHGPgoh8,2023-04-27 13:33:00,"An undiscovered universe of stocks is trading at 'near generational lows,' asset manager says",https://www.marketwatch.com/story/an-undiscovered-universe-of-stocks-is-trading-at-near-generational-lows-asset-manager-says-16d8bd02
INTC,neutral,0.0,dY2hrcBVJOuvrpJe9D7xolb7Qd8II9nilcbtQqKd3qQ,2023-04-27 13:01:00,"Taiwan Semiconductor Manufacturing Will Keep Spending on Equipment, but Is the Stock A Buy Now?",https://www.fool.com/investing/2023/04/27/taiwan-semiconductor-manufacturing-will-keep-spend/
INTC,positive,0.9446020126342773,9f8L77lS8dwst1SCEHqZy8lXgWApzDW3gME-HXy1MgQ,2023-04-27 02:30:00,Teradyne stock rallies 7% on  strong outlook as Wall Street debates Apple's influence ,https://www.marketwatch.com/story/teradyne-stock-rallies-more-than-5-after-earnings-outlook-beat-4ff85632
INTC,negative,-0.9602183699607849,YALEv_lcuEBx-HqADsepFY4b24zuqoCCjqOX72R5rmo,2023-04-26 23:38:00,Intel is expected to post its biggest loss on record. Has the chip maker finally hit rock bottom?,https://www.marketwatch.com/story/intel-is-expected-to-post-its-biggest-loss-on-record-has-the-chip-maker-finally-hit-rock-bottom-f1d8d7ea
INTC,negative,-0.8429210782051086,5p9E8RYVq14JhCHesf2pgt6lt2YsAJHvi9QkWV4Wt1s,2023-04-26 22:04:00,"Markets Continue Steady Slide; META, EBAY Beat Q1 Earnings",https://www.zacks.com/stock/news/2085436/markets-continue-steady-slide-meta-ebay-beat-q1-earnings
INTC,positive,0.8077331185340881,vom6Y9kUA8x3d5O9bF06CwAekwizeIHjtl-5y6iYrfk,2023-04-26 21:03:00,Microsoft worth nearly $150 billion more after stock's massive Wednesday rally,https://www.marketwatch.com/story/microsoft-just-delivered-exactly-what-software-needed-amid-doom-and-gloom-b8d1e7ab
INTC,neutral,0.0,1-l5L0yiV1xKE259H_11GKztevIal990mF4Q0Y5wZIs,2023-04-26 19:01:37,Analyst Expectations for Intel's Future,https://www.benzinga.com/analyst-ratings/23/04/32019104/analyst-expectations-for-intels-future
INTC,positive,0.9465087652206421,zuEu_cmcgsTBAdUgCD7umyhNylm87RzV_BIqE_zR6do,2023-04-26 11:40:00,Texas Instruments stock boosted by more end-market visibility as outlook comes in light,https://www.marketwatch.com/story/texas-instruments-stock-declines-as-weak-outlook-overshadows-earnings-beat-f5975c7a
INTC,neutral,0.0,8AfwYEUfRPFbcV24VN4yO_TU_RofIIswKQVAKjKx2hU,2023-04-26 10:20:07,Is Goldman Sachs Equal Weight U.S. Large Cap Equity ETF (GSEW) a Strong ETF Right Now?,https://www.zacks.com/stock/news/2084676/is-goldman-sachs-equal-weight-us-large-cap-equity-etf-gsew-a-strong-etf-right-now
INTC,negative,-0.9544610977172852,u_sBFqwuVEBctQLVzuqyoZbSFU3HDc7gFQ7tl_NgeNU,2023-04-26 05:34:30,"Microsoft's AI Ambitions Spell Trouble for Intel, Warns Analyst",https://www.benzinga.com/analyst-ratings/analyst-color/23/04/32003544/microsofts-ai-ambitions-spell-trouble-for-intel-warns-analyst
INTC,neutral,0.0,-7x1ZOJeSBxNg4tbh3Sn9JVCgHXfCuOYU6yqQQSrvHw,2023-04-25 21:15:10,Texas Instruments (TXN) Beats Q1 Earnings and Revenue Estimates,https://www.zacks.com/stock/news/2084526/texas-instruments-txn-beats-q1-earnings-and-revenue-estimates
INTC,positive,0.8915647864341736,43cQBcaD73KTLSGDzTv0P-hx8qpdNP7tnvMbW1-t8gs,2023-04-25 15:10:00,Semiconductor ETFs in Focus Ahead of Q1 Earnings,https://www.zacks.com/stock/news/2084330/semiconductor-etfs-in-focus-ahead-of-q1-earnings
INTC,positive,0.6018882393836975,0GTJDqA4t5Yiho4VDwnofxy747TRvBPU1eNdCrMisCU,2023-04-25 11:54:00,"After a $2 trillion stock rebound, Big Tech wades into sea of uncertainty",https://www.marketwatch.com/story/after-a-2-trillion-stock-rebound-big-tech-wades-into-sea-of-uncertainty-eba2ea66
INTC,neutral,0.0,eVOV94qhq7YT-blwASO4FiIf8imtY0nbyTrSTfOI7lQ,2023-04-25 09:00:00,"The Zacks Analyst Blog Highlights Walmart, Chevron, Danaher, Intel and Lowe's",https://www.zacks.com/stock/news/2083819/the-zacks-analyst-blog-highlights-walmart-chevron-danaher-intel-and-lowes
INTC,positive,0.9190964698791504,IA09LY09OujTjZNyVR1-hrJEF1uvU1YsIMwBhMKw9Bs,2023-04-24 19:10:09,"AMD's Road To Recovery: Analyst Points To Bottom In March, Market Share Growth And Server Dominance Ahead",https://www.benzinga.com/analyst-ratings/analyst-color/23/04/31963423/amds-road-to-recovery-analyst-points-to-bottom-in-march-market-share-growth-and-ser
INTC,neutral,0.0,9_WKMqpa7StZDnRCNOTjdKeOBh3OVMsDpG9G5f_bjCQ,2023-04-24 17:32:00,"Top Analyst Reports for Walmart, Chevron & Danaher",https://www.zacks.com/research-daily/2083405/top-analyst-reports-for-walmart-chevron-danaher
INTC,negative,-0.7504687905311584,cm7oA2kdva5STGOGcHx_RfMRaRuts25gVn3OkzWWzp0,2023-04-24 17:15:00,S&P 500: Signs of a New Bull Market Keep Mounting,https://www.investing.com/analysis/sp-500-signs-of-a-new-bull-market-keep-mounting-200637495
INTC,negative,-0.9759908318519592,VIc9gYXL-FCD1b3BOHM-ZWoyLShHEqisIvpanhNB2k8,2023-04-24 13:12:00,Will Sharp Top-Line Contraction Mar Intel (INTC) Q1 Earnings?,https://www.zacks.com/stock/news/2083459/will-sharp-top-line-contraction-mar-intel-intc-q1-earnings
INTC,neutral,0.0,ziBOsVgzXBt6KAF8Hghz4Eyi0HhyKfAFIESYdUYfdCs,2023-04-24 11:30:00,3 Stocks to Avoid This Week,https://www.fool.com/investing/2023/04/24/3-stocks-to-avoid-this-week/
INTC,neutral,0.0,2MaCeWq2VMuiVp0zZiLi930tb-DWe3ofZbzGgG3IOdQ,2023-04-24 11:01:00,"As Big Tech determines the course of Wall Street, here is why Amazon will hold the most sway",https://www.marketwatch.com/story/as-big-tech-determines-the-course-of-wall-street-here-is-why-amazon-will-hold-the-most-sway-9abaf1da
INTC,neutral,0.0,_v9CtQLsNBbMu4vcx9ujZO1FaP6vEP3abdq4A4UBWco,2023-04-23 18:15:00,7 stocks tech sector experts say can profit from AI -- and survive short-seller attacks,https://www.marketwatch.com/story/7-stocks-tech-sector-experts-say-can-profit-from-ai-and-survive-short-seller-attacks-99e36b70
INTC,neutral,0.0,7b5kYHiam9eatAm_i3z-dpIBpYyROMhYoVWpVcLZUpA,2023-04-23 12:22:00,"1 Stock to Buy, 1 Stock to Sell This Week: McDonald’s, Intel",https://www.investing.com/analysis/1-stock-to-buy-1-stock-to-sell-this-week-mcdonalds-intel-200637450
INTC,neutral,0.0,-3ClBvYppchHzXcLadQ0sDEX8Dny5tiSqdRjct2t2Ys,2023-04-22 19:24:30,Europe Will Spend 43 Billion Euros on Chip Manufacturing -- Here's How Investors Can Take Advantage,https://www.fool.com/investing/2023/04/22/europe-will-spend-43-billion-euros-on-chip-manufac/
INTC,negative,-0.952508807182312,PuNPUqaEYec_AFGPD2ch4fzIjCTmTjcK4ZeWQbwFnLc,2023-04-22 14:21:00,Why do bosses like the ‘Pity City’ CEO seem so out of touch? The growing CEO-to-worker pay gap may offer a clue.,https://www.marketwatch.com/story/why-can-bosses-seem-so-out-of-touch-the-growing-ceo-to-worker-pay-gap-may-offer-a-clue-532978ba
INTC,neutral,0.0,h2TbjRlGBqLiDs4JnGefeCZOHlB6OAA96OZUA6FcSvg,2023-04-22 13:43:00,"Nvidia is AI hardware's growth leader now, but Intel, AMD and others are closing fast",https://www.marketwatch.com/story/nvidia-is-ai-hardwares-leader-now-but-intel-amd-and-others-are-closing-fast-8ad6f23f
INTC,negative,-0.9723766446113586,3kTEis52rBfW-A6z6GXQoU8F4EzQ81blQM4hpMAbL6c,2023-04-20 20:03:40,Bouncing Back from Chipageddon: TSMC Analyst Envisions Recovery after Uneven Q1 Performance,https://www.benzinga.com/news/23/04/31920818/bouncing-back-from-chipageddon-tsmc-analyst-envisions-recovery-after-uneven-q1-performance
INTC,positive,0.9477391839027405,-N6OCW_El8wo6ayZekXk3YX2b4jfREW0EIIEMFpfghY,2023-04-20 14:28:00,Advanced Micro Devices (AMD) Transforms With SAP Partnership,https://www.zacks.com/stock/news/2082271/advanced-micro-devices-amd-transforms-with-sap-partnership
INTC,neutral,0.0,mF7d4UYq5uU68UijAlv9VOf8UrcYxlNrir7GpyP7Z1c,2023-04-20 14:03:13,Earnings Preview: Intel (INTC) Q1 Earnings Expected to Decline,https://www.zacks.com/stock/news/2082077/earnings-preview-intel-intc-q1-earnings-expected-to-decline
INTC,positive,0.9379993677139282,oQr6AuZlbGDu4dIaajwbkfwyepGOllmmbRgkzINvnyI,2023-04-20 11:53:00,Can AI’s ‘iPhone moment’ boost these flagging semiconductor stocks?,https://www.marketwatch.com/story/can-ais-iphone-moment-boost-these-flagging-semiconductor-stocks-ec417001
INTC,negative,-0.9598687887191772,ut3-Eluqu0j8HbvCo0aQL8ha2yxUwe3GW-Yhp_ayZUE,2023-04-20 11:20:00,Intel Sours on Bitcoin Mining Market,https://www.fool.com/investing/2023/04/20/intel-sours-on-bitcoin-mining-market/
INTC,neutral,0.0,PEnrkVE6Tl2in6UWaiKv2D0JkwZnRazRTHVOAinQqNc,2023-04-20 09:18:57,The AI Gold Rush: How Nvidia Stands To Gain Amidst Surging GPU Demand,https://seekingalpha.com/article/4595181-ai-gold-rush-nvidia-stands-to-gain-surging-gpu-demand?source=feed
INTC,neutral,0.0,EVs6j8GsxSPhV-YMsTxCjYZsZ_AgLDh9mR9JOadFyA8,2023-04-20 08:30:00,"Stock Market Earnings Q1 2023: Amazon, Palantir, Nvidia, AMD, Intel, and More",https://www.fool.com/investing/2023/04/20/stock-market-earnings-q1-2023-amazon-palantir-nvid/
INTC,negative,-0.9631620645523071,Q3b9snSCNqr18vRqF2xbEgFYCWarQzsvhiMKQcWEUcw,2023-04-19 13:21:00,"More than 170,000 tech-sector employees have lost their jobs in 2023",https://www.marketwatch.com/story/more-than-170-000-tech-sector-employees-have-lost-their-jobs-since-the-start-of-2023-a3596851
INTC,negative,-0.9719083309173584,3siBCvxwPKLdgYcEib0MU9jHymfLu-uOM6EaTYOyrow,2023-04-19 13:10:06,"PC Unit Sales Plunge in Q1, and TSMC Feels the Effects",https://www.fool.com/investing/2023/04/19/pc-unit-sales-plunge-in-q1-and-tsmc-feels-the-effe/
INTC,neutral,0.0,N3z97G7lnTgBC_RlP3MUWiDW87S7x7Da5tYz4ai-2Fc,2023-04-19 11:52:01,"Could AI Demand Boost High-End Consumer Products From Intel, AMD, and Nvidia?",https://www.fool.com/investing/2023/04/19/could-ai-demand-boost-high-end-consumer-products-f/
INTC,negative,-0.9628705382347107,Gpd2VfJgjdn0YHSlqXnfiDybdbj8sqgq04XzqUxLFVU,2023-04-18 21:45:23,Intel (INTC) Stock Sinks As Market Gains: What You Should Know,https://www.zacks.com/stock/news/2080706/intel-intc-stock-sinks-as-market-gains-what-you-should-know
INTC,negative,-0.8984006643295288,aqieF1VlMq03v7IQtqij99TgA2vkHFwueUP-nGNLa8k,2023-04-18 20:29:00,3 Reasons the Sleepy Action in Stocks is Set to End,https://www.zacks.com/commentary/2080682/3-reasons-the-sleepy-action-in-stocks-is-set-to-end
