ticker,sentiment,sentiment_score,news_id,time,title,article_url
INTC,neutral,0.0,XAYks_30LXYi8xCXPjHeihznlQhndZ2Tvle2CrqaLRw,2023-10-25 10:33:00,1 IPO Stock to Buy Hand Over Fist and 1 to Avoid Like the Plague,https://www.fool.com/investing/2023/10/25/1-ipo-stock-to-buy-hand-over-fist-and-1-to-avoid-l/
INTC,neutral,0.0,-EWhTGxQ1oYyxNBYD-9LPewlZ9bEW4cCTA6tRufJv4A,2023-10-24 17:32:31,"Have $10,000? These 3 Stocks Could Be Bargain Buys for 2023 and Beyond.",https://www.fool.com/investing/2023/10/24/have-10000-these-3-stocks-could-be-bargain-buys-fo/
INTC,positive,0.6290675401687622,66MXdgggF54trT9qapRJWcCH4NqFdOvYncIG_oehc8w,2023-10-24 16:43:03,What's Going On With Nvidia Stock Tuesday?,https://www.benzinga.com/government/23/10/35396502/whats-going-on-with-nvidia-stock-tuesday
INTC,positive,0.8683553338050842,4dkW6u-aJjBv6pXrfch0qn_IjMcIdznRM2LO44IZUyk,2023-10-24 14:18:00,Carrier (CARR) to Report Q3 Earnings: What's in the Cards?,https://www.zacks.com/stock/news/2170909/carrier-carr-to-report-q3-earnings-whats-in-the-cards
INTC,neutral,0.0,cM3iBVRVibPbAbnw5VKJSwm4ZImkomiifj7WBRG9emM,2023-10-24 10:16:00,Better Semiconductor Stock: ASML vs. TSMC,https://www.fool.com/investing/2023/10/24/better-semiconductor-stock-asml-vs-tsmc/
INTC,neutral,0.0,fyfNUAA7VViFA5Khqqf6eFb3MaojLdh2Vh0zjYVPEuw,2023-10-24 10:15:00,Should Advanced Micro Devices and Intel Investors Be Worried About Nvidia Creating a New PC Chip?,https://www.fool.com/investing/2023/10/24/should-advanced-micro-devices-and-intel-investors/
INTC,positive,0.8817905783653259,zhc0Ov9iWcx2FgJaTN6Cf4f1kM75OI1IqaFTBzlWeyA,2023-10-24 09:20:00,"1 Green Flag for AMD Stock in 2023, and 1 Red Flag",https://www.fool.com/investing/2023/10/24/1-green-flag-for-amd-in-2023-and-1-red-flag/
INTC,negative,-0.6144757866859436,DrPk8VosORjixLI7ECrPbFVC1nYQYVxXLWVMTV972Gs,2023-10-24 09:11:00,CACI Set to Report Q1 Earnings: What's in the Offing?,https://www.zacks.com/stock/news/2170586/caci-set-to-report-q1-earnings-whats-in-the-offing
INTC,negative,-0.874427080154419,m0DoMclyUg8ZMo3z-yFwTWvtKZq_VqvbFWU23CWAdi0,2023-10-23 21:44:00,"Big Q3 Earnings Headed Our Way: MSFT, GOOGL & More",https://www.zacks.com/stock/news/2170435/big-q3-earnings-headed-our-way-msft-googl-more
INTC,neutral,0.0,zztOefuAC55NFSg--IJui4Zbgk5cBiR8hriNjjlMMD4,2023-10-23 19:38:00,"Big tech is battling to put AI on your PC, laptop and smartphone",https://www.marketwatch.com/story/big-tech-is-battling-to-put-ai-on-your-pc-laptop-and-smartphone-fee49dac
INTC,neutral,0.0,XPjqvMIx98pM2GM7jvFRm_mSYmaZ6me1GzhCFIGp7y8,2023-10-23 19:36:00,Will Q3 Be a Trick or Treat for Investors As Peak Season Begins?,https://www.investing.com/analysis/will-q3-be-a-trick-or-treat-for-investors-as-peak-season-begins-200642974
INTC,neutral,0.0,1ChU5PGZWMghZl-AFw_InHr5B5nps1NE2bAHEd11RDs,2023-10-23 14:15:00,These Are the 5 Companies I'm Watching Closely This Week,https://www.fool.com/investing/2023/10/23/im-watching-these-5-companies-closely-this-week/
INTC,neutral,0.0,XgRDt8Tp2Gn6AhLvRo5e4s1YcoY1swqfySeZbJmMpew,2023-10-23 14:13:57,Taiwan Semiconductor Manufacturing vs. Intel: TSMC Stands on Intel's Manufacturing Ambitions,https://www.fool.com/investing/2023/10/23/taiwan-semiconductor-manufacturing-vs-intel-tsmc-s/
INTC,negative,-0.9695336818695068,CuoNK61z6AnKYwSiXcaeKJe6YI8FhT4idxGOl8-W5K8,2023-10-23 14:05:00,Semiconductor ETFs in Focus Ahead of Q3 Earnings,https://www.zacks.com/stock/news/2170292/semiconductor-etfs-in-focus-ahead-of-q3-earnings
INTC,negative,-0.9709113240242004,CiVM-YSrcOXOYsxLjiCLs5AMVWlDDoCKRwmMbjBKIAo,2023-10-23 13:29:00,"Stock Market News for Oct 23, 2023",https://www.zacks.com/stock/news/2170194/stock-market-news-for-oct-23-2023
INTC,positive,0.9577611088752747,Az-GV0nZ9D3VFOQP2xacCyM7nM-nNGVaczZ3VjxGltw,2023-10-23 10:13:00,Is a Beat in the Cards for Vertiv (VRT) in Q3 Earnings?,https://www.zacks.com/stock/news/2170068/is-a-beat-in-the-cards-for-vertiv-vrt-in-q3-earnings
INTC,positive,0.9597060084342957,ZTmzp7tx2GA_MNS4owqSuZtRHl_4aOMOrzHBBYYAClA,2023-10-23 09:13:00,Will Software Revenue Improvement Buoy IBM's Q3 Earnings?,https://www.zacks.com/stock/news/2170067/will-software-revenue-improvement-buoy-ibms-q3-earnings
INTC,positive,0.9568873047828674,INNZi55ahUWtJcOMSRMomhARz77qwVSOxVSJRZGQ9IU,2023-10-23 09:11:00,Can Solid Consulting Revenues Benefit IBM's Q3 Earnings?,https://www.zacks.com/stock/news/2170065/can-solid-consulting-revenues-benefit-ibms-q3-earnings
INTC,neutral,0.0,RpSNmRBmvdK1jWICzk0W-bkf9QSk30yK8PWdjO8PfDI,2023-10-23 08:08:00,S&P 500 Earnings Yield Highest Since Mid-March ’23: Can it Last?,https://www.investing.com/analysis/sp-500-earnings-yield-highest-since-midmarch-23-can-it-last-200642953
INTC,negative,-0.9693689942359924,3V4HjXUAOPaCfj7eD8u93OY-oTmi8gQR4mIOIu8phKc,2023-10-23 07:15:17,"Amazon, Alphabet, Meta, Intel Q3 Earnings This Week: Will Mega-Caps Shatter Forecasts And Revive Market?",https://www.benzinga.com/analyst-ratings/analyst-color/23/10/35367409/amazon-alphabet-meta-intel-q3-earnings-this-week-will-mega-caps-shatter-forecasts-a
INTC,positive,0.7086745500564575,TPflUNwiREGFJzOc3ToPshr0y1mgReZ5PLeeXDsdNho,2023-10-22 15:50:00,Where Will TSMC Stock Be in 1 Year?,https://www.fool.com/investing/2023/10/22/where-will-tsmc-stock-be-in-1-year/
INTC,neutral,0.0,UBbdxuCQe9JpClHrsZET0pVd5i1CFQydt2pd-sR8UCU,2023-10-22 13:23:00,Nvidia Stock Is a Battleground: Perspectives From Three Seasoned Tech Investors,https://www.fool.com/investing/2023/10/22/3-perspectives-on-nvidia-as-a-battleground-stock/
INTC,neutral,0.0,WAYpchBFNQDQo4_Ae9wOJZgjQVZjCQBq3W3ZfY_aL-s,2023-10-22 10:54:00,"1 Stock to Buy, 1 Stock to Sell This Week: Meta Platforms, Snap",https://www.investing.com/analysis/1-stock-to-buy-1-stock-to-sell-this-week-meta-platforms-snap-200642935
INTC,negative,-0.9236083030700684,5ax2YHgtFym4BBIcfsyAjscE9fIgw0AoYoDBJ9ol1sE,2023-10-21 16:20:00,Israel-Hamas war threatens tech sector growth and innovation,https://www.marketwatch.com/story/israel-hamas-war-threatens-the-global-tech-sectors-growth-and-innovation-24f20887
INTC,negative,-0.8997987508773804,3wiaWGG_L-4zVIm_cQ7Fyg5ZFKs9jk9CmRv-qCJTuL4,2023-10-20 20:08:03,"Investor Risk Sentiment Wavers Amid War, Interest Rate Concerns; Tesla Earnings Disappoint: The Week In The Markets",https://www.benzinga.com/markets/asia/23/10/35358005/investor-risk-sentiment-wavers-amid-war-interest-rate-concerns-tesla-earnings-disappoint-the-week-in
INTC,negative,-0.9719933867454529,Qjmy7A7MgVaTDbSMyd5eqc1YlPRcWR_K5YVeXPPOtGg,2023-10-20 13:39:00,Will Top-Line Decline Hinder Intel's (INTC) Q3 Earnings?,https://www.zacks.com/stock/news/2169606/will-top-line-decline-hinder-intels-intc-q3-earnings
INTC,positive,0.946240246295929,RnYPwPhyryN_uFv4xF0SdZ_tP0HPill83CtzifmolWU,2023-10-20 12:07:00,F5 (FFIV) to Report Q4 Earnings: Key Factors to Consider,https://www.zacks.com/stock/news/2169419/f5-ffiv-to-report-q4-earnings-key-factors-to-consider
INTC,negative,-0.9670405983924866,ZPDfS7KLkQ7ABxkFWXZHWjWt8_q_0q3AiDRYgREAcOk,2023-10-20 12:00:00,Will Soft Consumer Revenues Hurt Verizon (VZ) Q3 Earnings?,https://www.zacks.com/stock/news/2169519/will-soft-consumer-revenues-hurt-verizon-vz-q3-earnings
INTC,negative,-0.9704740643501282,sVbihabsXBZ7N8Sd09TytWm6d4AWGIOtyROri2_OXcU,2023-10-20 11:52:00,Will Lower Business Revenues Dent Verizon (VZ) Q3 Earnings?,https://www.zacks.com/stock/news/2169470/will-lower-business-revenues-dent-verizon-vz-q3-earnings
INTC,neutral,0.0,eIKm4jursZCzFUVdgVhMcnyn1qNgF_Wb6m233WAKsTM,2023-10-20 11:30:00,"What Intel, AMD, and Super Micro Computer Stock Investors Should Know About Recent Chip Updates",https://www.fool.com/investing/2023/10/20/what-intel-amd-and-super-micro-computer-stock-inve/
INTC,neutral,0.0,XQkTdpdJD8Mj0ZZMSv-iMTvxYCVCi8FKaZiouIcLJC4,2023-10-20 09:40:00,Where Will ASML Stock Be in 1 Year?,https://www.fool.com/investing/2023/10/20/where-will-asml-stock-be-in-1-year/
INTC,neutral,0.0,HHCqnubzSRa7fzGtxYKIr9p9QAnp97goZk0ho6ZYq7c,2023-10-19 14:01:44,Intel (INTC) Expected to Beat Earnings Estimates: Should You Buy?,https://www.zacks.com/stock/news/2168917/intel-intc-expected-to-beat-earnings-estimates-should-you-buy
INTC,negative,-0.9691784977912903,5bpN-K4W9Z6sgMZGy4jT5M8PH7BneeXikyQNbQwUD6o,2023-10-19 12:41:00,Logitech (LOGI) to Report Q2 Earnings: What's in the Offing?,https://www.zacks.com/stock/news/2168646/logitech-logi-to-report-q2-earnings-whats-in-the-offing
INTC,neutral,0.0,6MRe6GTL8TwsWX-wHyeKb28hyKKfH2sktdhZMGyQM7A,2023-10-19 10:20:05,Should Invesco Large Cap Value ETF (PWV) Be on Your Investing Radar?,https://www.zacks.com/stock/news/2168539/should-invesco-large-cap-value-etf-pwv-be-on-your-investing-radar
INTC,negative,-0.9643670916557312,ai2a-Q0hZhsrbyJrR4P29pjNUMZS2xv_Vf3-5xJHTrY,2023-10-18 14:22:00,Will Soft Revenues Affect Verizon's (VZ) Earnings in Q3?,https://www.zacks.com/stock/news/2168171/will-soft-revenues-affect-verizons-vz-earnings-in-q3
INTC,positive,0.957954466342926,hO__H9D0KZMpj8PkSMyq7iunGaIB-tkC3fcVgSPFvdM,2023-10-18 14:20:00,Will Healthy Top-Line Improvement Buoy IBM's Q3 Earnings?,https://www.zacks.com/stock/news/2168169/will-healthy-top-line-improvement-buoy-ibms-q3-earnings
INTC,neutral,0.0,51qUuGUQKv4_Gy2Gr9Bw3epLOInHcZpGD711zN8LybI,2023-10-18 13:31:00,TD SYNNEX's (SNX) Hyve Solutions Unveils Hercules 9120 Platform,https://www.zacks.com/stock/news/2167902/td-synnexs-snx-hyve-solutions-unveils-hercules-9120-platform
INTC,negative,-0.9467079639434814,t3L8jZcOLEYxcmT_ic_fEYJvhbcsnVHoTIuVFzWb0QE,2023-10-18 13:05:00,"Stock Market News for Oct 18, 2023",https://www.zacks.com/stock/news/2167843/stock-market-news-for-oct-18-2023
INTC,negative,-0.6872413158416748,Lvj-uRlkgHHwXlniFtdoLL8qAFy7Dn5C2yZUFtpdUVY,2023-10-18 12:46:00,Will New AI Chip Restrictions Threaten Nvidia Stock Performance?,https://www.investing.com/analysis/will-new-ai-chip-restrictions-threaten-nvidia-stock-performance-200642833
INTC,positive,0.9267473220825195,ehS1oXT_HPgMiMIdXIsavhYjf9kXkGxprEKMgFLZuR0,2023-10-18 12:40:00,Micron Stock: Memory Chip Prices Are Bouncing Back,https://www.fool.com/investing/2023/10/18/micron-stock-memory-chip-prices-are-bouncing-back/
INTC,negative,-0.6526051163673401,9sOKbCmmCa_rZioczttPewwWypk5piuyp70ChobJbG0,2023-10-18 11:35:00,Intel's PC Chip Business Still Has 1 Big Problem,https://www.fool.com/investing/2023/10/18/intels-pc-chip-business-still-has-1-big-problem/
INTC,neutral,0.0,8Bww-zrjnAPTLPoTUa3lnBnDLWvDt5thDVYPMQlUtYw,2023-10-18 10:47:00,"The Zacks Analyst Blog Highlights Pinterest, On Semiconductor, Intel, Alphabet and Meta Platforms",https://www.zacks.com/stock/news/2167704/the-zacks-analyst-blog-highlights-pinterest-on-semiconductor-intel-alphabet-and-meta-platforms
INTC,positive,0.8911736011505127,xhbjaBZRATeac2IXnPcpEYsHtCnJy3TvxG0-DQaCxxU,2023-10-18 10:05:00,Nvidia Is Doubling Its Pace of Innovation: Will It Leave Challengers in the Dust?,https://www.fool.com/investing/2023/10/18/nvidia-is-doubling-its-pace-of-innovation-will-it/
INTC,negative,-0.39060133695602417,W6y7n26Nl0YTbiQezm_KcCpdsQ0LEY-Q-U_xh9auC08,2023-10-17 21:54:00,"AI stole the show this year, but earnings will drag Wall Street back to reality",https://www.marketwatch.com/story/ai-stole-the-show-this-year-but-earnings-will-drag-wall-street-back-to-reality-c06ba5d0
INTC,negative,-0.9743022322654724,G-YIX-xdIG5l85Q4e8D645w6Fa7L_iQTI60Xdc8U50I,2023-10-17 21:45:20,Here's Why Intel (INTC) Fell More Than Broader Market,https://www.zacks.com/stock/news/2167513/heres-why-intel-intc-fell-more-than-broader-market
INTC,negative,-0.9534773826599121,z3qdWO2P7dYEUa0950gynwabXz0vbxV59A5gzSHrRzM,2023-10-17 19:58:00,Nvidia Stock Takes a Hit Amid China Restriction News - Time to Buy the Dip?,https://www.zacks.com/commentary/2167491/nvidia-stock-takes-a-hit-amid-china-restriction-news---time-to-buy-the-dip
INTC,negative,-0.8749971985816956,frOIPtzq3e64DPBy0tzkbPYHw5ScaIq3seLTBock_KM,2023-10-17 15:53:41,Why VMware Stock Just Dropped 7%,https://www.fool.com/investing/2023/10/17/why-vmware-stock-just-dropped-7/
INTC,negative,-0.9546917080879211,Is6B5pvRoYq1FwMar7d9dZzQgk3VDjuPFgY-2nNFMDo,2023-10-17 15:36:57,"Why Nvidia, AMD, Intel, and Other Semiconductor Stocks Are Down After New AI Regulation Announcement",https://www.fool.com/investing/2023/10/17/why-nvidia-amd-intel-and-other-semiconductor-stock/
INTC,negative,-0.968705415725708,cXAdNkUBgWB_CavvJdAB6GVQgT6pM-Xf84kEFxH2UsI,2023-10-17 14:42:00,Nvidia’s stock slides toward worst day in nine months as restrictions on China sales expand,https://www.marketwatch.com/story/nvidias-stock-slides-toward-worst-day-in-nine-months-as-restrictions-on-china-sales-expand-98efac3
INTC,positive,0.8947497606277466,wIW8HR5HeekVUx2qCicpERv0lsHjb3huz_F-CX4DLYo,2023-10-17 14:03:00,5 Technology Stocks Poised to Beat Earnings Estimates in Q3,https://www.zacks.com/stock/news/2167259/5-technology-stocks-poised-to-beat-earnings-estimates-in-q3
INTC,neutral,0.0,P5I_S50hgoZAPC5M_y-UJzrXQUP9WOQZUM-Gw1BzMvI,2023-10-17 13:00:11,Intel Corporation (INTC) is Attracting Investor Attention: Here is What You Should Know,https://www.zacks.com/stock/news/2167031/intel-corporation-intc-is-attracting-investor-attention-here-is-what-you-should-know
INTC,negative,-0.7369253039360046,BMXIbYpm02-6ft6OJxp_70cRF8yt6ek1EmQijZ6232o,2023-10-17 12:46:00,3 Red Flags for ASML's Future,https://www.fool.com/investing/2023/10/17/3-red-flags-for-asmls-future/
INTC,positive,0.7223265767097473,EYgcz1l-FxDAPas7fJLroVZQCZA4evDlxQST9TTQSyo,2023-10-17 11:45:00,Intel's Raptor Lake Refresh Target's AMD's Gaming Advantage,https://www.fool.com/investing/2023/10/17/intels-raptor-lake-refresh-targets-amds-gaming-adv/
INTC,neutral,0.0,3LDTdUMlsUTwaF0-K1vDlJYMPUxYhaIKv4iOMr8LvcQ,2023-10-17 10:20:06,Should You Invest in the First Trust NASDAQ Semiconductor ETF (FTXL)?,https://www.zacks.com/stock/news/2166892/should-you-invest-in-the-first-trust-nasdaq-semiconductor-etf-ftxl
INTC,positive,0.5749703645706177,JX2JwB9Y30TrWpf-jyArfqlbW4WNoTkt5KadEAWBtQQ,2023-10-16 21:07:00,"Intel’s stock is now a popular hedge-fund play, but further momentum may not be a slam dunk",https://www.marketwatch.com/story/intels-stock-is-now-a-popular-hedge-fund-play-but-further-momentum-may-not-be-a-slam-dunk-6376920f
INTC,negative,-0.5698654055595398,BfhcyB0K8e-RywNIcXk30PUFAV_Jb_fuYMytJFIHGmg,2023-10-16 18:55:39,Goldman Sachs Is Bearish On Intel Ahead of Q3 - Here's Why,https://www.benzinga.com/news/23/10/35270801/goldman-sachs-is-bearish-on-intel-ahead-of-q3-heres-why
INTC,negative,-0.7216487526893616,kHNysV0okgvdm1uGVSIgw1Ci_pwGezDvFRxxyQPjQNQ,2023-10-16 17:52:03,What's Going On With AMD Stock Monday?,https://www.benzinga.com/government/23/10/35272425/whats-going-on-with-amd-stock-monday
INTC,neutral,0.0,8W_2gZYWwNosvpUgA2krGJOGOET_QWD8uQ2Mmf3UMYQ,2023-10-16 17:45:13,"Why Intel, Broadcom, and Indie Semi Stocks All Popped Today",https://www.fool.com/investing/2023/10/16/why-intel-broadcom-indie-semi-stocks-popped-today/
INTC,neutral,0.0,e7QL8H76QBXpbsTey3vPchoWL32EoCNh1YdMXFEjVko,2023-10-16 15:48:59,"What Nvidia, Intel, and AMD Stock Investors Should Know About Recent Top AI Updates",https://www.fool.com/investing/2023/10/16/what-nvidia-intel-and-amd-stock-investors-should-k/
INTC,neutral,0.0,iSvaNN3EYOUFjCHvsEne3OwMlpKmx26uPPZJWSqZuo0,2023-10-16 14:15:00,The Good and the Bad News for Intel Stock Investors,https://www.fool.com/investing/2023/10/16/the-good-and-the-bad-news-for-intel-stock-investor/
INTC,positive,0.955102264881134,49Ybmj3_QEWZCRv-BwHTj6JYhpHNLpUmUiftLssf5Dw,2023-10-16 11:47:00,Will Modest Top-Line Growth Aid Q3 Earnings of AT&T (T)?,https://www.zacks.com/stock/news/2166321/will-modest-top-line-growth-aid-q3-earnings-of-att-t
INTC,neutral,0.0,rnLUKBJUR3odFG4dOvNAIByA1Khi8kdNHreTjtrwOSc,2023-10-16 06:40:14,Intel: Promising Turnaround And Future Leadership,https://seekingalpha.com/article/4640937-intel-stock-promising-turnaround-future-leadership-reiterate-buy
INTC,neutral,0.0,93mK0Qka_UjaEwRhVFHbqplru5icaS7FgVPIPXrIjMo,2023-10-15 12:50:00,"1 Reason to Buy AMD Stock, and 1 Reason to Sell",https://www.fool.com/investing/2023/10/15/1-reason-to-buy-amd-stock-and-1-reason-to-sell/
INTC,positive,0.7559866905212402,LpQuxrRwL5BBH9AF2RJpLH1RoaW-nrWMAyIMCA0IU8c,2023-10-14 11:40:00,Intel Launches a New Budget Graphics Card,https://www.fool.com/investing/2023/10/14/intel-launches-a-new-budget-graphic-card/
INTC,negative,-0.9669837355613708,QQBKKpd0xRGpiGrsIhbm_Pkh8dc-fUR8nqfOtkwFprI,2023-10-13 18:49:00,"Tech layoffs exceed 240,000 so far in 2023, more than 50% higher than in all of 2022",https://www.marketwatch.com/story/tech-layoffs-exceed-240-000-in-2023-a1487651
INTC,negative,-0.8712863922119141,uXEploe2UwTf4KEkxDIwDg_VaA2CNUVikrcddBlP69c,2023-10-13 16:10:49,What's Going On With Nvidia Stock Friday?,https://www.benzinga.com/government/23/10/35242412/whats-going-on-with-nvidia-stock-friday
INTC,positive,0.9004077315330505,9Eu4mT7tGQAH7ZrbnZPF_czq0Cr_SWlf0MVYfbag8mo,2023-10-12 17:31:57,What's Going On With Nvidia Stock Thursday?,https://www.benzinga.com/news/23/10/35223327/whats-going-on-with-nvidia-stock-thursday
INTC,neutral,0.0,1wJAg2qEmPefzSlvBj5hDSdG9RzSKZVsMhd5IdfEKv4,2023-10-12 15:10:00,Dow ETF in Focus Ahead of Q3 Earnings,https://www.zacks.com/stock/news/2165006/dow-etf-in-focus-ahead-of-q3-earnings
INTC,neutral,0.0,PSS5zogvRTEhDNeBcrN9F6O-HIMSPlSXOMEuc_Nbl5w,2023-10-12 12:22:00,Q3 Earnings Seasons Kicks Into High Gear Amid Mixed Outlook: What to Expect?,https://www.investing.com/analysis/q3-earnings-seasons-kicks-into-high-gear-amid-mixed-outlook-what-to-expect-200642640
INTC,neutral,0.0,SVCu4o-7RioAE0oKo4oohrqKBXRWz8kdL2nuLZS-_9k,2023-10-12 09:05:00,3 Red Flags for Nvidia's Future,https://www.fool.com/investing/2023/10/12/3-red-flags-for-nvidia-future/
INTC,neutral,0.0,Ki1LNk7SjeAYkOk6hYgrGHHeKER_3mJpGRQ15C3Olhk,2023-10-12 05:03:22,BlackBerry: Breaking Up Is Hard To Do,https://seekingalpha.com/article/4640322-blackberry-breaking-up-is-hard-to
INTC,neutral,0.0,BQUt3-vOF4k-hqVubFXrQ5-YpFwimzSe76VzAf26Y_o,2023-10-11 22:47:00,"As AI matures, Nvidia won't be the only pick-and-shovel company to thrive, BofA analysts say",https://www.marketwatch.com/story/as-ai-matures-nvidia-wont-be-the-only-pick-and-shovel-company-to-thrive-bofa-analysts-say-f1582b97
INTC,neutral,0.0,u9_8Imx1-PELDWH1BN4L0kqvlViUYQcKHThA79GkJug,2023-10-11 14:21:00,Is Nvidia Stock a Buy Now?,https://www.fool.com/investing/2023/10/11/is-nvidia-stock-a-buy-now/
INTC,negative,-0.9145283102989197,Wnxj63WvYCgMSNGVjX-ZM2HjN70FTfVvnw04kV5_6qU,2023-10-11 11:45:00,"Down 26%, This Incredible Dividend Stock Is a Screaming Buy Right Now",https://www.fool.com/investing/2023/10/11/down-26-this-incredible-dividend-stock-is-a-scream/
INTC,positive,0.9225206971168518,d_H3bgK7mipS7RutvFxyVwnK3A6fz2N4pFjGCRS3Y3o,2023-10-11 11:32:00,The PC Crash Is Almost Over. That's Good News for Intel.,https://www.fool.com/investing/2023/10/11/the-pc-crash-is-almost-over-thats-good-news-for-in/
INTC,neutral,0.0,e1_RStdml54DEyZpvVEYx2R0yaQnGQiMo1YmbYlMqls,2023-10-11 10:20:06,Is iShares MSCI USA Value Factor ETF (VLUE) a Strong ETF Right Now?,https://www.zacks.com/stock/news/2164074/is-ishares-msci-usa-value-factor-etf-vlue-a-strong-etf-right-now
INTC,neutral,0.0,Hp1ZTDgJ0qyrY8cykOAby8AutO3LCHQe4OABRpENiCI,2023-10-10 21:21:05,"What Qualcomm, Micron Technology, and AMD Stock Investors Should Know About Recent Semiconductor Updates",https://www.fool.com/investing/2023/10/10/what-qualcomm-micron-technology-and-amd-stock-inve/
INTC,neutral,0.0,rvLNvcOpexlsATqVn3rSpRcDRHv8g1hZCj2zTu_4TTc,2023-10-10 15:33:00,What's in the Offing for SMART Global (SGH) in Q4 Earnings?,https://www.zacks.com/stock/news/2163707/whats-in-the-offing-for-smart-global-sgh-in-q4-earnings
INTC,neutral,0.0,AYxIEKF_LIl8JxS7J1d0RTd0cZqM5YgBU3R6zBFCL3g,2023-10-10 13:38:06,Should Nvidia Stock Investors Be Worried About Microsoft Potentially Creating an AI Chip?,https://www.fool.com/investing/2023/10/10/should-nvidia-stock-investors-be-worried-about-mic/
INTC,positive,0.7696648240089417,oXXv1nOO90Jx_1FW2jlMQyZ0QyeCdoP_3Kf03jOikYY,2023-10-10 11:55:00,Can Vodafone (VOD) Benefit From Open RAN Network Thrust?,https://www.zacks.com/stock/news/2163295/can-vodafone-vod-benefit-from-open-ran-network-thrust
INTC,positive,0.6268928050994873,1gR9OrmM8yFVsggmiOwEXOL6B6tBBNery0oQPmIibdc,2023-10-10 11:51:00,Intel Is Planning Another IPO of A Top Chip Subsidiary -- What Investors Need to Know,https://www.fool.com/investing/2023/10/10/intel-is-planning-another-chip-ipo/
INTC,neutral,0.0,ZHdJR0cyip3AV9-SKRrUc-Na33mmEmAqAds8UkgwE7s,2023-10-10 09:21:00,"1 Artificial Intelligence (AI) Stock That's a Screaming Buy in October, and 1 That Appears Poised to Tumble",https://www.fool.com/investing/2023/10/10/1-ai-stock-screaming-buy-october-1-ready-to-tumble/
INTC,negative,-0.970855176448822,DwZEVF8k6OQhlhwU6zThl1bF5l74LwelPSUSqUNrK9M,2023-10-09 15:06:55,Here's Why Lam Research Stock Dropped 10% Last Month,https://www.fool.com/investing/2023/10/09/heres-why-lam-research-stock-dropped-10-last-month/
INTC,neutral,0.0,Hixt12IUd8_MDQFvqzPJnRNSB64NIHJnn2V9BDezuLA,2023-10-09 13:21:53,"What Nvidia, Intel, and AMD Stock Investors Should Know About This Week's Top Chip Updates",https://www.fool.com/investing/2023/10/09/what-nvidia-intel-and-amd-stock-investors-should-k/
INTC,negative,-0.4911065697669983,LwVGTSzeGoZYVpUyV_VTpJJX4juSzRzV7gs__skazcA,2023-10-09 10:50:00,AMD Could Fail in Artificial Intelligence for 1 Reason,https://www.fool.com/investing/2023/10/09/amd-could-fail-in-artificial-intelligence-ai-for-1/
INTC,neutral,0.0,Mq1p2zBT-Tc-z1eIKKiz4ggNyPoWVpFf5MRgOZbgYzw,2023-10-09 10:05:00,Intel: On the Road to a Breakup?,https://www.fool.com/investing/2023/10/09/intel-on-the-road-to-a-break-up/
INTC,positive,0.5273852944374084,tFt_hbBpf_Fzsadzx9s7jzc_nuAHxK5LYLL-6XwiENg,2023-10-08 11:50:00,Intel Plans IPO for Its Biggest Acquisition,https://www.fool.com/investing/2023/10/08/intel-plans-ipo-for-its-biggest-acquisition/
INTC,negative,-0.6887392997741699,UNc0wNFBw-f3x7SORK-6Bq9Fq9w-qLQkggqJBIn_TsY,2023-10-06 19:56:38,Nvidia Just Made Big Changes to Its Data Center Strategy -- Is This Bad News for AMD and Intel Stock Investors?,https://www.fool.com/investing/2023/10/06/nvidia-just-made-big-changes-to-its-data-center-st/
INTC,neutral,0.0,BgPrRVh-uai2KsoZ3R4cdclcJSZqF-8aG2oJvemHvI8,2023-10-06 15:39:00,IPOs are out of fashion. Here's what companies are doing instead.,https://www.marketwatch.com/story/ipos-are-out-of-fashion-heres-what-companies-are-doing-instead-1d8423eb
INTC,negative,-0.1512163460254669,5Dr9qZR6lesem_9ntc1aRF24fDEHzVtiWgYY-KWg_L8,2023-10-06 14:05:25,"Regulatory Shadow Over Saudi Golf League LIV And PGA Tour Merger, Novo Nordisk's Weight Loss Drugs May Pose Serious Stomach Risks, Netflix's Local Content and Pricing Woes Undermine Growth in India: Today's Top Stories",https://www.benzinga.com/news/23/10/35126486/regulatory-shadow-over-saudi-golf-league-liv-and-pga-tour-merger-novo-nordisks-weight-loss-drugs-may
INTC,neutral,0.0,lBY9eUceWbPf0MzkAn9A8DeK9zlWsBjKPQghv7mpCls,2023-10-05 14:25:00,Howard Hughes Holdings spinning off Seaport Entertainment to shareholders,https://www.marketwatch.com/story/howard-hughes-holdings-spinning-off-seaport-entertainment-to-shareholders-1fc4d5a4
INTC,negative,-0.967867910861969,Y3vp0A3PqgGiTgwk3ImBg2qlJSl3-kdIcLpjQxOjbQY,2023-10-05 11:58:00,"More than 239,000 global tech workers have been laid off so far in 2023",https://www.marketwatch.com/story/more-than-239-000global-tech-workers-have-been-laid-off-so-far-in-2023-7b4fa88d
INTC,neutral,0.0,2yW-9MxiuPbnOATht_OaWs98o715ezky23c1Tgzvieg,2023-10-05 11:39:00,Where Will Intel Be in 3 Years?,https://www.fool.com/investing/2023/10/05/where-will-intel-be-in-3-years/
INTC,neutral,0.0,l2ZWCY-Y2nPf97yYyGbs00TLKjqgkiu377P3zNSKXUk,2023-10-05 11:10:00,"2 AI Chip Stocks That Turned $10,000 Into Millions",https://www.fool.com/investing/2023/10/05/2-ai-chip-stocks-that-turned-10000-into-millions/
INTC,positive,0.6691295504570007,Xwhmbm0fj5mrcA8THme5u_-cmA7GYF4j8v0okLHtKJM,2023-10-05 10:51:00,8 S&P 500 Companies Exposed to China-US Tech War - And 1 Set to Benefit From It,https://www.investing.com/analysis/8-sp-500-companies-exposed-to-chinaus-tech-war--and-1-set-to-benefit-from-it-200642417
INTC,neutral,0.0,EfmYKKoBgFDCo22F1JceotTalGuiafx0SjXdLMFmfPs,2023-10-05 09:40:00,3 Things About Arm Holdings That Smart Investors Know,https://www.fool.com/investing/2023/10/05/things-about-arm-holdings-smart-investors-know/
INTC,negative,-0.6456712484359741,hcEXM31puoYvMJm9ZgUbp0rq-Igdhj4B1RRYihE0hPc,2023-10-05 07:27:06,Semiconductors Winners And Losers At The Start Of Q4 2023,https://seekingalpha.com/article/4639093-semiconductors-winners-and-losers-start-of-q4-2023
INTC,negative,-0.73615562915802,3MfmgGwhAX6w8CvBe2KQLlDi8s56WjerDTNYaKd7wxw,2023-10-04 20:35:00,Dow snaps three-day losing streak after softer-than-expected ADP jobs data,https://www.marketwatch.com/story/s-p-500-futures-recover-early-losses-after-treasury-yields-spike-3ddc7f4f
INTC,neutral,0.0,34Lvo8-mGl73IBRIh7UdSNLg6hvQt0vq4IiXR3QLwcU,2023-10-04 20:20:37,Analysts Maintain Intel's Rating Unmoved Amid Programmable Solutions Group Spinoff,https://www.benzinga.com/news/23/10/35092769/analysts-maintain-intels-rating-unmoved-amid-programmable-solutions-group-spinoff
INTC,neutral,0.0,tawE1k7RXi4y3BTswtlOBku4pj9uK6QBsCyjnDdpSmM,2023-10-04 19:23:09,What Intel Stock Investors Should Know About Its Latest Spinoff and Future IPO Plans,https://www.fool.com/investing/2023/10/04/what-intel-stock-investors-should-know-about-its-l/
INTC,positive,0.8096413016319275,a2otUpfCw0O4UVQKguhbnMv6jOazponox3Irx6n_Au4,2023-10-04 17:52:01,"Stocks Rebound, Tech Shines As Bond Yields Relax, Oil Tumbles: What's Driving Markets Wednesday?",https://www.benzinga.com/news/earnings/23/10/35085018/s-p-500-nasdaq-face-uphill-battle-as-bond-yields-rise-analyst-pins-hope-on-key-jobs-data-this-week
