ticker,sentiment,sentiment_reasoning,news_id,source_ticker,time
ORCL,positive,"The article highlights Oracle's strong performance in the cloud computing and AI markets, with significant customer wins and plans for further data center expansion. The company's financial metrics, such as strong operating cash flow and free cash flow, are also seen as positive factors.",ac68640c4bd892c57b9769569b9021060c7803657044de59500abc6d3287ad44,IBM,2024-10-28 22:30:00
MSFT,neutral,"Microsoft is mentioned as a veteran tech-cloud giant, but the article does not provide any specific commentary on the company's performance or outlook.",ac68640c4bd892c57b9769569b9021060c7803657044de59500abc6d3287ad44,IBM,2024-10-28 22:30:00
IBM,neutral,"IBM is also mentioned as a veteran tech-cloud giant, but the article does not provide any specific commentary on the company's performance or outlook.",ac68640c4bd892c57b9769569b9021060c7803657044de59500abc6d3287ad44,IBM,2024-10-28 22:30:00
IBM,neutral,"The article lists IBM as one of the key players in the compliance automation tools market, but does not provide any specific details about the company's performance or market position.",e79a5e50fb91da1c095621f9151c02319747a2a0785edcaaabf2f46be3c991ec,IBM,2024-10-25 14:44:00
ACHR,neutral,"The article includes Archer as one of the key companies in the compliance automation tools market, but does not provide any further information about the company.",e79a5e50fb91da1c095621f9151c02319747a2a0785edcaaabf2f46be3c991ec,IBM,2024-10-25 14:44:00
ACHR.WS,neutral,"The article includes Archer as one of the key companies in the compliance automation tools market, but does not provide any further information about the company.",e79a5e50fb91da1c095621f9151c02319747a2a0785edcaaabf2f46be3c991ec,IBM,2024-10-25 14:44:00
IBM,positive,"IBM's AI-enabled software business, including its generative AI offerings, is its fastest growing segment and represents a significant portion of its revenue. The stock dip presents a buying opportunity as the company continues to focus on this high-growth area.",270d2e6f5e0851947f4203ea9b12003cddef813da4d954e84298c91d1f6f6993,IBM,2024-10-25 14:32:00
IBM,positive,"The article suggests that IBM's dividend payouts are expected to continue growing, with the company likely raising its quarterly dividend by at least $0.01 per share next year. This is due to the company's strong software sales and growing presence in enterprise AI services, which are driving its profitability and cash flow.",1a28db18f6d90d339c9f07f04e9922c89c7524acd1bb156768ed3581cfca1b62,IBM,2024-10-25 10:27:00
GM,positive,"GM surpassed Wall Street expectations and raised full-year guidance, causing a 10% stock price increase.",6912e30d6e1286e10f1623fe0cde648318e22d17e109b3d360b34645d00da465,IBM,2024-10-24 15:30:00
PM,positive,"PM beat Q3 expectations and raised EPS guidance, leading to a nearly 9% stock price increase.",6912e30d6e1286e10f1623fe0cde648318e22d17e109b3d360b34645d00da465,IBM,2024-10-24 15:30:00
VZ,negative,"VZ released disappointing results, leading to a downturn in the stock price.",6912e30d6e1286e10f1623fe0cde648318e22d17e109b3d360b34645d00da465,IBM,2024-10-24 15:30:00
LMT,negative,"LMT released disappointing results, leading to a downturn in the stock price.",6912e30d6e1286e10f1623fe0cde648318e22d17e109b3d360b34645d00da465,IBM,2024-10-24 15:30:00
TSLA,positive,"TSLA reported better-than-expected results on the bottom line, causing a 10% stock price increase.",6912e30d6e1286e10f1623fe0cde648318e22d17e109b3d360b34645d00da465,IBM,2024-10-24 15:30:00
IBM,negative,"IBM reported results that surpassed Wall Street estimates on EPS but missed on revenues, leading to a 5% stock price decline.",6912e30d6e1286e10f1623fe0cde648318e22d17e109b3d360b34645d00da465,IBM,2024-10-24 15:30:00
BA,negative,"Boeing preannounced weak expectations, which contributed to the overall decline in the blended growth rate for the S&P 500.",6912e30d6e1286e10f1623fe0cde648318e22d17e109b3d360b34645d00da465,IBM,2024-10-24 15:30:00
HON,neutral,"HON slightly missed on revenues, but the stock price did not see a significant reaction.",6912e30d6e1286e10f1623fe0cde648318e22d17e109b3d360b34645d00da465,IBM,2024-10-24 15:30:00
LUV,positive,"LUV beat on both the top and bottom lines, but the stock price did not see a significant boost.",6912e30d6e1286e10f1623fe0cde648318e22d17e109b3d360b34645d00da465,IBM,2024-10-24 15:30:00
UPS,positive,"UPS beat on both the top and bottom lines, and the stock price saw a boost after the report.",6912e30d6e1286e10f1623fe0cde648318e22d17e109b3d360b34645d00da465,IBM,2024-10-24 15:30:00
IBM,positive,"IBM is mentioned as one of the top players in the automation testing market, indicating its strong presence and capabilities in this domain.",0d28ebaf7c85883a9d165843293ce9b4b6f69c6c49f1fb1608ad7e8b85327987,IBM,2024-10-24 12:30:00
CGEMY,positive,"Capgemini SE is also listed as one of the leading companies in the automation testing market, suggesting its expertise and market position.",0d28ebaf7c85883a9d165843293ce9b4b6f69c6c49f1fb1608ad7e8b85327987,IBM,2024-10-24 12:30:00
WIT,positive,"Wipro Limited is identified as a key player in the automation testing market, highlighting its prominence in the industry.",0d28ebaf7c85883a9d165843293ce9b4b6f69c6c49f1fb1608ad7e8b85327987,IBM,2024-10-24 12:30:00
ACN,positive,"Accenture Plc is mentioned as one of the top companies operating in the automation testing market, indicating its strong market presence.",0d28ebaf7c85883a9d165843293ce9b4b6f69c6c49f1fb1608ad7e8b85327987,IBM,2024-10-24 12:30:00
CRM,positive,"Salesforce is mentioned as a major participant in the iPaaS market, suggesting its involvement and potential to benefit from the market's growth.",9ecf394750d5248bc9ebe342f76aa6f8eb7b94452ae5a61553b9cafdc3003db9,IBM,2024-10-21 06:44:00
INFA,positive,"Informatica is mentioned as a major participant in the iPaaS market, indicating its prominence and potential to capitalize on the market's expansion.",9ecf394750d5248bc9ebe342f76aa6f8eb7b94452ae5a61553b9cafdc3003db9,IBM,2024-10-21 06:44:00
MSFT,positive,"Microsoft is mentioned as a major participant in the iPaaS market, suggesting its strong presence and ability to drive the market's growth.",9ecf394750d5248bc9ebe342f76aa6f8eb7b94452ae5a61553b9cafdc3003db9,IBM,2024-10-21 06:44:00
ORCL,positive,"Oracle is mentioned as a major participant in the iPaaS market, indicating its involvement and potential to benefit from the market's expansion.",9ecf394750d5248bc9ebe342f76aa6f8eb7b94452ae5a61553b9cafdc3003db9,IBM,2024-10-21 06:44:00
IBM,positive,"IBM is mentioned as a major participant in the iPaaS market, suggesting its prominent role and ability to capitalize on the market's growth.",9ecf394750d5248bc9ebe342f76aa6f8eb7b94452ae5a61553b9cafdc3003db9,IBM,2024-10-21 06:44:00
IBM,positive,"The article highlights IBM's long history of AI innovation and its focus on enterprise-grade AI solutions through the Watsonx platform, which has already generated over $2 billion in orders.",d3190ba8d960e60cf77686f604f82cac4f0af10b1608959343e668ad4991d6b5,IBM,2024-10-20 15:43:00
PATH,positive,"The article praises UiPath's robotic process automation solutions, which are seen as a powerful combination with AI, and notes that the stock is undervalued despite strong financial performance.",d3190ba8d960e60cf77686f604f82cac4f0af10b1608959343e668ad4991d6b5,IBM,2024-10-20 15:43:00
NVDA,neutral,"The article acknowledges Nvidia's dominance in the AI market but suggests that the stock may be overvalued, leading the author to prefer alternative AI investment options.",d3190ba8d960e60cf77686f604f82cac4f0af10b1608959343e668ad4991d6b5,IBM,2024-10-20 15:43:00
IBM,neutral,"The author mentions that IBM will be getting close scrutiny, but does not provide a specific sentiment.",9f80f096daf25e2ad3947ec8de0d585f0c0a037201a4e9bba3ba94207c74efd9,IBM,2024-10-18 19:10:00
TSLA,negative,The author expresses concern that Elon Musk is getting distracted by politics and that Tesla needs a lower-cost model for US consumers.,9f80f096daf25e2ad3947ec8de0d585f0c0a037201a4e9bba3ba94207c74efd9,IBM,2024-10-18 19:10:00
CME,neutral,"The author states that CME Group's valuation model will be updated, but does not provide a specific sentiment.",9f80f096daf25e2ad3947ec8de0d585f0c0a037201a4e9bba3ba94207c74efd9,IBM,2024-10-18 19:10:00
KO,neutral,"The author mentions that Coca-Cola's valuation model will be updated, but does not provide a specific sentiment.",9f80f096daf25e2ad3947ec8de0d585f0c0a037201a4e9bba3ba94207c74efd9,IBM,2024-10-18 19:10:00
IBM,positive,"IBM is also mentioned as a partner in the new center, indicating their involvement in the development of AI and machine learning tools for solar eruption prediction.",85d21e7341da968210649ebeae3149490ca44e8603a0075fce188e155e6dd7fc,IBM,2024-10-17 19:00:00
SAP,positive,"SAP is mentioned as one of the key players in the asset performance management market, indicating its strong presence and potential to benefit from the market growth.",207de97b2238c6ffd254cb920418cdababe3fabf4e490756fa39dc152468ff7f,IBM,2024-10-17 12:37:48
IBM,positive,"IBM is mentioned as one of the key players in the asset performance management market, indicating its strong presence and potential to benefit from the market growth.",207de97b2238c6ffd254cb920418cdababe3fabf4e490756fa39dc152468ff7f,IBM,2024-10-17 12:37:48
EMR,positive,"Emerson is mentioned as one of the key players in the asset performance management market, indicating its strong presence and potential to benefit from the market growth.",207de97b2238c6ffd254cb920418cdababe3fabf4e490756fa39dc152468ff7f,IBM,2024-10-17 12:37:48
BSY,positive,"Bentley Systems is mentioned as one of the key players in the asset performance management market, indicating its strong presence and potential to benefit from the market growth.",207de97b2238c6ffd254cb920418cdababe3fabf4e490756fa39dc152468ff7f,IBM,2024-10-17 12:37:48
ROK,positive,"Rockwell Automation is mentioned as one of the key players in the asset performance management market, indicating its strong presence and potential to benefit from the market growth.",207de97b2238c6ffd254cb920418cdababe3fabf4e490756fa39dc152468ff7f,IBM,2024-10-17 12:37:48
SMNEY,positive,"Siemens Energy is mentioned as one of the key players in the asset performance management market, indicating its strong presence and potential to benefit from the market growth.",207de97b2238c6ffd254cb920418cdababe3fabf4e490756fa39dc152468ff7f,IBM,2024-10-17 12:37:48
ABBNY,positive,"ABB is mentioned as one of the key players in the asset performance management market, indicating its strong presence and potential to benefit from the market growth.",207de97b2238c6ffd254cb920418cdababe3fabf4e490756fa39dc152468ff7f,IBM,2024-10-17 12:37:48
CRM,positive,"The article suggests that Salesforce could be the top-performing stock in the Dow next year, driven by the company's strong performance in the AI space, particularly with its virtual assistant Agentforce. The author believes Salesforce has the most upside compared to its DJIA peers.",a56441d1f11b684bd7f4836963d8648ddf288fc290d7802547a944b80e006cc2,IBM,2024-10-16 14:15:00
MSFT,positive,"The article mentions Microsoft's success with its CoPilot assistant, which runs on ChatGPT, and how Salesforce has taken note of this and decided to challenge its big tech cohort with its own virtual assistant, Agentforce.",a56441d1f11b684bd7f4836963d8648ddf288fc290d7802547a944b80e006cc2,IBM,2024-10-16 14:15:00
AMZN,neutral,"The article states that the author is bullish on Amazon, but also mentions that the company is facing a lot of pressure and scrutiny to drive consistent impressive results, considering it has poured billions into its AI initiatives.",a56441d1f11b684bd7f4836963d8648ddf288fc290d7802547a944b80e006cc2,IBM,2024-10-16 14:15:00
AAPL,neutral,"The article suggests that Apple's AI roadmap is in its early stages, making it hard to predict how its decisions will pan out.",a56441d1f11b684bd7f4836963d8648ddf288fc290d7802547a944b80e006cc2,IBM,2024-10-16 14:15:00
INTC,negative,The article states that the author thinks Intel's best days may be behind it.,a56441d1f11b684bd7f4836963d8648ddf288fc290d7802547a944b80e006cc2,IBM,2024-10-16 14:15:00
IBM,negative,The article suggests that IBM is stuck competing in saturated markets.,a56441d1f11b684bd7f4836963d8648ddf288fc290d7802547a944b80e006cc2,IBM,2024-10-16 14:15:00
CSCO,negative,The article indicates that Cisco is stuck competing in saturated markets.,a56441d1f11b684bd7f4836963d8648ddf288fc290d7802547a944b80e006cc2,IBM,2024-10-16 14:15:00
IBM,positive,"IBM is bringing complete Jakarta EE compatibility and production support, along with MicroProfile, making it ideal for cloud native applications.",2c67a707d513fda095c42216dc70e727555effa15bd00963ea70397c4bab114d,IBM,2024-10-15 10:00:00
MSFT,positive,Microsoft is proud to play a key role in the upcoming Jakarta EE 11 release alongside partners.,2c67a707d513fda095c42216dc70e727555effa15bd00963ea70397c4bab114d,IBM,2024-10-15 10:00:00
ORCL,positive,"Oracle's investments in WebLogic Server, Helidon, Coherence, Java and AI are aligned with the trends shown in the survey, including growing adoption of Jakarta EE and MicroProfile technologies.",2c67a707d513fda095c42216dc70e727555effa15bd00963ea70397c4bab114d,IBM,2024-10-15 10:00:00
IBM,positive,"IBM is mentioned as one of the key players in the AI in drug discovery market, indicating its involvement and potential growth opportunities in this space.",d39920e2d51765c76312eebf2e1b975dcdcf4cc64b83ac9cb99bdddfcee96317,IBM,2024-10-14 14:48:00
NVDA,positive,"NVIDIA is also listed as a key player in the AI in drug discovery market, suggesting its technology and solutions are being utilized in this domain.",d39920e2d51765c76312eebf2e1b975dcdcf4cc64b83ac9cb99bdddfcee96317,IBM,2024-10-14 14:48:00
GOOG,positive,"DeepMind, a subsidiary of Alphabet, is mentioned as a key player in the AI in drug discovery market, highlighting its expertise and contributions in this area.",d39920e2d51765c76312eebf2e1b975dcdcf4cc64b83ac9cb99bdddfcee96317,IBM,2024-10-14 14:48:00
GOOGL,positive,"DeepMind, a subsidiary of Alphabet, is mentioned as a key player in the AI in drug discovery market, highlighting its expertise and contributions in this area.",d39920e2d51765c76312eebf2e1b975dcdcf4cc64b83ac9cb99bdddfcee96317,IBM,2024-10-14 14:48:00
IBM,positive,"IBM is mentioned as a major player in the smart cities market, offering solutions like Intelligent Operations Center and Smart Grid, indicating its involvement in the growth of this market.",17f45f02edf82d5fda1b0509b0c981eadb3b94a90ef6d3c4a1f8080130384438,IBM,2024-10-14 13:00:00
CSCO,positive,"Cisco Systems is listed as a major player in the smart cities market, providing solutions like Smart+Connected Communities and IoT Control Center, suggesting its active participation in the market's expansion.",17f45f02edf82d5fda1b0509b0c981eadb3b94a90ef6d3c4a1f8080130384438,IBM,2024-10-14 13:00:00
SIEGY,positive,"Siemens is mentioned as a major player in the smart cities market, offering solutions like Smart Infrastructure Solutions and Traffic Management Systems, indicating its contribution to the market's growth.",17f45f02edf82d5fda1b0509b0c981eadb3b94a90ef6d3c4a1f8080130384438,IBM,2024-10-14 13:00:00
MSFT,positive,"Microsoft is listed as a major player in the smart cities market, providing solutions like Azure IoT Suite and Smart City Solutions, suggesting its involvement in the market's development.",17f45f02edf82d5fda1b0509b0c981eadb3b94a90ef6d3c4a1f8080130384438,IBM,2024-10-14 13:00:00
SBGSY,positive,"Schneider Electric is listed as a major player in the smart cities market, providing solutions like EcoStruxure and Smart Cities Solutions, suggesting its active role in the market's growth.",17f45f02edf82d5fda1b0509b0c981eadb3b94a90ef6d3c4a1f8080130384438,IBM,2024-10-14 13:00:00
HON,positive,"Honeywell is mentioned as a major player in the smart cities market, offering solutions like Building Management Solutions and Smart City Solutions, indicating its involvement in the market's development.",17f45f02edf82d5fda1b0509b0c981eadb3b94a90ef6d3c4a1f8080130384438,IBM,2024-10-14 13:00:00
ORCL,positive,"Oracle is listed as a major player in the smart cities market, providing solutions like Cloud Applications for Smart Cities and Urban Planning Solutions, suggesting its contribution to the market's expansion.",17f45f02edf82d5fda1b0509b0c981eadb3b94a90ef6d3c4a1f8080130384438,IBM,2024-10-14 13:00:00
PHG,positive,"Philips Lighting is listed as a major player in the smart cities market, providing solutions like Connected Lighting Solutions and Smart Street Lighting, suggesting its active role in the market's development.",17f45f02edf82d5fda1b0509b0c981eadb3b94a90ef6d3c4a1f8080130384438,IBM,2024-10-14 13:00:00
ACN,positive,"Accenture is mentioned as a major player in the smart cities market, offering solutions like Smart Cities Strategy Consulting and Digital Solutions, indicating its involvement in the market's expansion.",17f45f02edf82d5fda1b0509b0c981eadb3b94a90ef6d3c4a1f8080130384438,IBM,2024-10-14 13:00:00
CSCO,positive,"Cisco Meraki is listed as a major player in the smart cities market, providing solutions like Smart Cameras and Wireless Access Points, suggesting its contribution to the market's growth.",17f45f02edf82d5fda1b0509b0c981eadb3b94a90ef6d3c4a1f8080130384438,IBM,2024-10-14 13:00:00
HTHIY,positive,"Hitachi is mentioned as a major player in the smart cities market, offering solutions like Social Innovation Solutions and Urban Mobility Solutions, indicating its participation in the market's development.",17f45f02edf82d5fda1b0509b0c981eadb3b94a90ef6d3c4a1f8080130384438,IBM,2024-10-14 13:00:00
QCOM,positive,"Qualcomm is mentioned as a major player in the smart cities market, offering solutions like Smart City Solutions and IoT Platforms, indicating its involvement in the market's growth.",17f45f02edf82d5fda1b0509b0c981eadb3b94a90ef6d3c4a1f8080130384438,IBM,2024-10-14 13:00:00
AMZN,positive,"AWS is listed as a major player in the smart cities market, providing solutions like AWS IoT Core and Smart City Analytics, suggesting its contribution to the market's development.",17f45f02edf82d5fda1b0509b0c981eadb3b94a90ef6d3c4a1f8080130384438,IBM,2024-10-14 13:00:00
FJTSY,positive,"Fujitsu is listed as a major player in the smart cities market, providing solutions like Smart City Services and Urban Infrastructure Solutions, suggesting its active role in the market's growth.",17f45f02edf82d5fda1b0509b0c981eadb3b94a90ef6d3c4a1f8080130384438,IBM,2024-10-14 13:00:00
VEOEY,positive,"Veolia is mentioned as a major player in the smart cities market, offering solutions like Smart Water Management and Waste Management Solutions, indicating its involvement in the market's development.",17f45f02edf82d5fda1b0509b0c981eadb3b94a90ef6d3c4a1f8080130384438,IBM,2024-10-14 13:00:00
SSDIY,positive,"Samsung is mentioned as a major player in the smart cities market, offering solutions like Smart Lighting and Smart Home Technology, indicating its participation in the market's growth.",17f45f02edf82d5fda1b0509b0c981eadb3b94a90ef6d3c4a1f8080130384438,IBM,2024-10-14 13:00:00
TSHTY,positive,"Toshiba is listed as a major player in the smart cities market, providing solutions like Smart Community Solutions and Energy Management Systems, suggesting its active role in the market's expansion.",17f45f02edf82d5fda1b0509b0c981eadb3b94a90ef6d3c4a1f8080130384438,IBM,2024-10-14 13:00:00
CSCO,positive,"Cisco is a leading provider of silicon photonics technology, which is expected to benefit from the growing demand for low-power electronics and the rise of quantum computing.",b9d3cd85532e44cd411ab96e675fa230e6d23c7b1d883fbc0abe3356805d9a82,IBM,2024-10-14 12:30:00
INTC,positive,Intel is a major player in the semiconductor industry and is likely to capitalize on the growth of the silicon photonics market.,b9d3cd85532e44cd411ab96e675fa230e6d23c7b1d883fbc0abe3356805d9a82,IBM,2024-10-14 12:30:00
IBM,positive,"IBM is a prominent technology company that is actively involved in the development of quantum computing, which is expected to drive the demand for silicon photonics.",b9d3cd85532e44cd411ab96e675fa230e6d23c7b1d883fbc0abe3356805d9a82,IBM,2024-10-14 12:30:00
MSFT,positive,"Microsoft is a leading player in the data monetization market, providing tools and solutions that enable organizations to leverage their data assets.",2562d6257d30816eb87dcc0e0397eca282904280c76c1fb169bb9b856b4b0979,IBM,2024-10-14 12:00:00
ORCL,positive,"Oracle is another prominent player in the data monetization market, offering cloud-based data management and analytics solutions.",2562d6257d30816eb87dcc0e0397eca282904280c76c1fb169bb9b856b4b0979,IBM,2024-10-14 12:00:00
CRM,positive,"Salesforce is a key player in the data monetization market, providing customer relationship management (CRM) and data analytics tools to help organizations monetize their data.",2562d6257d30816eb87dcc0e0397eca282904280c76c1fb169bb9b856b4b0979,IBM,2024-10-14 12:00:00
IBM,positive,"IBM is a major player in the data monetization market, offering a range of data management and analytics solutions.",2562d6257d30816eb87dcc0e0397eca282904280c76c1fb169bb9b856b4b0979,IBM,2024-10-14 12:00:00
SAP,positive,"SAP is a leading provider of enterprise software and solutions, including data management and analytics tools that are relevant for data monetization.",2562d6257d30816eb87dcc0e0397eca282904280c76c1fb169bb9b856b4b0979,IBM,2024-10-14 12:00:00
DOMO,positive,Domo offers cloud-based data management and analytics tools that can help organizations monetize their data.,2562d6257d30816eb87dcc0e0397eca282904280c76c1fb169bb9b856b4b0979,IBM,2024-10-14 12:00:00
SAP,positive,"SAP is a major player in the QMS market, offering solutions like SAP Quality Management and SAP Integrated Business Planning, which are expected to contribute to the market growth.",c1c21741497eefb1dd027ee2f37a7028210996e5b700c2a78261279c9fa53289,IBM,2024-10-11 13:00:00
ORCL,positive,"Oracle is another prominent player in the QMS market, providing solutions like Oracle Quality Management Cloud and Oracle Manufacturing Cloud, which are likely to drive market demand.",c1c21741497eefb1dd027ee2f37a7028210996e5b700c2a78261279c9fa53289,IBM,2024-10-11 13:00:00
SIEGY,positive,"Siemens offers QMS solutions like Siemens Teamcenter Quality and Siemens Opcenter Quality, which are expected to contribute to the market growth.",c1c21741497eefb1dd027ee2f37a7028210996e5b700c2a78261279c9fa53289,IBM,2024-10-11 13:00:00
IBM,positive,"IBM provides QMS solutions like IBM Watson Quality and IBM Maximo Asset Management, which are likely to drive market demand.",c1c21741497eefb1dd027ee2f37a7028210996e5b700c2a78261279c9fa53289,IBM,2024-10-11 13:00:00
NVDA,positive,"NVIDIA is a leading provider of accelerator cards, including the NVIDIA A100 and NVIDIA RTX A6000, which are well-positioned to benefit from the growing demand for high-performance computing and AI applications.",0fc43a17b9fd41ce6e20f8a9bec306f84719a7fdc5cba4149d82bd97202b2083,IBM,2024-10-11 13:00:00
AMD,positive,"AMD, through its Radeon Pro and Radeon RX 6000 series accelerator cards, is also well-positioned to capitalize on the growth in the accelerator card market, particularly in the high-performance computing and gaming sectors.",0fc43a17b9fd41ce6e20f8a9bec306f84719a7fdc5cba4149d82bd97202b2083,IBM,2024-10-11 13:00:00
INTC,positive,"Intel's Xeon Phi and FPGA PAC N3000 accelerator cards are expected to contribute to the growth of the accelerator card market, as the company continues to invest in developing specialized hardware for high-performance computing and AI applications.",0fc43a17b9fd41ce6e20f8a9bec306f84719a7fdc5cba4149d82bd97202b2083,IBM,2024-10-11 13:00:00
AMD,positive,"Xilinx, now part of AMD, offers the Versal ACAP and Kintex UltraScale FPGA accelerator cards, which are well-positioned to benefit from the increasing demand for programmable hardware in the accelerator card market.",0fc43a17b9fd41ce6e20f8a9bec306f84719a7fdc5cba4149d82bd97202b2083,IBM,2024-10-11 13:00:00
MU,positive,"Micron Technology's Micron 9300 NVMe SSD and Micron 5210 ION SSD accelerator cards are expected to contribute to the growth of the accelerator card market, as the company continues to develop high-performance storage solutions.",0fc43a17b9fd41ce6e20f8a9bec306f84719a7fdc5cba4149d82bd97202b2083,IBM,2024-10-11 13:00:00
AVGO,positive,Broadcom's NetXtreme II and StrataXGS accelerator cards are well-positioned to benefit from the increasing demand for high-performance networking solutions in the accelerator card market.,0fc43a17b9fd41ce6e20f8a9bec306f84719a7fdc5cba4149d82bd97202b2083,IBM,2024-10-11 13:00:00
IBM,positive,"IBM's Cloud Accelerator and Power System AC922 accelerator cards are expected to contribute to the growth of the accelerator card market, as the company continues to develop specialized hardware for cloud computing and high-performance computing applications.",0fc43a17b9fd41ce6e20f8a9bec306f84719a7fdc5cba4149d82bd97202b2083,IBM,2024-10-11 13:00:00
AMZN,positive,Amazon Web Services' Inferentia and Graviton accelerator cards are well-positioned to benefit from the increasing demand for cloud-based AI and high-performance computing solutions in the accelerator card market.,0fc43a17b9fd41ce6e20f8a9bec306f84719a7fdc5cba4149d82bd97202b2083,IBM,2024-10-11 13:00:00
QCOM,positive,"Qualcomm's Snapdragon 8cx and Cloud AI 100 accelerator cards are expected to contribute to the growth of the accelerator card market, as the company continues to develop specialized hardware for mobile and cloud computing applications.",0fc43a17b9fd41ce6e20f8a9bec306f84719a7fdc5cba4149d82bd97202b2083,IBM,2024-10-11 13:00:00
