ticker,sentiment,sentiment_reasoning,news_id,source_ticker,time
SBGSY,positive,"Schneider Electric is mentioned as one of the major players in the smart grid security market, implying their involvement and potential to capitalize on the industry's expansion.",0c86ebdfe58025704aa87ea1d89fec623c031598059aef5982c46c9433cc7558,IBM,2024-08-06 21:00:00
LMT,positive,"The article includes Lockheed Martin Corporation as a key player in the smart grid security market, indicating their expertise and potential to benefit from the industry's growth.",0c86ebdfe58025704aa87ea1d89fec623c031598059aef5982c46c9433cc7558,IBM,2024-08-06 21:00:00
IBM,positive,"IBM is listed as one of the major players in the smart grid security market, suggesting their strong presence and potential to capitalize on the industry's expansion.",0c86ebdfe58025704aa87ea1d89fec623c031598059aef5982c46c9433cc7558,IBM,2024-08-06 21:00:00
ETR,positive,"The article mentions Entergy as a major player in the smart grid security market, implying their involvement and potential to benefit from the industry's growth.",0c86ebdfe58025704aa87ea1d89fec623c031598059aef5982c46c9433cc7558,IBM,2024-08-06 21:00:00
CSCO,positive,"Cisco Systems Inc. is listed as one of the key players in the smart grid security market, suggesting their strong presence and potential to capitalize on the industry's expansion.",0c86ebdfe58025704aa87ea1d89fec623c031598059aef5982c46c9433cc7558,IBM,2024-08-06 21:00:00
HON,positive,"The article mentions Honeywell (Elster) as a major player in the smart grid security market, implying their expertise and potential to contribute to the industry's growth.",0c86ebdfe58025704aa87ea1d89fec623c031598059aef5982c46c9433cc7558,IBM,2024-08-06 21:00:00
ETN,positive,"Eaton Corporation is included as one of the key players in the smart grid security market, indicating their involvement and potential to benefit from the industry's expansion.",0c86ebdfe58025704aa87ea1d89fec623c031598059aef5982c46c9433cc7558,IBM,2024-08-06 21:00:00
CSCO,positive,"Cisco Systems is a key player in the cloud system management market, providing solutions that enable organizations to manage their cloud resources effectively.",ffd26fa70af831dd9ab09ef62e0afba6818e62390667695948e47b8d60bd6b08,IBM,2024-08-01 16:45:00
HPE,positive,"HPE is a major provider of cloud system management solutions, helping organizations optimize their cloud environments and improve their IT operations.",ffd26fa70af831dd9ab09ef62e0afba6818e62390667695948e47b8d60bd6b08,IBM,2024-08-01 16:45:00
IBM,positive,"IBM is a leading player in the cloud system management market, offering solutions that leverage AI and machine learning to enhance cloud management capabilities.",ffd26fa70af831dd9ab09ef62e0afba6818e62390667695948e47b8d60bd6b08,IBM,2024-08-01 16:45:00
MSFT,positive,"Microsoft is a key player in the cloud system management market, with its Azure platform providing a range of cloud management tools and services.",ffd26fa70af831dd9ab09ef62e0afba6818e62390667695948e47b8d60bd6b08,IBM,2024-08-01 16:45:00
ORCL,positive,"Oracle is a prominent provider of cloud system management solutions, helping organizations manage their cloud resources and optimize their cloud-based operations.",ffd26fa70af831dd9ab09ef62e0afba6818e62390667695948e47b8d60bd6b08,IBM,2024-08-01 16:45:00
NOW,positive,"ServiceNow is a leading provider of cloud system management solutions, helping organizations streamline their IT operations and improve their cloud-based service delivery.",ffd26fa70af831dd9ab09ef62e0afba6818e62390667695948e47b8d60bd6b08,IBM,2024-08-01 16:45:00
MSFT,positive,"Microsoft is mentioned as one of the leading players in the IAM market, indicating its strong position and potential to benefit from the market growth.",6a9fffb58500ff85c81b1890a21260ea47fddeaebd3c228b9622836e179a7468,IBM,2024-08-01 11:57:00
OKTA,positive,"Okta is also mentioned as one of the leading players in the IAM market, suggesting its competitiveness and ability to capitalize on the market opportunities.",6a9fffb58500ff85c81b1890a21260ea47fddeaebd3c228b9622836e179a7468,IBM,2024-08-01 11:57:00
IBM,positive,"IBM is listed as a key player in the IAM market, highlighting its expertise and market presence in this domain.",6a9fffb58500ff85c81b1890a21260ea47fddeaebd3c228b9622836e179a7468,IBM,2024-08-01 11:57:00
ORCL,positive,"Oracle is identified as one of the leading companies in the IAM market, indicating its strong position and potential to benefit from the market growth.",6a9fffb58500ff85c81b1890a21260ea47fddeaebd3c228b9622836e179a7468,IBM,2024-08-01 11:57:00
CRM,positive,"Salesforce is mentioned as a prominent player in the IAM market, suggesting its ability to capitalize on the growing demand for IAM solutions.",6a9fffb58500ff85c81b1890a21260ea47fddeaebd3c228b9622836e179a7468,IBM,2024-08-01 11:57:00
AMZN,positive,"Amazon's dominance in cloud computing, which is a crucial backbone of the AI industry, and its extensive in-house use of AI across its e-commerce operations make it a versatile and promising investment for the long haul.",0cd64391d7aaa6ebd9c6ef9a9428c71b436e6ca5ff0ec5ff2fed3b1a0d96f7d2,IBM,2024-07-31 14:47:00
IBM,positive,"IBM's deep-rooted expertise in AI research, extensive patent portfolio, and focus on enterprise solutions provide a solid foundation for future growth in the AI space. The company is well-positioned to capitalize on the accelerating AI adoption.",0cd64391d7aaa6ebd9c6ef9a9428c71b436e6ca5ff0ec5ff2fed3b1a0d96f7d2,IBM,2024-07-31 14:47:00
AMD,positive,"The article mentions the company as a leading player in the data center GPU market, indicating its strong market presence and potential to benefit from the industry's growth.",70c3b586e879df9e07ccc1d088765dcae440a670a7b21ed9b6046b5d2560e4a7,IBM,2024-07-31 09:46:00
AMZN,positive,"The article highlights the growing use of data center GPUs in cloud computing, which suggests that companies like Amazon Web Services, a leading cloud service provider, could benefit from this trend.",70c3b586e879df9e07ccc1d088765dcae440a670a7b21ed9b6046b5d2560e4a7,IBM,2024-07-31 09:46:00
IBM,neutral,"The company is listed as one of the key players in the data center GPU market, but no further information is given about its market position or growth potential.",70c3b586e879df9e07ccc1d088765dcae440a670a7b21ed9b6046b5d2560e4a7,IBM,2024-07-31 09:46:00
INTC,neutral,"The article does not provide any specific information about Intel's performance or outlook in the data center GPU market, so the sentiment is neutral.",70c3b586e879df9e07ccc1d088765dcae440a670a7b21ed9b6046b5d2560e4a7,IBM,2024-07-31 09:46:00
MU,neutral,"The company is listed as one of the key players in the data center GPU market, but no further details are given about its market position or growth prospects.",70c3b586e879df9e07ccc1d088765dcae440a670a7b21ed9b6046b5d2560e4a7,IBM,2024-07-31 09:46:00
MSFT,positive,"The article highlights the growing use of data center GPUs in cloud computing, which suggests that companies like Microsoft, a leading cloud service provider, could benefit from this trend.",70c3b586e879df9e07ccc1d088765dcae440a670a7b21ed9b6046b5d2560e4a7,IBM,2024-07-31 09:46:00
NVDA,positive,"As a leading manufacturer of GPUs, NVIDIA is likely to be a major beneficiary of the growth in the data center GPU market, as the article mentions ongoing innovations in GPU technology as a key driver of market growth.",70c3b586e879df9e07ccc1d088765dcae440a670a7b21ed9b6046b5d2560e4a7,IBM,2024-07-31 09:46:00
UPLD,neutral,"The article presents a mixed outlook for Upland Software's Q2 2024 results. While the company expects a decline in total revenues, its performance is likely to have benefited from increased customer acquisitions and successful AI integrations, as well as partnerships with IBM and Salesforce.",916589b097522a5e80b357275f7efb7ba16a9b9a0ebc450944d376964d46be78,IBM,2024-07-30 16:28:00
IBM,positive,"The article mentions that Upland Software's partnership with IBM WatsonX is expected to enhance product capabilities and attract enterprise customers, which is a positive development for IBM.",916589b097522a5e80b357275f7efb7ba16a9b9a0ebc450944d376964d46be78,IBM,2024-07-30 16:28:00
CRM,positive,"The article states that Upland Software's partnership with Salesforce for AI-driven solutions is expected to enhance product capabilities and attract enterprise customers, which is a positive for Salesforce.",916589b097522a5e80b357275f7efb7ba16a9b9a0ebc450944d376964d46be78,IBM,2024-07-30 16:28:00
SHOP,positive,"The article suggests that Shopify has a positive Earnings ESP and a Zacks Rank #1, which increases the odds of an earnings beat, making it a stock worth considering.",916589b097522a5e80b357275f7efb7ba16a9b9a0ebc450944d376964d46be78,IBM,2024-07-30 16:28:00
IBM,positive,"IBM is mentioned as one of the key players in the threat hunting market, indicating its strong presence and capabilities in this growing industry.",5070ebca25c2463a0ee6659e16aafc2d1a10e5f8550e19f147b04e28e4d21d3e,IBM,2024-07-29 14:00:00
CGEMY,positive,"Capgemini is identified as a leading player in the threat hunting market, highlighting its position as a major provider of threat hunting solutions and services.",5070ebca25c2463a0ee6659e16aafc2d1a10e5f8550e19f147b04e28e4d21d3e,IBM,2024-07-29 14:00:00
CRWD,positive,"CrowdStrike is mentioned as one of the top companies in the threat hunting market, indicating its strong market presence and capabilities in this growing industry.",5070ebca25c2463a0ee6659e16aafc2d1a10e5f8550e19f147b04e28e4d21d3e,IBM,2024-07-29 14:00:00
GOOG,positive,"Alphabet is seen as a bargain despite the rise of generative AI, as it has a long history of AI innovation, a large cash hoard, and is investing heavily to remain competitive in the field.",34a7b57bced0f11e60ae69f94df6bd2064e8c25ac8a014a61eae3e41dd0655b9,IBM,2024-07-29 12:30:00
GOOGL,positive,"Alphabet is seen as a bargain despite the rise of generative AI, as it has a long history of AI innovation, a large cash hoard, and is investing heavily to remain competitive in the field.",34a7b57bced0f11e60ae69f94df6bd2064e8c25ac8a014a61eae3e41dd0655b9,IBM,2024-07-29 12:30:00
QCOM,positive,"Qualcomm is positioned to benefit from the growing demand for AI-capable chipsets in the smartphone market, and has also diversified into other areas like IoT and PCs.",34a7b57bced0f11e60ae69f94df6bd2064e8c25ac8a014a61eae3e41dd0655b9,IBM,2024-07-29 12:30:00
IBM,positive,"IBM has reinvented itself as a cloud and AI company through its acquisition of Red Hat, and offers a attractive dividend yield, making it a value proposition for investors.",34a7b57bced0f11e60ae69f94df6bd2064e8c25ac8a014a61eae3e41dd0655b9,IBM,2024-07-29 12:30:00
AMZN,positive,"The article highlights Amazon as a strong long-term investment option due to its cross-sector muscle, constant innovation, and potential for international growth. It suggests that Amazon could help investors achieve their millionaire goals over the long run.",71805660e1b19fe1e3c956b34d94cefc6ec1cdc5887cbaaade95314642083dc6,IBM,2024-07-28 15:09:00
GOOG,positive,"The article mentions Alphabet (Google) as another tech giant with a strong track record and the ability to adapt to market changes, suggesting it could be a good long-term investment.",71805660e1b19fe1e3c956b34d94cefc6ec1cdc5887cbaaade95314642083dc6,IBM,2024-07-28 15:09:00
GOOGL,positive,"The article mentions Alphabet (Google) as another tech giant with a strong track record and the ability to adapt to market changes, suggesting it could be a good long-term investment.",71805660e1b19fe1e3c956b34d94cefc6ec1cdc5887cbaaade95314642083dc6,IBM,2024-07-28 15:09:00
AAPL,positive,"The article notes that Apple may be able to find a successor to the iPhone, indicating its potential for long-term growth and durability.",71805660e1b19fe1e3c956b34d94cefc6ec1cdc5887cbaaade95314642083dc6,IBM,2024-07-28 15:09:00
IBM,positive,"The article suggests that IBM, with its ability to adapt to market changes for over a century, could be a long-lasting investment option.",71805660e1b19fe1e3c956b34d94cefc6ec1cdc5887cbaaade95314642083dc6,IBM,2024-07-28 15:09:00
HON,positive,The company is a major provider of airport information systems and is well-positioned to benefit from the market growth.,f5e316d2ef9bd4e5a251aab614b586fb60cc0705a6a30dbade2f2a7ec915ce6b,IBM,2024-07-26 07:30:00
AMADY,positive,The company is a leading provider of airport information systems and is expected to contribute to the market's expansion.,f5e316d2ef9bd4e5a251aab614b586fb60cc0705a6a30dbade2f2a7ec915ce6b,IBM,2024-07-26 07:30:00
RTX,positive,The company is a key player in the airport information systems market and is expected to contribute to the market's expansion.,f5e316d2ef9bd4e5a251aab614b586fb60cc0705a6a30dbade2f2a7ec915ce6b,IBM,2024-07-26 07:30:00
ISMAY,positive,The company is a leading provider of airport information systems and is well-positioned to capitalize on the market growth.,f5e316d2ef9bd4e5a251aab614b586fb60cc0705a6a30dbade2f2a7ec915ce6b,IBM,2024-07-26 07:30:00
IBM,positive,The company is a major system integrator in the airport information systems market and is expected to benefit from the market's growth.,f5e316d2ef9bd4e5a251aab614b586fb60cc0705a6a30dbade2f2a7ec915ce6b,IBM,2024-07-26 07:30:00
DTEGY,positive,The company is a major player in the airport information systems market and is well-positioned to capitalize on the market's growth.,f5e316d2ef9bd4e5a251aab614b586fb60cc0705a6a30dbade2f2a7ec915ce6b,IBM,2024-07-26 07:30:00
THLLY,positive,The company is a major supplier of airport information systems and is likely to benefit from the market growth.,f5e316d2ef9bd4e5a251aab614b586fb60cc0705a6a30dbade2f2a7ec915ce6b,IBM,2024-07-26 07:30:00
SIEGY,positive,The company is a leading provider of airport information systems and is expected to contribute to the market's expansion.,f5e316d2ef9bd4e5a251aab614b586fb60cc0705a6a30dbade2f2a7ec915ce6b,IBM,2024-07-26 07:30:00
WDAY,positive,"Workday has introduced cutting-edge skills technology that allows organizations to easily and securely import and export skills data within the Workday platform, indicating their focus on innovation and improving talent management capabilities.",7267e31b7a8937f715e2cdd3840ed71a1fbfd082ae574948612e95da8efd33ed,IBM,2024-07-22 17:57:08
IBM,positive,"IBM is a major player in the talent management software market, contributing to the market's dominance in North America.",7267e31b7a8937f715e2cdd3840ed71a1fbfd082ae574948612e95da8efd33ed,IBM,2024-07-22 17:57:08
ORCL,positive,"Oracle has announced a new AI-powered upskilling solution within Oracle Grow, part of the Oracle ME employee experience platform, indicating their focus on leveraging technology to enhance talent management.",7267e31b7a8937f715e2cdd3840ed71a1fbfd082ae574948612e95da8efd33ed,IBM,2024-07-22 17:57:08
IBM,neutral,"The article presents a mixed outlook for IBM's software segment, with potential weakness in the hybrid platform & solutions business but also positive factors like product innovation and the growth of watsonx.ai. The acquisition of HashiCorp is seen as a positive for the company's hybrid multi-cloud strategy.",19cc5497b2e121f8f883441863c9a63ad64f2242ad9936d81b476aa6d6f0b61e,IBM,2024-07-22 15:52:15
GLW,positive,"The article mentions Corning Incorporated as a company that is expected to post an earnings beat, based on the combination of a positive Earnings ESP and a Zacks Rank #1 (Strong Buy).",19cc5497b2e121f8f883441863c9a63ad64f2242ad9936d81b476aa6d6f0b61e,IBM,2024-07-22 15:52:15
SIMO,positive,"The article mentions Silicon Motion Technology Corporation as a company that is expected to post an earnings beat, based on the combination of a positive Earnings ESP and a Zacks Rank #2 (Buy).",19cc5497b2e121f8f883441863c9a63ad64f2242ad9936d81b476aa6d6f0b61e,IBM,2024-07-22 15:52:15
META,positive,"The article mentions Meta Platforms, Inc. as a company that is expected to post an earnings beat, based on the combination of a positive Earnings ESP and a Zacks Rank #3 (Hold).",19cc5497b2e121f8f883441863c9a63ad64f2242ad9936d81b476aa6d6f0b61e,IBM,2024-07-22 15:52:15
NOW,positive,"The article highlights ServiceNow's strong performance, with expectations of continued growth in subscription revenues and traction in its GenAI offerings. The company's partnerships with tech giants like Microsoft, NVIDIA, and IBM are also seen as positive factors.",dbbddff9b21dda9f1e6b6f4b412ef660c21e2552e8527d10de5e1793c0451de2,IBM,2024-07-22 13:00:58
MSFT,positive,"The article mentions ServiceNow's partnership with Microsoft, which is integrating ServiceNow's Now Assist and Microsoft Copilot, indicating a positive collaboration between the two companies.",dbbddff9b21dda9f1e6b6f4b412ef660c21e2552e8527d10de5e1793c0451de2,IBM,2024-07-22 13:00:58
NVDA,positive,"ServiceNow is leveraging NVIDIA's Avatar Cloud Engine technologies to enhance its GenAI capabilities, suggesting a beneficial partnership.",dbbddff9b21dda9f1e6b6f4b412ef660c21e2552e8527d10de5e1793c0451de2,IBM,2024-07-22 13:00:58
IBM,positive,"ServiceNow is combining its Now Platform with IBM watsonx to boost productivity for mutual customers and partners, indicating a positive collaboration.",dbbddff9b21dda9f1e6b6f4b412ef660c21e2552e8527d10de5e1793c0451de2,IBM,2024-07-22 13:00:58
TSLA,positive,"Tesla is set to report earnings, which could help tech stocks reclaim the spotlight.",12d69683165767e47120d3b6bbfba585704b49c535ab4f12de1c247061bd3765,IBM,2024-07-21 21:31:02
GOOG,positive,"Alphabet (Google's parent company) is set to report earnings, which could help tech stocks reclaim the spotlight.",12d69683165767e47120d3b6bbfba585704b49c535ab4f12de1c247061bd3765,IBM,2024-07-21 21:31:02
GOOGL,positive,"Alphabet (Google's parent company) is set to report earnings, which could help tech stocks reclaim the spotlight.",12d69683165767e47120d3b6bbfba585704b49c535ab4f12de1c247061bd3765,IBM,2024-07-21 21:31:02
IBM,neutral,"IBM is set to report earnings, which is of interest to investors.",12d69683165767e47120d3b6bbfba585704b49c535ab4f12de1c247061bd3765,IBM,2024-07-21 21:31:02
F,neutral,"Ford is set to report earnings, which is of interest to investors.",12d69683165767e47120d3b6bbfba585704b49c535ab4f12de1c247061bd3765,IBM,2024-07-21 21:31:02
FpB,neutral,"Ford is set to report earnings, which is of interest to investors.",12d69683165767e47120d3b6bbfba585704b49c535ab4f12de1c247061bd3765,IBM,2024-07-21 21:31:02
FpC,neutral,"Ford is set to report earnings, which is of interest to investors.",12d69683165767e47120d3b6bbfba585704b49c535ab4f12de1c247061bd3765,IBM,2024-07-21 21:31:02
FpD,neutral,"Ford is set to report earnings, which is of interest to investors.",12d69683165767e47120d3b6bbfba585704b49c535ab4f12de1c247061bd3765,IBM,2024-07-21 21:31:02
GM,neutral,"General Motors is set to report earnings, which is of interest to investors.",12d69683165767e47120d3b6bbfba585704b49c535ab4f12de1c247061bd3765,IBM,2024-07-21 21:31:02
DB,neutral,"Deutsche Bank is set to report earnings, which is of interest to investors as the European banking sector faces a reality check.",12d69683165767e47120d3b6bbfba585704b49c535ab4f12de1c247061bd3765,IBM,2024-07-21 21:31:02
DGP,neutral,"Deutsche Bank is set to report earnings, which is of interest to investors as the European banking sector faces a reality check.",12d69683165767e47120d3b6bbfba585704b49c535ab4f12de1c247061bd3765,IBM,2024-07-21 21:31:02
DGZ,neutral,"Deutsche Bank is set to report earnings, which is of interest to investors as the European banking sector faces a reality check.",12d69683165767e47120d3b6bbfba585704b49c535ab4f12de1c247061bd3765,IBM,2024-07-21 21:31:02
DZZ,neutral,"Deutsche Bank is set to report earnings, which is of interest to investors as the European banking sector faces a reality check.",12d69683165767e47120d3b6bbfba585704b49c535ab4f12de1c247061bd3765,IBM,2024-07-21 21:31:02
TLT,neutral,"Deutsche Bank is set to report earnings, which is of interest to investors as the European banking sector faces a reality check.",12d69683165767e47120d3b6bbfba585704b49c535ab4f12de1c247061bd3765,IBM,2024-07-21 21:31:02
BNPQY,neutral,"BNP Paribas is set to report earnings, which is of interest to investors as the European banking sector faces a reality check.",12d69683165767e47120d3b6bbfba585704b49c535ab4f12de1c247061bd3765,IBM,2024-07-21 21:31:02
SAN,neutral,"Banco Santander is set to report earnings, which is of interest to investors as the European banking sector faces a reality check.",12d69683165767e47120d3b6bbfba585704b49c535ab4f12de1c247061bd3765,IBM,2024-07-21 21:31:02
LYG,neutral,"Lloyds Banking Group is set to report earnings, which is of interest to investors as the European banking sector faces a reality check.",12d69683165767e47120d3b6bbfba585704b49c535ab4f12de1c247061bd3765,IBM,2024-07-21 21:31:02
UNCRY,neutral,"UniCredit is set to report earnings, which is of interest to investors as the European banking sector faces a reality check.",12d69683165767e47120d3b6bbfba585704b49c535ab4f12de1c247061bd3765,IBM,2024-07-21 21:31:02
TSLA,positive,"Tesla is set to report earnings, which could help tech stocks reclaim the spotlight.",cc2303c31300051ae0593a91cbd194df46e6dc9968436ff12fca8ceb4565ed0b,IBM,2024-07-21 18:00:33
GOOG,positive,"Alphabet (Google's parent company) is set to report earnings, which could help tech stocks reclaim the spotlight.",cc2303c31300051ae0593a91cbd194df46e6dc9968436ff12fca8ceb4565ed0b,IBM,2024-07-21 18:00:33
GOOGL,positive,"Alphabet (Google's parent company) is set to report earnings, which could help tech stocks reclaim the spotlight.",cc2303c31300051ae0593a91cbd194df46e6dc9968436ff12fca8ceb4565ed0b,IBM,2024-07-21 18:00:33
IBM,neutral,"IBM is set to report earnings, which will be closely watched by investors.",cc2303c31300051ae0593a91cbd194df46e6dc9968436ff12fca8ceb4565ed0b,IBM,2024-07-21 18:00:33
F,neutral,"Ford is set to report earnings, which will be closely watched by investors.",cc2303c31300051ae0593a91cbd194df46e6dc9968436ff12fca8ceb4565ed0b,IBM,2024-07-21 18:00:33
FpB,neutral,"Ford is set to report earnings, which will be closely watched by investors.",cc2303c31300051ae0593a91cbd194df46e6dc9968436ff12fca8ceb4565ed0b,IBM,2024-07-21 18:00:33
FpC,neutral,"Ford is set to report earnings, which will be closely watched by investors.",cc2303c31300051ae0593a91cbd194df46e6dc9968436ff12fca8ceb4565ed0b,IBM,2024-07-21 18:00:33
FpD,neutral,"Ford is set to report earnings, which will be closely watched by investors.",cc2303c31300051ae0593a91cbd194df46e6dc9968436ff12fca8ceb4565ed0b,IBM,2024-07-21 18:00:33
GM,neutral,"General Motors is set to report earnings, which will be closely watched by investors.",cc2303c31300051ae0593a91cbd194df46e6dc9968436ff12fca8ceb4565ed0b,IBM,2024-07-21 18:00:33
DB,neutral,"Deutsche Bank is set to report earnings, which will be closely watched by investors as the European banking sector faces a reality check.",cc2303c31300051ae0593a91cbd194df46e6dc9968436ff12fca8ceb4565ed0b,IBM,2024-07-21 18:00:33
DGP,neutral,"Deutsche Bank is set to report earnings, which will be closely watched by investors as the European banking sector faces a reality check.",cc2303c31300051ae0593a91cbd194df46e6dc9968436ff12fca8ceb4565ed0b,IBM,2024-07-21 18:00:33
DGZ,neutral,"Deutsche Bank is set to report earnings, which will be closely watched by investors as the European banking sector faces a reality check.",cc2303c31300051ae0593a91cbd194df46e6dc9968436ff12fca8ceb4565ed0b,IBM,2024-07-21 18:00:33
DZZ,neutral,"Deutsche Bank is set to report earnings, which will be closely watched by investors as the European banking sector faces a reality check.",cc2303c31300051ae0593a91cbd194df46e6dc9968436ff12fca8ceb4565ed0b,IBM,2024-07-21 18:00:33
TLT,neutral,"Deutsche Bank is set to report earnings, which will be closely watched by investors as the European banking sector faces a reality check.",cc2303c31300051ae0593a91cbd194df46e6dc9968436ff12fca8ceb4565ed0b,IBM,2024-07-21 18:00:33
BNPQY,neutral,"BNP Paribas is set to report earnings, which will be closely watched by investors as the European banking sector faces a reality check.",cc2303c31300051ae0593a91cbd194df46e6dc9968436ff12fca8ceb4565ed0b,IBM,2024-07-21 18:00:33
SAN,neutral,"Banco Santander is set to report earnings, which will be closely watched by investors as the European banking sector faces a reality check.",cc2303c31300051ae0593a91cbd194df46e6dc9968436ff12fca8ceb4565ed0b,IBM,2024-07-21 18:00:33
LYG,neutral,"Lloyds Banking Group is set to report earnings, which will be closely watched by investors as the European banking sector faces a reality check.",cc2303c31300051ae0593a91cbd194df46e6dc9968436ff12fca8ceb4565ed0b,IBM,2024-07-21 18:00:33
UNCRY,neutral,"UniCredit is set to report earnings, which will be closely watched by investors as the European banking sector faces a reality check.",cc2303c31300051ae0593a91cbd194df46e6dc9968436ff12fca8ceb4565ed0b,IBM,2024-07-21 18:00:33
IBM,positive,"The article highlights IBM's strengths in the AI market, including its focus on responsible AI, its thriving consulting business, and its strong partnerships. It also notes IBM's compelling valuation and consistent outperformance of the S&P 500 over the past year.",d5d5a4df0627847891ed3ee0a0b661fec5d890d08268b4f65e2d630303538257,IBM,2024-07-20 11:47:00
GOOG,neutral,"The article mentions that IBM's Mistral Large AI model is comparable to Alphabet's Gemini system, but does not provide any further details or commentary on Alphabet.",d5d5a4df0627847891ed3ee0a0b661fec5d890d08268b4f65e2d630303538257,IBM,2024-07-20 11:47:00
GOOGL,neutral,"The article mentions that IBM's Mistral Large AI model is comparable to Alphabet's Gemini system, but does not provide any further details or commentary on Alphabet.",d5d5a4df0627847891ed3ee0a0b661fec5d890d08268b4f65e2d630303538257,IBM,2024-07-20 11:47:00
