ticker,sentiment,sentiment_reasoning,news_id,source_ticker,time
IBM,positive,"The article mentions that strategic partnerships with global tech leaders, such as IBM, play a pivotal role in accelerating AI adoption in Saudi Arabia's manufacturing sector.",223db7c16f87d71b24bf8e21128fed757257aff41d68fe7002a8b07818c29a76,IBM,2024-09-23 14:57:00
AMZN,positive,"The article mentions that strategic partnerships with global tech leaders, such as Amazon, play a pivotal role in accelerating AI adoption in Saudi Arabia's manufacturing sector.",223db7c16f87d71b24bf8e21128fed757257aff41d68fe7002a8b07818c29a76,IBM,2024-09-23 14:57:00
GOOG,positive,"The article mentions that strategic partnerships with global tech leaders, such as Google, play a pivotal role in accelerating AI adoption in Saudi Arabia's manufacturing sector.",223db7c16f87d71b24bf8e21128fed757257aff41d68fe7002a8b07818c29a76,IBM,2024-09-23 14:57:00
NVDA,neutral,The author acknowledges Nvidia's leading position in the AI chip market but is cautious about the stock's rich valuation and potential competition from other chip makers.,76bd0b2de30a09546503efebaeb7e851d4a474873c58d880c37d90810d3ce80e,IBM,2024-09-21 15:09:00
AMD,positive,"The author highlights AMD's Instinct series of AI accelerators as a potential competitor to Nvidia, offering comparable performance at a lower price.",76bd0b2de30a09546503efebaeb7e851d4a474873c58d880c37d90810d3ce80e,IBM,2024-09-21 15:09:00
INTC,positive,"The author notes Intel's Gaudi 3 AI accelerator as a competitor to Nvidia, with advantages in power efficiency and cooling requirements.",76bd0b2de30a09546503efebaeb7e851d4a474873c58d880c37d90810d3ce80e,IBM,2024-09-21 15:09:00
IBM,positive,"The author mentions IBM's Spyre AI accelerator, which is designed to add AI features to mainframe servers, as a potential competitor to Nvidia.",76bd0b2de30a09546503efebaeb7e851d4a474873c58d880c37d90810d3ce80e,IBM,2024-09-21 15:09:00
QCOM,positive,"The author highlights Qualcomm's efforts to build AI accelerators into its mobile processors, which could compete with Nvidia's cloud-based offerings.",76bd0b2de30a09546503efebaeb7e851d4a474873c58d880c37d90810d3ce80e,IBM,2024-09-21 15:09:00
SOUN,negative,"SoundHound may not be able to invest as aggressively in R&D as its larger competitors due to capital constraints, putting it at a disadvantage as the big tech giants increase their AI spending even further with the lower rates.",6c37d2d2f52119e350198cfc35b3b623ef585af9899bf815767122df84803967,IBM,2024-09-21 14:20:00
SOUNW,negative,"SoundHound may not be able to invest as aggressively in R&D as its larger competitors due to capital constraints, putting it at a disadvantage as the big tech giants increase their AI spending even further with the lower rates.",6c37d2d2f52119e350198cfc35b3b623ef585af9899bf815767122df84803967,IBM,2024-09-21 14:20:00
IBM,positive,"IBM has been increasing its R&D spending on AI by around 8% since the start of 2022, indicating its willingness to invest aggressively in the technology even with higher rates.",6c37d2d2f52119e350198cfc35b3b623ef585af9899bf815767122df84803967,IBM,2024-09-21 14:20:00
AAPL,positive,"Apple has increased its R&D spending on AI by 28% since the start of 2022, demonstrating its focus on investing in the technology.",6c37d2d2f52119e350198cfc35b3b623ef585af9899bf815767122df84803967,IBM,2024-09-21 14:20:00
SIEGY,positive,"The article includes Siemens AG as one of the key players in the Saudi Arabia Industry 4.0 market, indicating the company's presence and potential to benefit from the growth of this market.",32546f103195c971d57c8db439de02775fc5a91620a0185e6de8b1192909e125,IBM,2024-09-20 10:51:00
SBGSY,positive,"The article lists Schneider Electric SE as one of the key players in the Saudi Arabia Industry 4.0 market, indicating the company's participation and potential to benefit from the growth of this market.",32546f103195c971d57c8db439de02775fc5a91620a0185e6de8b1192909e125,IBM,2024-09-20 10:51:00
HON,positive,"The article includes Honeywell International Inc. as one of the key players in the Saudi Arabia Industry 4.0 market, suggesting the company's involvement and potential to capitalize on the market's expansion.",32546f103195c971d57c8db439de02775fc5a91620a0185e6de8b1192909e125,IBM,2024-09-20 10:51:00
YOKEY,positive,"The article mentions Yokogawa Electric Corporation as one of the key players in the Saudi Arabia Industry 4.0 market, indicating the company's presence and potential to benefit from the growth of this market.",32546f103195c971d57c8db439de02775fc5a91620a0185e6de8b1192909e125,IBM,2024-09-20 10:51:00
IBM,positive,"The article lists IBM Corporation as one of the key players in the Saudi Arabia Industry 4.0 market, suggesting the company's involvement and potential to capitalize on the market's expansion.",32546f103195c971d57c8db439de02775fc5a91620a0185e6de8b1192909e125,IBM,2024-09-20 10:51:00
CSCO,positive,"The article includes Cisco Systems, Inc. as one of the key players in the Saudi Arabia Industry 4.0 market, indicating the company's participation and potential to benefit from the growth of this market.",32546f103195c971d57c8db439de02775fc5a91620a0185e6de8b1192909e125,IBM,2024-09-20 10:51:00
ROK,positive,"The article mentions Rockwell Automation Inc. as one of the key players in the Saudi Arabia Industry 4.0 market, suggesting the company's involvement and potential to capitalize on the market's expansion.",32546f103195c971d57c8db439de02775fc5a91620a0185e6de8b1192909e125,IBM,2024-09-20 10:51:00
ABBNY,positive,"The article mentions ABB Ltd. as one of the key players in the Saudi Arabia Industry 4.0 market, suggesting the company's involvement and potential to capitalize on the market's expansion.",32546f103195c971d57c8db439de02775fc5a91620a0185e6de8b1192909e125,IBM,2024-09-20 10:51:00
MSFT,positive,"Microsoft is mentioned as one of the prominent players in the healthcare cloud computing market, indicating its strong presence and potential to benefit from the market growth.",bfd4cc784b0daf805de7c889025cdcd915604492041e186ee257ecccad8dcd4c,IBM,2024-09-19 12:30:00
IBM,positive,"IBM is also listed as a prominent player in the healthcare cloud computing market, suggesting its involvement and potential to capitalize on the market opportunities.",bfd4cc784b0daf805de7c889025cdcd915604492041e186ee257ecccad8dcd4c,IBM,2024-09-19 12:30:00
ORCL,positive,"Oracle is identified as one of the leading companies in the healthcare cloud computing market, implying its competitive position and ability to contribute to the market's expansion.",bfd4cc784b0daf805de7c889025cdcd915604492041e186ee257ecccad8dcd4c,IBM,2024-09-19 12:30:00
AMZN,positive,"Amazon Web Services is mentioned as a prominent player in the healthcare cloud computing market, indicating its significant presence and potential to benefit from the market growth.",bfd4cc784b0daf805de7c889025cdcd915604492041e186ee257ecccad8dcd4c,IBM,2024-09-19 12:30:00
GEHC,positive,"GE Healthcare is listed as one of the prominent players in the healthcare cloud computing market, suggesting its involvement and potential to capitalize on the market opportunities.",bfd4cc784b0daf805de7c889025cdcd915604492041e186ee257ecccad8dcd4c,IBM,2024-09-19 12:30:00
BABA,positive,"Alibaba Cloud is mentioned as a prominent player in the healthcare cloud computing market, indicating its significant presence and potential to benefit from the market growth.",bfd4cc784b0daf805de7c889025cdcd915604492041e186ee257ecccad8dcd4c,IBM,2024-09-19 12:30:00
GOOG,positive,"Google Cloud Platform is listed as one of the prominent players in the healthcare cloud computing market, suggesting its involvement and potential to capitalize on the market opportunities.",bfd4cc784b0daf805de7c889025cdcd915604492041e186ee257ecccad8dcd4c,IBM,2024-09-19 12:30:00
GOOGL,positive,"Google Cloud Platform is listed as one of the prominent players in the healthcare cloud computing market, suggesting its involvement and potential to capitalize on the market opportunities.",bfd4cc784b0daf805de7c889025cdcd915604492041e186ee257ecccad8dcd4c,IBM,2024-09-19 12:30:00
DELL,positive,"Dell is identified as a prominent player in the healthcare cloud computing market, implying its competitive position and ability to contribute to the market's expansion.",bfd4cc784b0daf805de7c889025cdcd915604492041e186ee257ecccad8dcd4c,IBM,2024-09-19 12:30:00
IBM,positive,"The article mentions IBM as one of the major players in the explainable AI market, indicating their strong presence and potential to benefit from the market growth.",be7314275b53a47ef203848eb24128e198760e0ab08df9ce4f2c0214d58d7fdc,IBM,2024-09-19 06:27:00
MSFT,positive,"The article lists Microsoft as a key player in the explainable AI market, suggesting their involvement and potential to capitalize on the market opportunities.",be7314275b53a47ef203848eb24128e198760e0ab08df9ce4f2c0214d58d7fdc,IBM,2024-09-19 06:27:00
GOOG,positive,The inclusion of Google as a major player in the explainable AI market indicates their involvement and potential to benefit from the market growth.,be7314275b53a47ef203848eb24128e198760e0ab08df9ce4f2c0214d58d7fdc,IBM,2024-09-19 06:27:00
GOOGL,positive,The inclusion of Google as a major player in the explainable AI market indicates their involvement and potential to benefit from the market growth.,be7314275b53a47ef203848eb24128e198760e0ab08df9ce4f2c0214d58d7fdc,IBM,2024-09-19 06:27:00
INTC,positive,The inclusion of Intel as a major player in the explainable AI market suggests their involvement and potential to benefit from the market growth.,be7314275b53a47ef203848eb24128e198760e0ab08df9ce4f2c0214d58d7fdc,IBM,2024-09-19 06:27:00
AMZN,positive,The article's mention of AWS as a key player in the explainable AI market indicates their participation and potential to capitalize on the market opportunities.,be7314275b53a47ef203848eb24128e198760e0ab08df9ce4f2c0214d58d7fdc,IBM,2024-09-19 06:27:00
NVDA,positive,The inclusion of NVIDIA as a major player in the explainable AI market suggests their involvement and potential to benefit from the market growth.,be7314275b53a47ef203848eb24128e198760e0ab08df9ce4f2c0214d58d7fdc,IBM,2024-09-19 06:27:00
PATH,positive,"UiPath announced the launch of a new AI-powered RPA platform, enhancing capabilities for intelligent automation and process mining, indicating the company's focus on innovation and product development.",deed5cde4c4d5e3ced517e677d6cdff97863c7a9bbdc24ede1c2ac58497b7543,IBM,2024-09-18 15:54:00
PEGA,positive,"Pegasystems introduced a new hyperautomation suite combining RPA, AI, and machine learning to automate complex business processes, showcasing the company's efforts to develop advanced automation solutions.",deed5cde4c4d5e3ced517e677d6cdff97863c7a9bbdc24ede1c2ac58497b7543,IBM,2024-09-18 15:54:00
IBM,positive,"IBM acquired WDG Automation to expand its RPA and AI capabilities, strengthening its position in the hyperautomation market and indicating the company's focus on growth and innovation in this space.",deed5cde4c4d5e3ced517e677d6cdff97863c7a9bbdc24ede1c2ac58497b7543,IBM,2024-09-18 15:54:00
MSFT,positive,"Microsoft launched a new update to its Power Automate platform, featuring enhanced AI and machine learning integrations for improved automation workflows, demonstrating the company's commitment to enhancing its automation offerings.",deed5cde4c4d5e3ced517e677d6cdff97863c7a9bbdc24ede1c2ac58497b7543,IBM,2024-09-18 15:54:00
APPN,positive,"Appian announced the acquisition of Jidoka, a Spanish RPA vendor, to bolster its automation capabilities and expand its market presence in Europe, indicating the company's strategic focus on growth and expansion.",deed5cde4c4d5e3ced517e677d6cdff97863c7a9bbdc24ede1c2ac58497b7543,IBM,2024-09-18 15:54:00
NICE,positive,"NICE Systems introduced new AI-driven analytics features to its RPA platform, enabling better decision-making and process optimization, demonstrating the company's commitment to enhancing its automation capabilities.",deed5cde4c4d5e3ced517e677d6cdff97863c7a9bbdc24ede1c2ac58497b7543,IBM,2024-09-18 15:54:00
EQIX,positive,"The article mentions the growth of the colocation data center segment, which Equinix is a major player in.",6239ded3f8056fd72421074543960e87ab83be81d8c425ef074a829c6aeada65,IBM,2024-09-18 15:00:00
DLR,positive,"The article discusses the increasing demand for data centers, which would benefit Digital Realty as a leading data center REIT.",6239ded3f8056fd72421074543960e87ab83be81d8c425ef074a829c6aeada65,IBM,2024-09-18 15:00:00
DLRpJ,positive,"The article discusses the increasing demand for data centers, which would benefit Digital Realty as a leading data center REIT.",6239ded3f8056fd72421074543960e87ab83be81d8c425ef074a829c6aeada65,IBM,2024-09-18 15:00:00
DLRpK,positive,"The article discusses the increasing demand for data centers, which would benefit Digital Realty as a leading data center REIT.",6239ded3f8056fd72421074543960e87ab83be81d8c425ef074a829c6aeada65,IBM,2024-09-18 15:00:00
DLRpL,positive,"The article discusses the increasing demand for data centers, which would benefit Digital Realty as a leading data center REIT.",6239ded3f8056fd72421074543960e87ab83be81d8c425ef074a829c6aeada65,IBM,2024-09-18 15:00:00
GOOG,positive,"The article mentions the rising adoption of cloud services and advanced technologies like AI/ML, which would benefit tech giants like Google.",6239ded3f8056fd72421074543960e87ab83be81d8c425ef074a829c6aeada65,IBM,2024-09-18 15:00:00
GOOGL,positive,"The article mentions the rising adoption of cloud services and advanced technologies like AI/ML, which would benefit tech giants like Google.",6239ded3f8056fd72421074543960e87ab83be81d8c425ef074a829c6aeada65,IBM,2024-09-18 15:00:00
IBM,positive,"The article discusses the increasing demand for data center solutions, which would benefit enterprise IT providers like IBM.",6239ded3f8056fd72421074543960e87ab83be81d8c425ef074a829c6aeada65,IBM,2024-09-18 15:00:00
AMZN,positive,"The article highlights the growth of cloud computing, which would positively impact AWS as a leading cloud service provider.",6239ded3f8056fd72421074543960e87ab83be81d8c425ef074a829c6aeada65,IBM,2024-09-18 15:00:00
MSFT,positive,"The article mentions the rising adoption of cloud services and advanced technologies, which would benefit cloud providers like Microsoft.",6239ded3f8056fd72421074543960e87ab83be81d8c425ef074a829c6aeada65,IBM,2024-09-18 15:00:00
AMZN,positive,"The article highlights the growing adoption of generative AI in financial services, which could benefit companies like AWS that provide cloud-based AI solutions.",6b41508f6e341f0a9751cb3075d831f7c1058333474d2430edd28b239cb2d03a,IBM,2024-09-18 08:34:00
GOOG,positive,"The article mentions Google as one of the companies profiled in the report, indicating its presence in the generative AI in financial services market, which could be a growth opportunity for the company.",6b41508f6e341f0a9751cb3075d831f7c1058333474d2430edd28b239cb2d03a,IBM,2024-09-18 08:34:00
GOOGL,positive,"The article mentions Google as one of the companies profiled in the report, indicating its presence in the generative AI in financial services market, which could be a growth opportunity for the company.",6b41508f6e341f0a9751cb3075d831f7c1058333474d2430edd28b239cb2d03a,IBM,2024-09-18 08:34:00
IBM,positive,"The article highlights the growing adoption of generative AI in financial services, which could benefit companies like IBM that provide AI-based solutions to the industry.",6b41508f6e341f0a9751cb3075d831f7c1058333474d2430edd28b239cb2d03a,IBM,2024-09-18 08:34:00
INTC,positive,"The article mentions Intel as one of the companies profiled in the report, indicating its involvement in the generative AI in financial services market, which could be a growth opportunity for the company.",6b41508f6e341f0a9751cb3075d831f7c1058333474d2430edd28b239cb2d03a,IBM,2024-09-18 08:34:00
MA,positive,"The article highlights the growing adoption of generative AI in financial services, which could benefit companies like Mastercard that provide payment processing and other financial services.",6b41508f6e341f0a9751cb3075d831f7c1058333474d2430edd28b239cb2d03a,IBM,2024-09-18 08:34:00
MSFT,positive,"The article mentions Microsoft as one of the companies profiled in the report, indicating its presence in the generative AI in financial services market, which could be a growth opportunity for the company.",6b41508f6e341f0a9751cb3075d831f7c1058333474d2430edd28b239cb2d03a,IBM,2024-09-18 08:34:00
CRM,positive,"The article highlights the growing adoption of generative AI in financial services, which could benefit companies like Salesforce that provide customer relationship management and other enterprise software solutions.",6b41508f6e341f0a9751cb3075d831f7c1058333474d2430edd28b239cb2d03a,IBM,2024-09-18 08:34:00
SAP,positive,"The article mentions SAP as one of the companies profiled in the report, indicating its presence in the generative AI in financial services market, which could be a growth opportunity for the company.",6b41508f6e341f0a9751cb3075d831f7c1058333474d2430edd28b239cb2d03a,IBM,2024-09-18 08:34:00
MSFT,positive,"Microsoft is mentioned as one of the major players in the Cloud IAM market, indicating its strong presence and market leadership in this space.",b5200410377a37da44a7f10444c40ccce044c7ada0301dde712e1195c1e8afa7,IBM,2024-09-18 00:30:00
IBM,positive,"IBM is also mentioned as one of the major players in the Cloud IAM market, suggesting its significant market share and competitiveness in this industry.",b5200410377a37da44a7f10444c40ccce044c7ada0301dde712e1195c1e8afa7,IBM,2024-09-18 00:30:00
OKTA,positive,"Okta is mentioned as a company that is gaining traction in the Cloud IAM market by offering specialized and flexible IAM services, indicating its growth and competitiveness in the industry.",b5200410377a37da44a7f10444c40ccce044c7ada0301dde712e1195c1e8afa7,IBM,2024-09-18 00:30:00
ADBE,positive,"Adobe is mentioned as one of the key players in the team collaboration tools market, indicating its strong presence and potential growth opportunities in this space.",25deed0722bf857fd51ac2c0dfc2ff480dc207fb2d24bd9649def600bf0d2edf,IBM,2024-09-14 11:30:00
IBM,positive,"IBM Corporation is listed as one of the key players in the team collaboration tools market, suggesting its involvement and competitiveness in this growing industry.",25deed0722bf857fd51ac2c0dfc2ff480dc207fb2d24bd9649def600bf0d2edf,IBM,2024-09-14 11:30:00
ZM,positive,"Zoom Video Communications Inc. is identified as a key player in the team collaboration tools market, highlighting its prominent position and potential to benefit from the market's growth.",25deed0722bf857fd51ac2c0dfc2ff480dc207fb2d24bd9649def600bf0d2edf,IBM,2024-09-14 11:30:00
MSFT,positive,"Microsoft is mentioned as one of the leading collaboration tool providers, indicating its strong market presence and ability to capitalize on the increasing demand for team collaboration solutions.",25deed0722bf857fd51ac2c0dfc2ff480dc207fb2d24bd9649def600bf0d2edf,IBM,2024-09-14 11:30:00
GOOG,positive,"Google LLC is identified as one of the key players in the team collaboration tools market, highlighting its involvement and potential to benefit from the market's expansion.",25deed0722bf857fd51ac2c0dfc2ff480dc207fb2d24bd9649def600bf0d2edf,IBM,2024-09-14 11:30:00
GOOGL,positive,"Google LLC is identified as one of the key players in the team collaboration tools market, highlighting its involvement and potential to benefit from the market's expansion.",25deed0722bf857fd51ac2c0dfc2ff480dc207fb2d24bd9649def600bf0d2edf,IBM,2024-09-14 11:30:00
ASAN,positive,"Asana Inc. is mentioned as a key player in the team collaboration tools market, indicating its prominence and ability to capitalize on the growing demand for such solutions.",25deed0722bf857fd51ac2c0dfc2ff480dc207fb2d24bd9649def600bf0d2edf,IBM,2024-09-14 11:30:00
CSCO,positive,"Cisco Systems Inc. is listed as one of the key players in the team collaboration tools market, suggesting its strong position and potential to contribute to the market's growth.",25deed0722bf857fd51ac2c0dfc2ff480dc207fb2d24bd9649def600bf0d2edf,IBM,2024-09-14 11:30:00
ORCL,positive,"Oracle Corporation is mentioned as one of the key players in the team collaboration tools market, indicating its presence and ability to capitalize on the growing demand for such solutions.",25deed0722bf857fd51ac2c0dfc2ff480dc207fb2d24bd9649def600bf0d2edf,IBM,2024-09-14 11:30:00
MSFT,positive,"Microsoft is a key player in the CSP market, and the growing adoption of cloud solutions and digital transformation trends are likely to benefit the company.",ec5802ab03066916c9f0579e726a715feae66a24c5624d9f2a46b52e43b21332,IBM,2024-09-13 18:00:00
ADBE,positive,"Adobe's content management and collaboration tools are well-suited for the CSP market, and the company is likely to benefit from the industry's expansion.",ec5802ab03066916c9f0579e726a715feae66a24c5624d9f2a46b52e43b21332,IBM,2024-09-13 18:00:00
OTEX,positive,"OpenText is a leading provider of enterprise information management solutions, including CSP offerings, and the growing demand for such platforms is expected to positively impact the company.",ec5802ab03066916c9f0579e726a715feae66a24c5624d9f2a46b52e43b21332,IBM,2024-09-13 18:00:00
IBM,positive,IBM's expertise in enterprise software and cloud services positions the company well to capitalize on the growing CSP market.,ec5802ab03066916c9f0579e726a715feae66a24c5624d9f2a46b52e43b21332,IBM,2024-09-13 18:00:00
IBM,positive,"The article mentions IBM as one of the prominent players in the healthcare analytics market, indicating its strong presence and potential to benefit from the market growth.",0f63c0cd4a702c4edec46b23dd410f2958a167c85b8ffbf615cbedb10d674d65,IBM,2024-09-13 12:30:00
MSFT,positive,"Microsoft is mentioned as one of the prominent technology companies that Leilani Garrett has authored leadership pieces, infographics, and articles for, indicating her experience and expertise in the technology industry.",c27b13687cc8b177948bbdd35d27ed3a04d5673d03ad450edf8068a8126cbe85,IBM,2024-09-11 18:00:00
IBM,positive,"IBM is mentioned as one of the prominent technology companies that Leilani Garrett has authored leadership pieces, infographics, and articles for, indicating her experience and expertise in the technology industry.",c27b13687cc8b177948bbdd35d27ed3a04d5673d03ad450edf8068a8126cbe85,IBM,2024-09-11 18:00:00
MSFT,positive,"Microsoft is a leading player in the immersive analytics market, focusing on innovation and strategic initiatives to maintain its market position.",678a24dcf2410f615b47e8acf357af3da8135b29dd447bc97555f01d8b2495cf,IBM,2024-09-11 13:40:00
IBM,positive,"IBM's Watson platform leverages immersive analytics to enhance cognitive computing and data visualization, indicating the company's involvement in the market.",678a24dcf2410f615b47e8acf357af3da8135b29dd447bc97555f01d8b2495cf,IBM,2024-09-11 13:40:00
GOOG,positive,"Google is at the forefront of integrating immersive analytics capabilities into its big data platforms, demonstrating its commitment to the market.",678a24dcf2410f615b47e8acf357af3da8135b29dd447bc97555f01d8b2495cf,IBM,2024-09-11 13:40:00
GOOGL,positive,"Google is at the forefront of integrating immersive analytics capabilities into its big data platforms, demonstrating its commitment to the market.",678a24dcf2410f615b47e8acf357af3da8135b29dd447bc97555f01d8b2495cf,IBM,2024-09-11 13:40:00
CRM,positive,"Tableau has incorporated AR and VR capabilities into its data visualization platform, showcasing its adoption of immersive analytics.",678a24dcf2410f615b47e8acf357af3da8135b29dd447bc97555f01d8b2495cf,IBM,2024-09-11 13:40:00
DASTY,positive,"The company is mentioned as one of the key players in the immersive analytics market, indicating its involvement in the industry.",678a24dcf2410f615b47e8acf357af3da8135b29dd447bc97555f01d8b2495cf,IBM,2024-09-11 13:40:00
SAP,positive,"SAP is included as one of the key companies in the immersive analytics market, demonstrating its presence in the industry.",678a24dcf2410f615b47e8acf357af3da8135b29dd447bc97555f01d8b2495cf,IBM,2024-09-11 13:40:00
HPQ,positive,"HP is included as one of the key companies in the immersive analytics market, demonstrating its presence in the industry.",678a24dcf2410f615b47e8acf357af3da8135b29dd447bc97555f01d8b2495cf,IBM,2024-09-11 13:40:00
ACN,positive,"Accenture is listed as one of the key competitors in the immersive analytics market, suggesting its participation in the industry.",678a24dcf2410f615b47e8acf357af3da8135b29dd447bc97555f01d8b2495cf,IBM,2024-09-11 13:40:00
META,positive,"Meta (formerly Facebook) is mentioned as a key player in the immersive analytics market, indicating its involvement in the industry.",678a24dcf2410f615b47e8acf357af3da8135b29dd447bc97555f01d8b2495cf,IBM,2024-09-11 13:40:00
ORCL,positive,"Oracle is aggressively building out its cloud infrastructure with Nvidia GPUs to cater to the growing demand for AI services, which is driving significant revenue growth for the company.",94adffe1fe10b18ecdca1c555984bb3d2e3f0fd009c17241fdbc4667473acf9d,IBM,2024-09-11 11:20:00
IBM,positive,"IBM's consulting business is benefiting from Oracle's AI success, as IBM partners with Oracle and helps enterprises deploy and manage Oracle's AI-related services. This is driving significant business for IBM's consulting arm.",94adffe1fe10b18ecdca1c555984bb3d2e3f0fd009c17241fdbc4667473acf9d,IBM,2024-09-11 11:20:00
SAP,positive,"SAP SE is mentioned as one of the leading market players in the big data analytics market, indicating its strong presence and potential to benefit from the market growth.",9af181a633a6debf9ff6f4b500abded20707895c3658ff76312b00c4df59ceb1,IBM,2024-09-11 09:38:00
